start_year	end_year	File	Text
1659	1659	nyp.33433082429956-seq_0227.txt	12-15 OCTOBER.      311  schepen ter rhede Batavia comende om die te vercopen, daer van daen gehouden ende gejaecht wierden, jae, somtyts haer goet aen Onrust van de Chinesen wierden genonien, waerdoor sy beducht bleven, dat den eenen of den anderen Javaen, sulcx niet cunnende verdragen, daer door wel onlusten mochten komen te ontstaen, dat sv niet geerne by dese nieuwe vrede sagen; derhalven den Sultan aen den resident gelasten, derwegen aende Ede heer Gouverneur Generael op Batavia soude schryven om te vernemen, of de Javanen van Bantam nu niet so wel als voor desen hare eetwaren aen de schepen op Onrust ende Battavia mochten vercopen, als voor desen, waer op haer Ed antwoorde, t’syner tyt soude verwachten.  Van den Sousounangh Mataram was op Bantam een brief ende seven paerden lot schenckagie aen den Sultan gecomen; den brief hiell van beclach wegens eenige praeuwen van de Matarams volcq, by Kiey Arien staende den oorloch genomen ende door syn E. ’tvolck vervoert ende vercocht, tegens welcke pretentie den Bantammer segt niet te connen doen, also in gemelte tyt diverse praeuwen door die van Damack, Kiey Arien toebehorende, waren afgelopen, ’t welck soo bleeff staen’ sonder dat daer verder in gehandelt was; wat finael antwoort op haer vertreck stonden te becomen, souden trachten te vernemen.  D'Engelse vrunden hadden 2 dagen verleden groote aenloop van de Chinesen gehad om de betalingh van de peper, aen haer verkocht op de comste van haer schepen ; ende, also die noch niet quamen, begeerden voldoeningh; derhalven aen alle die Chinesen behoorlyck obligatie van haer schult hebben gepasseert, daer haer voor alsnoch mede tevreden houden; vorders deden die vrunden altans daer gene negolie, maer saten stil.  Nevens syn schryven op ’t galliot, Charlois, was een slaef van den balliu, Ambrosius van der Keer, oversendende, die op een middach met een droncken hooft in de logie gecomen was, seggende, hy na syn meester op Battavia wilde; sulex hem dan oock opstonts selfs, nevens een van syn slaven, met een cleen praeutien aen boort gebracht heeft ende den schipper in bewaringh gegeven.  Tot besluyt schreef mede, hoe een van de drie man, die by hem op Bantam in.de logie lagen, een keer naer Batavia hadden toegestaen te magen doen, om by haer Ed voor haer drien te versoecken eenige maenden verstreckinge op haer reeckeningh, die sy, soo meenden, wel van noden hadden; ende so syn schryven na groete afbrack ende besloot.  13 en 14 d’. is hier niet sonders gepasscert, dan alleen, dat de soldaten tot de aenstaende tocht wierden gecommandeert ende de provisien, oorlogs ammunitien met den aencleven van dien wierden afgescheept, alsmede ’t gene van hier voor Ceylon ende Malacca in den Achillis ende Sluys gescheept moet werden.  15 d’. wierden hier by haer Ede uyt de hier aenwesende krygsofficieren, die haren dienst tot de tocht naer Palembangh hadden gepresenteert, gecoren tot 15 comp, yder van 50 soldaten, dertien provisionele luytenants ende 15 tot provisionelevendrigs ende 26 provisionele sergeanten, blyvende de corporaels aen de E. van der Laen ende de fficieren gerecommandeert uyt de outste ende bequaemste gecommandeerde soldaten uyt te kiesen ende te stellen, soo vele als daer voor de 15 comp" sullen vereyst werden.  En                                             Original from Digitized by Google                           NEW YORK PUBLIC LIBRARY 
1659	1659	nyp.33433082429956-seq_0233.txt	29 OCTOBER.                              217  swarten met uytgetogen wapenen, brandende lonten, enterende onse logie off packhuys op een hostile wyse, hesetten de poort, vallende op ons volck, slaen ende verwonden ons opperhooft, coopluyden ende zeeluyden, alsdoen aen lant, roepende: sla doot, sla doot; ende hadden sonder twyffel vervallen geweest tot een generale moort, hadden niet de inboorlingen en Chinesen, residerende in onse onthoudinge, by tyts tot hare assistentie tusschen beyde gecomen, tot datter ontseth van den Coninck quam; desen niettegenstaende, evenwel soo roofden sy ende plunderden onse logie off packhuys ende dreychden alle uyren van haer te massacreren, als by de nevensgaende copye van haer protest tegens UEd. resident, etc. UE. kont verstaen ; wat wy alsnoch ons van dese proceduiren sullen duncken laten, weten wy niet, zynde onvergelyckelyck, uvytgenomen die van Amboina; wy verwachten beyde, recht ende voldoeninge; by aldien de twee natien niet tegen den anderen in oorloge weder en zyn geingajeert, soo en kan ons volck ons geene andere reden geven, als dese, dat meester Thomas Skinner vercocht hadde een partie amber off barnsteen, toebehorende synen broeder Fredrick, aen eenige van U volck aldaer, middelerwyle dat meester Lever in recht was om de middelen off goederen uyt syn handen te vorderen, welcke volgens syne boecken alhier wy bevinden te bedragen 155 catty tegen 14 realen van 8e" het catty, bedragende omtrent twee duysent rycxdaelders; welck amber off barnsteen vervoert zynde nae Johoor ende daer de Chinese joncken missende, soo wiert het wederom gevoert nar Jamby ende soude weder op Skinner geschoven geweest hebben door diegene, die het gekoft hadden, soo verre, dat men daerom begon te contesteren, hetwelck meester Lever ter ooren quam ende hy sochte dito by forme van recht te recouvreren, daer toe hy rede genoech hadde ende sy alsoo weynigh om na syn leven te staen; wy twyffelen niet, off UE. honnorable sal gemelte remoer ernstelyck gedachtigh zyn ende sullen exemplare straffe den autheuren desselffs opleggen, dat andere van diergelycke hier naermaels te begaen mogen afgeschrickt werden, bevelende UEde de bescherminge des Almachtigen; onderstont: verblyven UE. honnorables beminde vrunden ende dienaren, get. John Edwarts, Henry Page; ter-syden stont : Bantam '2),, Oct. 1659. De copye protest, door d’opperhooffden der Engelsen op Jamby aen ’t opperhooft  ende de verdere Comp' dienaren op Jamby schriftelyek in’t Engels gedaen ende in’t Nederlants overgeseth zynde, luyt, soo hier volght:  Naer dien m'. Pieter de Goyer, opperhooft van de Duytse gedon off logie in Jambe, ende syn seconde, m". Jonathan Claessen, met omtrent 40 blancke mannen ende 150 slaven off personen, gemelte de Goyer aengaende etc, op den 9e deser maent Augusty op een hostile en moorddadige wyse het honnorable Engelse Oostindische Comp gedon hebben gentert, gewapent met lanssen, crissen, rapieren, houwers, musquetten, etc. ende wacht, gehouden voor de poorte off inganck in gemelte Engels gedon, te besetten, op datter geen hulpe off assistentie soude konnen incomen van de inwoonders om haer te versekeren off ontsetten; welcke gemelte poorte ofte ingangh by haer alsoo  Original from  Digitized by Google                            NEW YORK PUBLIC LIBRARY 
1659	1659	nyp.33433082429956-seq_0019.txt	10 JANUARIUS                                  7  omsichtiger te gaen ende haer Ede ordre tot genoech doen punctuelicker naer komen; ondertusschen soude niet stil staen om den Bantammer alle mogelycke affbreuck te brengen.  Op den tweeden deser maent was ter bhare van Bantam, omtrent ’s Comp’ vlagge, ten ancker van Macasser over Jamby ende Japara gekomen ’t Engelse schip, den Dolphyn, synde een jaer voor dato op Batavia geweest, hebbende, volgens ’ voorgeven van gemelte schips opperhoofden, omtrent 4000 pical peper ende 150 picol suycker in, aldaer eenlyck door ’t hart weder gecomen ende was den 8' deser weder van daer naer Livorno vertrocken; inmiddels hadden d’opperhoofden deselve liherteyl als d'andere verleent, dat by verscliyninge van noch andere soo mede doen sonde, doch versekerden haer Ede, dat op derselver aff- ende aenvaren de geordonneerde ordre precys ende nauw soude achtervolght werden; soo hadde tot geleyde vande Dolphyn ’tjacht de Cat mede laten sevlen tot buyten de Straet.  De chaloup, d'Oester, nevens de 235 swarten, waren daer wel aengecomen ende vermeenden d’selve daer seer groote dienst, nevens d'andere, roeyende verdere chaloupen, te sullen doen, daer met d'eerste bequame gelegentheyt een preuve van soude laten nemen.  Drie dagen voor desselfs schryven waren eenige Chinesen met een vrede vlagge aen syn boort geweest met excusen uyt des Sulthans name, dat den tamboer niet gebracht hadden, die aen de Engelsen hadden gepresenteert om aen ons over te leveren, die ’tselve hadde geweygert, maer dat sy den selven tamboer binnen drie a vier dagen, inf welcken tyd den Sulthan. die alsdoen m:t 50 prauwen uyt vermeyen voer, weder thuys stont-te komen, aen syn boort soude brengen, dat vertrouwden maer uytvluchten waren, sulcx niet naer laten soude wel op hoede te blyven.  'T Engelse schip, den Draeck, maeckte preparatie om te seylen naer Jamby, doch was acht dagen uytgestelt, vermits deu gewesen agent, Skynner, by de Bantammers was gevlucht, omdat by de Engelsen uytgevonden was, dat desselfs aen haer gedane transport valsch was; watter nu van dit werck komen soude, stont den tyt te openbaren, dan scheenen d’Engelse seer bedwelmd ende verlegen te staen; vorders soude hy, Bastingh, niet mancqueren op den Draecks vertreck ’t selve met 2 bodems cen stuck te laten convoyeren, alsoo het een ledigen romp is ende wellicht, in plaetse van naer Jamby, naer Lampon, Anjer off anderwaerts, om ende by Bantam gelegen, mochte trachten te lopen om syn ladingh te becomen.  Gemelte Bastiugh was haer Ede bedanckende voor de gunste van dat syn persoon met het becleden der schone plaetse van't Molucxse gouverno hadden gelieven te versien, over sulex versochte, dat haer Ed belieffden syn persoon son lydich uyt ’tcommando van Bantam te verlossen, dat 8 10 dagen op Batavia tot reddinge van syn huyshoudinge mochte hebben.  Bastingh bleef voornemens op den dach syns schryvens de Chinesen van. Bantam te laten weten, dat op morgen volgens haer beloften den tamboer soude brengen, off dat anders wiste, wat met haer te doen hadde, hoe wel vertroude daer niet van volgen soude; hadde mede de Engelse vrunden gesproken ende gevraecht  Original from  Digitized by Google                            NEW YORK PUBLIC LIBRARY 
1659	1659	nyp.33433082429956-seq_0025.txt	20 ex 2 JANUARIUS.                        15  Intien Asem, verhalende, hoe den woedenden tyger in den tyt van twee maenden al veertien van syn volck uyt de houthackery hadde gehaelt ende verscheurt, sulcx syn volck haer daer in ’t bosch niet langer dorsten vertrouwen ende genootsaeckt waren geworden daer uyt te scheyden ende herwaerts te komen.  21 d’. In rade van Inda wiert op heden ’t vendu meesterschaps ampt deser stede opgedragen, onder andere sollicitanten, acn Cornelis Mol, secretaris van de weescamer alhier, alsoo hetselve ampt voor dato eenige jaren na den anderen hy syn, Mols, voorsaet, den secretaris Joan Trompert, is bedient ende waergenoimnen geweest.  Item het boode ampt van heeren Weesmeesteren alhier, in plaetse van vooren gemelten Mol, wert door haer welgemelte Ed den vryburger, Aernout Mennes van der Schell toegevoecht.                                       :  Den pachter van de basaarsilters, nevens derselver borgen, is by haer Ede heden in vergaderinge van India op hare ernstige vertoningen ende ootmocdige beede loegestaen maentelyx hondert ryexdaalders minder, dan die pacht gepacht hebben, te sullen betalen, dats, in plaetse van 700 realen, maer ses hondert realen sullen betalen, alsoo haer Ed gebleeken zy, dat den pacht maentlyex noch op verre naer d’selve ses hondert rycxdaalders boven de moeyte van de collecte niet can opbrengen.  De nieuwe gemaeckte cleede passer staende eerstdacchs volmaeckt te syn, is by haer Ede goetgevonden aen de cleden vercoopers voor dit jaer tot hondert slechte realen ’smaents in pacht te laten, ten aensien d’selve passer (haren lasten, buyten de materialen, die de Comp daer toe alle gegeven heeft, hebben doen opstellen.  Op heden syn mede by haer Ed geapprobeert de personen, by den eerw. kerckenrade alhier tot ouderlingen ende diaconen deser Christelycke gemeente beroepen, namentlyk:         -  Tot Ouderlingen, in plaets van de drie aflgegane ende  verlrochene, als daer zyn:  Alexander Heynen, baeskuyper, Nicolaes Oldenvliet, opperchirurgyn, Louis Isacsz Bassart, oppercoopman deses casteels, affgegaen, Mr. Adriaen Groenesteyn,  Jan van Hoesum ende  Nicolaes Hlouman,  beyde nae ’t patria vertrocken,  d'affgaende Diaconen zyn:  Mr. Andries Boogaert, Hans Wingler, Nicolaes Houman.  ende de gekoren:  Pieter Elmers, Thys Pietersz, ende Paulus Jansen, m". swaertveger deses casteels, die vermits den grooten  as            Original from Digitized by Google                            NEW YORK PUBLIC LIBRARY 
1659	1659	nyp.33433082429956-seq_0031.txt	26 Ex 27 JANUARIUS.                          15  van de gevangen chiampan gasten, die alle dagen noch al meer en meer clappen ende aenwysen.  Soo syn op heden van een andere chiampan mede gevath twee matroosen, de reste zynde gevlucht, die een cas quicksilver nu onlangs tusschen de rheede ende hier hy nacht gestolen ende verdanckert hebben.  27 d’. comt hier ter rheede ten ancker ’t gallot, Charlois, uyl de Bantamse besellinge, van daer mede brengende een brieff van den Ed. Bastingh, het commando ter besettinge aldaer becledende, meldende, hoe op den 18r deser maent aldaer de heseltinge waren gepasseert de retourschepen, Naerden ende Erasmus, nevens den geleyder, ’t jacht Bleemendael, ende aldaer ter besettinge gecomen ’t jacht, Koukercken, ende de chaloup, de Kreeft, waer mede haer Ed schryven hadden becomen, nevens den ingesloenen van den Engelsen agent, Mr. Edwards, die syn behoorlycke bestellinge hadde doen geven; de provisien, daer nevens voor de vloot gesonden, hadden wel becomen; soude sorge dragen de benodichde daervan behoorlyck versien werden ende yder syn portie bequam:           n  Belangende den Godverlochenden schelmsen tamboer, vertrouden die van Bantam noyt souden overgeven, hoe wel haer nu lieten verluyden die te sullen overgeven, wanneer de vrede tusschen haer ende ons ssesloten was; de Bantamse Chinesen hadden syn Ed. met een praeutie ende de witte vlagge gebracht een brieff in ’t Chinees, houdende aen Bingam, Chinees capiteyn alhier, die versochten te willen voort bestellen, dat hadde aengenomen, met eenen haer verbiedende sonder den tamboer niet weder aen boort te komen, alsoo haer geen gehoor soude verleent werden.  Soo was aldaer door de chaloup van de Kat, op den 13 deser, een tinangh met 4000 stucx oude clappussen genomen: de Javanen, die in ’t leven gebleven waren, waren’t aen ’tstrant ontvlucht; ende waren in ’t veroveren gebleven de kock ende den hoochbootsman, boven drie gequesten, alle hescheyden op gemelte (at.  Eyndelicken hadden de Engelse met ’tschip den Draeck zee gekosen ende waren na Jamby geseylt om aldaer een comptoir te stabileren, tot dien eynde mede nemende drie paerden ende andere behoeftigheden; de bodems, Leeuwinne ende de Kat, waren (selve tot buyten de Noorderwachter geleyden.  Op ’tvertreck van geseyde Engelsen Draeck waren alle de Engelse vrunden aen syn, Baslings, boort geweest, waeruyt onder andere discoursen gehoort hadde, dat het jongst van daer vertrocken schip, den Dolphyn,  droicture na Livorno was vertrocken; item, dat van den Solthan ende grooten op Bantam verstaen hadden, dat in eeuwicheyt geen vrede meer op Batavia souden versoucken ende dattet bun leet was sulcx voor desen gedaen hadden, doch dat den Sulthan wel genegen was in eeuwige vrede met die van Batavia te treden op die conditie, voor dato by d’heeren generael ende de raden van India ontworpen, wanneer de restitutie der beesten daer uyt gelaten wert ende dat de vrede voor Bantam: door wedersytse gecommitteerdens onder onse vlagge geschiede ende buyten dat niet, waer door zy, Engelsen, seyden, soo ten halven bleven sitten, sonder dat hare coopmanschappen conden vervoeren tot groote prejuditie van de Engelse Comp, die wel wisten,  et  as                         ’                     Original from Digitized by Google                            NEW YORK PUBLIC LIBRARY 
1659	1659	nyp.33433082429956-seq_0192.txt	176                          27- 29 AUGUSTUS.  om te pitcharen geseten hadden ende gesecht, niet wel conden vertrecken, voor ende aleer den Sultan de conditien der vrede hadde voldaen; daerop eyndelyck tot antwoort becomen hadde: wy hebben de slaven immers op vrye voeten gestelt; waerom halense de coopluyden van de Comp, die hier syn, niet wech, alsmede dat hy, Sultan, nader op het versochte soude letten, wanneer Symon Symonsen daer weder van hier soude keeren, dat hem, van Lier, also door den eersten gesant, Kiey Maes, inde logie, son stont om te vertrecken, aengesegt was; watter van was off komen soude, stont den tydt te openbaren, dan vertroude, daer weynich voor de Comp soude vallen.  D' Engelse vrunden aldaer liepen dagelicx seer tot al de grooten, voornamentlyck ten huyse van Kiey Arien, sulcx niet buyten bedencken stelden, sy al vry gestoockt hadden in die barsse antwoorde, van Kiey Arien becomen, wanneer seyde, wat doeje hier, als je geen coopmanschap dryft, als om alles te doorsien.  D'Engelsen hadden tegen den eersten assistent, die in ’s Comp logie legt ende Engels spreken kan, gesegt, clagender wyse, dat voor de vrede den peper, alle, die op Bantam was, voor 11 12 realen den bhaar hadde connen becomen, die nu niet voor 15 realen conden bemachtigen, also de eygenaers genegen waren die naer Batavia te voeren; waermede naer reverente groete syn schryven besloot ende dachtekend int fregat, 't Wapen van Batavia, seylende naer de rhede van Batavia, den 26" Augustus 1659.  Daer nevens levert gemelte van Lier aen haer Ede over een apart geschrift, dienende tot een cleen caertie, raeckende de stadt van Bantam met syn forten ende flanckeringen, als ’t gene van derselver sterckten ende constitutie mach raken ende hem bekent geworden zyn.  28 d’. des morgens, met de lantwint dryven van dese rhede de jachten, Arnemuyden ende Avenhorn, ende d’fluyt, ’t Hart. gedestineert ende affgeladen voor de directie van Bengalen ende tot vervolgh diens handels mede voerende drie bondert duysent gulden aen comptanten ende eenige ledige kisten tot afladen van salpeter, nevens een brief van haer Ede. aen den directeur, van den Broeck, welckers inhoude int Batavias uytgaende brieff onder dato can naer gelesen werden.  Soo licht mede syn ancker ende seylt van dese rhede over Malacca ende Aetchin na de Sumatrase westcust 't jacht, Kalff, medenemende aen geschilderde douken, dienstigh ende begeerde by die van Aetchin, een cargasoen ten bedrage van f 25820: 5:8; wat haer Ed by hare brieven daer mede aen d’Ed heer gouverneur, Joan Thyssen, op Malacca ende de commissaris, Keyser, op Aetchin syn aenschryvende ende recommanderende, can int briefboeck naer gelesen werden.  Tegens den avont seylt den vendrigh, Pieter Thonissen, met een chaloup ende drie contings met 30 slaven van hier naer de rivier Bacassy omme aldaer bast te schellen voor de leerbereyders.  29 d. ’s morgens, lichten haer anckers ende laten de vellen vallen de jachten, Hercules ende Hoogelande, om hare cours te stellen naer ’t eylant Ceylon ; ende hebben voor dat gouverno ende ’t onderhorige ingenomen twee hondert duysent gulden aen comptanten ende voorts verscheyden provisien ende benodigtheden, te samen ten bedrage van f 295653:3:10: boven welck cargo noch voor de cust Cormandel om  En                                              Original from Digitized by Google                           NEW YORK PUBLIC LIBRARY 
1659	1659	nyp.33433082429956-seq_0186.txt	170                           20-23 AUGUSTUS.  omgingen ende met den duyvel te doen hadden; vorders was daer doende om alle, die eenige ordre van Wangsa Radja hebben gehadt om te regeren, voor hem te ontbieden ende reeckening aff te vorderen ende met knevelen ende gewelt de luyden aen te doen seer te inishandelen.  Op dato syns schryvens hadde gemelte gouverneur, Angabey Martanata, syn sabander aen hem, Michielsen, gesonden ende op alle vruntschap versocht, hy doch by syn E. soude comen, also met hem over veel dingen te spreecken hadde, dat dan gevolgelyck voornemens bleeff, wanneer op alles tot afladinge van Westvrieslant soude ordre gestelt hebben, in een dach daernaer naer Sammarangh te vertrecken, met meninge om maer 2 dagen daer met door te brengen, waer mede syn schryven affbrack ende sloot.  21 d. Soo wert door haer Ed aen den alhier uyt Cambodia aengecomen Engelsman, gewesen opperhooft dier natie aldaer ende hier van Siam, nevens ’s Coup’ Cainbodiase dienaren, gecomen ende nu van meninge om met een inlants vaertuych naer Bantam te vertrecken, ter hant gestelt een cleen briefjen aen den Engelsen agent tot Bantam, d’ heer Edwarts, door haer Ed geschreven tot geleyde van een ingesloten packet bri.ven, vande Engelse met ’tfluytie, de Postilion, van Macassar in 's Conip' doos overgesonden, om aen gemelte Edwarts voorts gesonden te worden.  De heeren Jambyse mediateuren van de nademiddach in’t fort by d’Ed heer Gouverneur (ienerael verschenen zynde, soo werden deselve door syn Ed mel siry piangh onthaelt ende yder een schenckagie voor hare gedane moeyten in ’t besluyten der vrede tusschen d’ Comp ende Bantam wegens d’Comp ter handt gestelt, nevens een brief ende geschencken voor den Pangoran, haren heer; dan, also daer een groot Persiaens paert by was, soo versochten, dat ’tselve met ’s Comp schip, derwaerls comende, mochte naer gebracht werden, also ’t selve in haer vaertuygen niet wel conden bergen, waer mede afscheyt namen, voornemens om op morgen over Bantam naer Jamby te keren ende op Bantam den Sultan over de verbreeckinge van ’t besloten contract der vrede aen te spreken ende tot naercominge desselfs te vermanen mettet largeren der slaven ende Mardyckeren, aldaer van Batavia noch zynde, by de gemelle vrede so uytdruckelyck bedongen ende belooft te restitueren.  22 d’. Soo seylt van hier na Bantam ’tfregath, ’t Wapen van Batavia mede nemende een cleen briefjen van haer Ed aen den resident, waerby denselven bekent maken het voornemen der Jambyse gesanten om op Bantam te komen, om te sien of den Sultan tot naercominge van’t vrede accoort konde bewegen tot de restitutie van onse gevangen ende wechgelopen slaven ende Mardyckeren, alsmede om van Lier te laten opcomen ende dat den vendrigh, Fredrick Hendrick, soude transport doen, also syn E. als commissaris naer Jamby gecoren zy ende in corten sal moeten verlrecken.  23 d’. Vande morgen seylen van hier naer Bantam de Jambyse gesanten, voor gisteren haer afscheyt van haer Ede becomen hebbende, om van daer naer Jamby te keeren.                                        :  Van middach stort een buyten muyr van de pedacken van d’heer lantdrost, Jan Fermant, staende by de lantpoort, nevens syn woninge, in, waer onder een Chinese  En                                              Original from Digitized by Google                            NEW YORK PUBLIC LIBRARY 
