start_year	end_year	File	Text
1659	1659	nyp.33433082429956-seq_0137.txt	13-19 JUNIUS.                           121  eenige geschilderde doucken voor baren heer voor comptant hier te mogen coopen.  14 de. Met ’t doorblasen des lantwints, sano seylt van hier naer Malacca tjachtje, de Jager, medevoerende voor dat gouverno cenige touwercken, als andre scheepshenodigtheden, by haer gevordert, als mede een kist met 4 duysent stucken van achten, nevens een brieff van haer Ede. aen den hr. gouverneur, Joan Thyssen, ende den raet; wat haer gemelte Ede. d’h". gouverneur ende den raet in antwoorde op eenige harer jongste brieven syn dienende, als verder in mandato, soo op t een als ’tandere syn gevende, can by ’taffschrift derselver in ’t generale uytgaende Batavias brieffbouck, daer onder dato deser ingeschreven staet, naergelesen werden.  Soo seylt van hier mede naer Bantams besetlinge, tot vervangh van ’t jacht Woreum, ’t jacht den Angelier, mede tnt geleyde nemende een cleen letterken van haer Ed. aen den aldaer commanderenden coopman, van der Maerssen.  15 en 16 d’. is alhier niet sonders voorgevallen dan alleen, dat men sterck doende is om de schepen naer de noort haren last te versorgen.  17 d’, ’s morgens, seylt van dese rhede naer Tayouan ’t fluytschip, de Harp, ingeladen hebbende aen comptanten ende coopmanschappen een cargasoen ten bedrage van f111357:4:9; neemt mede een hrieff van haer Ed. aen den gouverneur Covet ende den raet aldaer, van inhoude, als hy ’tbrieffbouck can heooght werden.  18 d’, 's morgens, seylt van hier naer Tayouan het fluytie, Hilversum, hestaende desselffs ladinge in cen rys last, als verscheyde coopmanschappen, ten bedrage van f25655:3:12, waer nevens een cleen lettertjen aen den gouverneur ende den raedt van Formosa, door haer Ed geschreven.  Tegens den avont comt den licentmeester Symons syn Ed bekent maken, hoe binnen de rivier aengecomen ende gekeert was een der praeuwen van de Jambise gesanten, comende van Bantam, ende dat d’heeren mediateuren met de andre praeuwen noch van den avont hier stonden te syn, also al binnen d’eylanden waren ; so hadde hy, Symons, aen ’tvolek gevraegt, off den tamboer by haer meester was ende off sy hem mede brachten; hadden geantwoort van neen, maer dat Bantam tot vrede genegen was.  D'h". generael ordonneert daerop aen gemelte Symons, dat, indien de gesanten tydigh van den avont aencomen, die uyt derselver naem te gaen verwellecomen ende te horen, hoe de saken op Bantam staen, om syn Ede daervan rapport te doen.  19 d’. ’s morgens, heel tydich, comt den licentmeester Symons by den Gouverneur Generael en rapporteert, hoe op van de morgen sich hadde vervoegt aen de vaertuygen van de Jambise heeren mediateuren, synde op gisteren heel laet aen de mont van de rivier gecomen, die dan uyt syn Ed naem begroet hadde, waerop in discaurs waren geraect van haer verrichten op Bantam, onder andren, hoe aldaer door den Sulthan ende alle de grooten treffelyck waren ontfangen ende getracteert geweest, ende dat by haer alle mogelveke debvoiren waren aengewent om den Sulthan te bewegen tot overgevinge van den tamboer, doch alsa ’tselve uyt krachte van haer geloof niet kost, nochte vermochte te doen, sulex onverrichter saken hadden moeten keeren, doch dat den Sulthan, als de verdere grooten, alle seer tot den vreden incli- neerden ende genegen waren ; oock dat den tamboer souden restitueren, wanneer den vrede  En                                              Original from Digitized by Google                           NEW YORK PUBLIC LIBRARY 
1659	1659	nyp.33433082429956-seq_0123.txt	29 MAYUS,                           107  andersints soude ’t selve de tocht, in plaets van Domburgh, naer Lampon hebben laten doen, daer door althans qualyck seyl dorst voeren, waer mede haer reverente groete besloot.  29 d’. Soo stelt d'Ed heer Gouverneur Generael den licentmeester, Symons, een brieff ter handt, om d’selve aen expresse affgevaerdigdens van den Sammarangsen gouverneur, Kiay Ingebey WWangsa Radja, te overhandigen ende daer mede te laten vertrecken, zynde by syn Ed in antwoorde geschreven van dien, die sy van haren gemelten heer aen svn Ede hebben gebracht, waerby haer Ed beleeffdelyck versoecken gexcuseert te mogen blyven om syn E. eenige penningen wegens de Comp te lenen, alsoo ’tselve niet vermogens syn, als breder by tgenerale uytgaende brieffboeck can naergesien ende gelesen werden, daeronder dato in geschreven staet.  Soo comt hier binnen de rivier by den boom vast te meeren seker tingangh, comende van Bantam, daer op vier Javanen ende twee Chinesen, nevens eenen Jaques Macquelyn, zynde geweest assistent in dienst der E. Comp ende nu jongst vryman ende door die van Bantam met syn vaertuygh genomen, welcken Macquelyn door den heer ontfanger generael, Joan Croon, by syn Ede in ’tcasteel gebracht ende ondervraeght, hoe hier quam ende tot wat eynde, diende hy, Macquelyn, hoe den Sulthan van Bantam door voorspraeck van den sabantlaer aldaer, zynde een geschoren Chinees, die hem voor 40 ryexdaelders op Bantam gecocht hadde, hem hadde in vrydom gestelt om te mogen herwaerts keeren, met belofte de sabandaer syn gelt weder te senden, doch dat den Sulthan ende de grooten aldaer hadden goetgevonden hem met een tingangh herwaerts te senden ende daerinne vier Javanen om tvaertuygh te regeeren ende twee Chinesen om den Sulthan rapport te doen, van 'tgene hen belast hadde aen syn Ede voor te dragen, namentlyck, indien haer Ed mochten genegen syn om met Bantam in vrede weder te keeren, dat den Sulthan daer mede toegenegen was, ende dat haer Ede, sulex begerende, passe gelieffden te verleenen voor hare gesanten, die alsdan herwaerts souden senden. Verders verhaelde hy, Macquelyn, hoe de groote van Bantam haer schenen weynigh aen de vreden gelegen te laten, als wetende meer voordeel by den oorlogh te doen, als hy tverongelucken van ’tjacht, de Hasewint, van de becomen buyt daervan, als nu jongst met het afflopen van een ryck geladen jonckie, comeude van Succadane, onder anderen inhebbende een goede partye rouwe diamanten, is gebleecken, doch dat den gemeenen man daer weynigh, als juyst die ter zee rooffden, aff verbetert waren, sulcx die seer nae den vree haecten; wyders, dat de Bantammers groot opgaven van haer doente, dat echter soo veel niet beschoot, sonder dat yets anders meer wiste le verhalen.  Gemelte vertoogh door d’hr Gouverneur Generael in vergaderinge van India vertoont ende overwogen, hoe d’Comp-den Sulthan in verscheyde gelegentheden genoechsaem bekent heeft laten maken, dat haer Ede wel tot den vreden genegen waren, maer dat den Sulthan alvorens den tamboer soude overleveren ende buyten dat niet conden in’ onderhandelinge met denselven treden, ende aengesien tot noch daerin in gebreken blyft gemelte twee Chinesen ende vier Javanen, nevens de lingangh, daermede hier gecomen zyn, opstonts weder te laten vertrecken ende  En                                              Original from Digitized by Google                           NEW YORK PUBLIC LIBRARY 
1659	1659	nyp.33433082429956-seq_0122.txt	106                                  28 MAYUS.  wat haer Ed., soo nopende de negotie, als hooffse saccken ende bracderlycken oorloge, als verderen aencleven syn schryvende ende haer Edce. van dienende, wert onder dato deses in de aparte sommiere verbalen, van Cormandel ende Bengalen gehouden, largo gevonden om naer te lesen.  Soo laet hier mede 't ancker vallen het galliot, d'Appelboom, comende uyt de besettinge voor Bantam, medebrengende een brief van den commandeur van der Maerssen aen haer Ed., gedachtekent uyt oorlogs jacht Ter Goes den 26e" deser maent, inhoudende: hoe conform haer Ede. ordre op den 16-" deser het jacht Worcum ende de chaloup de Kreeft hadde affgevaerdight tot ’tvisiteren van de groote bocht van Lampon, die dan den 20"" daeraen, naer dat twee dagen met opsoucken. aldaer hadden t’souck gebracht, een Engels schip van achter eenige eylanden onder seyl sagen, haren cours straetwaerts settende, daerop haer volgden; dan was gemelte Engels schip haer door beter beseyltheyt ende slappe winden, als voornamentlyck het vaerwater aldaer met rudsen ende clippen zynde vervult, sonder ’t selve te konnen verspreecken ontcomen; ende soo keerden sy weder bescttingwaerts, alwaer den 24 quamen ende deden rapport van ’tverhaelde; doch waren d'opperhooffden van gemelte jacht van gevoelen, indien den Engelsman selffs niet hadde t'seyl gegaen, sy by haer niet souden opgedaen off gevonden gewerden hebben.  Tot naerrichtinge van gemelte opperhooffden by rescontre van Engelse vrunden hadde hy, van der Meerssen, d'selve een schriftelycke ordre medegegeven, die vermeende volgens de goede meninge ende successive wel gegeven ordre van haer Ede, tot naerrichtinge aen de hooffden der besettinge aldaer geschreven, was accorderende, doch tot derselver gerustheyt, soo was reverentlyck versoeckende, haer Ed. deselve eens geliefden te resumeren, tot welcken eynde de copye derselver was oversendende, om te sien off de orde, daerby vervath, oock alsodanigh de meeninge van haer Ede, zy, waerop bleeff haer Ed. antwoorde te gemoet sien.  Alsoo ’tgalliot, d’Appelboom, aldaer seven weken ter beseltinge hadde gelegen ende door syn lecte qualycken konde boven water gehouden worden, soo ware goet gevonden ’tselve een keer na Batavia te laten doen, waermede opsont 4 mans ende een inlants vrouspersoon, alle van Bantam, op den 172 des nachts aen boort comen vluchten, dan wisten niet sonderlings te verhalen.  Soo en vernamen oock van de Bantammers niet ende noch minder van de vrede; den Maleyer hadde ’tsedert ’tvertreck van der Veer noch eenmael aen boort geweest, onder pretext van naer de antwoorde van haer Ed. te vragen, die dan hadde aengeseght in toecomende niet weder te comen, ofl dat hy anders als ou soude getracteert worden, sulex hem niet meer vernomen hadde.  Soo waren daer binnen Bantam weder verscheyde van hare oorlogs prauwen geretourneert, sonder te weten tot wat eynde, off opontboden, off wel dat ten eynde victualy gecomen waren.  Tot besluyt versocht, in geval hier een bequaem ende wel beseylt jacht conde gemist ende ter besettinge gesonden werden om daer dienst te doen, soude het de sake daer wel vereysschen by opcominge van eenige Engelse bodems, alsoo Domburgh wel schoon gemaeckt is, maar syn groote mast is in de visser meest aen twee, want  En                                              Original from Digitized by Google                            NEW YORK PUBLIC LIBRARY 
1659	1659	nyp.33433082429956-seq_0136.txt	120                               11-138 JUNIUS,  verloren, sulex hier te lande medebrenght 70 man cloeck volck, bestaende uyt 49 matroosen ende 21. soldaten.  Soo comen oock alhier weder uyt de Straet ’t jacht, de Griffioen, ende ’t fluytje, de Mees, synde ’t jacht volladen met rouwe houtwercken, bequaem tot auckerstocken, pompen, als onderleggers, gehact ende gehaelt van ’t eylant Sebessie, welckers opperhoofden rapporteren, dat aldaer haer geen Bantamse vvyanden aen lant vertoont  hebben, maer wel, dat om ende weder haer aldaer sterck te water vertoont haden, sonder het minste op henluyden te attenteren, sulcx alle ’t volck cloeck ende gesont weder brachten.  12 d’. comt uyt Amboina geseylt ende laet hier ter rhede 'tancker vallen ’t schip, N. Rotterdam, aldaer ingeladen hebbende 185505  suyver gewicht nagelen, met 7790 bossen cocos lont, tsamen aldaer ter facture gestelt tot f 115401: 18:14; met gemelten bodem becomen haer Ed. mede twee brieven met hare hylagen, door d’hr. gouverneur Hustaert, d'eerste in dato 50 April van Goram ende d’andre in dato 25 Mey uyt Amboina geschreven, waerhy den toestant van ’t Amboinse gouverno, alsmede de krygstocht naer ’t eylant Goram, by syn Ed. gedaen, omstandigh is adviserende, als onder dato deser in ’t apart sommier verbaecl, van Amboina gehouden, can naer gelesen werden.  13 d’. is in vergaderinge van India, naer oversligh van ’t aenwesende ende le gemoet gesien werdende gelal krygers, verstaen ’t eylant Formosa, in plaets van de geyste 500 soldaten, maer met 250 van hier te konnen versorght worden, daer haer aldaer in de verlossinge off verbeteringe naer sullen moeten richten, des nodigh synde.  Soo is mede verstaen voor die presidie aen te leugen de fluytschepen, Breukelen, met syn volle Siamse ryslast, als Hilversum ende Immenhorn.  Staende de vergaderinge van Inda, soo comt den sabandaer Symons ende maeckt haer Ede bekent, hae alhier een vaertuygh met eenige dienaren van den soon van den Sousouhounangh Mattaram van Japara alhier aen den boom was aengecomen, waervan twee derselver door gemelte heer expresselyck met een brieff van denselven acn haer Ed. waren affgevaerdigt, die dan hem hadden ter hant gestelt ende syn Ed. overleverende, welckers inhoude, uyt het Javaens in ’tNederlants overgeseth zynde, hielt desen zin in.  TRANSLAET BRIEFF van pangoran Dipaty Anom aen JE h’. Gouverneur Generael.  Desen brieff compt van pangoran Dipaty Anom aen myn broeder, den capiteyn Moor: brengeren deses svn myn dienaers, met namen Siloor ende Sabdanalla, met desen mynen brieff, nevens twee puaerden tot vereeringe aen myn broeder, den capiteyn Moor; vorders alle myn andere begeerten svn de voorschreven Siloor ende Sabdanalla wel bekent.  Den Sabandaer wist te seggen, dat gemelte dienaren hadde affgevraegt, off jets aen syn Ede. te versoecken hadden off dat op Batavia jets wilden copen, ende hadde in antwoorde becomen, niets te versoecken hadden, eenlyek, dat versochten  En                                              Original from Digitized by Google                           NEW YORK PUBLIC LIBRARY 
1659	1659	nyp.33433082429956-seq_0056.txt	40                98 FEBRUARIUS.  Staende de maent February, soo syn volgens der Christen wyse alhier ter aerde bestelt de naervolgende affgestorvene lichamen: 24 Comp dienaers, 1 Nederlants kint  zynde 25 Europianen mannen ende 4 Mardyckers, 5     d,    vrouwen, 11     d,    kinderen, 4 lyffeygenen,  t'samen 49 dooden. Daer tegens syn hier weder in de Christelycke kercken, dese naervolgende kinderen gedoopt, als : .... Europianen, .... Inlantse. z... yffeygenen,  t'samen .... kinderen. Soo syn mede in dese meergemelte maent alhier inde kercke wettelyck . gepaert de volgende persoonen : 5 Comp dienaers. 2 burgers, 4 Mardyckers  t' samen 9 personen.  Ten jongsten werden alhier onder des Comp gebiet bevonden onder haer capiteyns, als andere haer meesters, 1158 Javanen, die alle by den lantdrost aengetekeal ende bekent syn met hare namen, volgens de lyste daervan, op heden aen d'Ed' heer Gouverneur Generael overgegeven.  En                                              Original from Digitized by Google                           NEW YORK PUBLIC LIBRARY  
1659	1659	nyp.33433082429956-seq_0042.txt	Kenan  EE  hens hae -  26  4 FEBRUARIUS.  Coningea der werelt, wien de elimenten onderdanig zyn, de lucht ende de aerde, de wolcken, het stoff ende de regen, dese sulcke elimenten syn contrarie legen desen de zon; als wanneer hy met zyne stralen voortcomt, doet hy alle sterren uyt met syn schynsel; met syn macht ende cracht doet hy alles wycken; met syn stralen hy loopt de werelt door, comt voort ende gaet onder. Ick vergelyek my met de voorseyde krachten der sonne, gelvck victorieuse ende machtige, vol van gratien, onwinnelyck, Aracan, heer van tgouden huys ende van alle monarchie, Chenda, Sudroma, Raza, keyser van verscheyden deelen.  Iek doe weten aen de machtige in de zee, vergiftigh als een serpent, groot van verstant ende wetenschap, raadt van India, heer van het steenen casteel, Joan Maelsuycker, Gouverneur Generael, den capiteyn Heyndrick de Dieu, die hier onder myn protectie geresideert heeft na den raet van den generael, heeft myn Conincklycke raet bevonden te syn een voorsichtigh man van groote raeltslagen, die mv verheuchde te horen svn loff; in syne tyt alle de schepen, die quamen in dt myn lant, deselve Hendrick de Dieu, als capiteyn van deselve schepen, presenteerden my de brieff ende geschencken van de generael; ick ontfingh die altvt met goede genegentheyt, siende den vver, dien in hem was; en syn my bericht alle de saken. die in hem belast waren, waer met hy verdient heeft veel eer ende gunst te ontfangen in myn ryck, gelvek hv tot syn doot genoten heeft; ick heb hem doen begraven ende doen accompangeren door myn edellieden tot het graff, na dien hy het waerdich was; het heeft Godt gelieft wech te nemen een man, die so groot was, dat my bedroeft heeft, ende alle de raden van mynen raadt; na de doot van deselve capiteyn svn in myn ryck aengecomen twee schepen met brieven ende geschencken van den generaecl; de koopmanschappen, die hy in deselve brieff heeft begeert, heb ick terstont toegeslaen, gevende myn gunst om genegotieertl te worden in corte; oock sal my ende mynen Conincklycken raedt aengenaem syn, soo de generael een capiteyn sent, die voorichtigh zy, gelyek den overleden, van goeden raedt, om de affairen van de generael te verrichten, ende met hem eenige stucken crocado ofte laken van Portugael, van allerley soorte, fluweel van allerhande goede coleur, satyn, damast van veel couleur, hetzy om te verhandelen; hef. eerste mousson, na dat de nieuwe capiteyn sal meriteren, sal ick hem toestaen, al hetgeen redelick sal Sv; hier nevens sende vyff stucks betilles.  Naer langh uytsien, soo comt alhier, Gode loff, mede ter rheede seylen ’t schip,  Westvrieslant, op den 8" May verleden jaers uyt ’t Vlie van de Camer van Hoorn t'seyl gegaen met 556 sielen, bestaende in 282 seevarende ende 69 soldaten, 5 vrouwen, een kint ende een swartin, hebbende de Cabo de goede hoop aengeweest ende aldaer eenigen tyt ververst; hebben daer door sieckten gelaten 5 seevarende ende een soldaet; onder wegen verloren 67 seevarenden ende 18 soldaten, sulcx hier te lande brenght 265, bestaende uyt 210 seevarende, 50 militaire, 3 vrouspersonen, een kint ende een slavin.  Digitized by Google  Original from NEW YORK PUBLIC LIBRARY  
1659	1659	nyp.33433082429956-seq_0095.txt	26 APRIL.                        79  212 February, de Trou primo ende de Coninck van Polen, ’t Vergulde Hart, Hasselt ende de Vinck den 6" Maart; ende syn weder van daer geseylt den bet ende Zisten January, 22e8 February, 15" Maart ende de 4 jongste den 10e Maart; soo hadde den E. Willem Bastingh op syn vertreck aldaer een brieffken, aen haer Ede houdende, gelaten, dat nu was oversendende.  De vier strantheeren waren maer eenmael uyt de Mataram affgeweest om de goederen van den gemassacreerden Pangoran Soerobaya op te schryven, waer wel 600 vaertuygen maer toe syn vertrocken geweest, met ordre om alle de grooten daer om te brengen: dan, op wege zynde, sont den Sousonhounangh pardon over lant, met ordre die alle sonder geweer in de Mattaram souden senden; ende soo dra sy alles hadden opgenomen, waren alle naer haer plaetsen vertrocken, alwaer gekomen zynde, ordre vonden om opstonts weder boven te komen, so dat, sonder voeten aen lant te setten, naer boven mosten.  Den Pangoran van Soerabaya was den 21 February, nevens twee van syn broeders, een soon, twee neven, als wel 60 van syn principaelste bevelhebberen, omgebracht; de oorsaecke daervan wert gerucht, omdat naer ’t leven van de Sousouhounangh stongh ende een seker persoon met beloften van staet ende gelt te vereeren soude gekocht hebben om denselven te vermoorden ende dat hem tot dien eynde met een cleet ende cris soude begiftight hebben, waer door het soude uytgecomen zyn.  Soo wiert aldaer gants van geene veranderinge der vier strantheeren gehoort, maer wel, dat seer om gelt verlegen waren om haer quola op te brengen, off dat daer so lange boven inde Mattararm souden moeten verblyven, waerover aldaer groote persinge van gelt onder de gemeynte geschiede; yder most een twee rycxdaelders op brengen ende Chinesen, die getrout syn, 10, daer by de strantheeren 7 8000 ryexdaelders sullen proffiteren; ende die niet hebben, werden datelyckstelt; soo wiert hy wegens de Comp mede van haer alle gesamentlyck aengesocht om gelt ter leen, dan stelde haer uyt, dat het nu niet hadde; soo hadde mede verstaen, dat drie der vier gouverneurs hare gesanten aen haer Ed om gelt te leen hadden gesonden, die oock last hadden om vande Chinesen, als den Capiteyn en andere, 1 2000 rycxdaelders te lenen, daer voren hout, sout, rys, suycker off wat anders begeerden, souden gelevert worden.  De Macassaerse gesanten waren ultimo February verleden van daer geseylt met twee vaertuygen, die haer van den Sousouhounangh gegeven syn, synde ongevaer 20 lasten yder groot; ende seylden mede in comp desselffs ’t gallot, door den Sousouhounangh daer doen maken, op het groot opgeven van den Codja Brahim ende de Portugesen wegens de winsten, die op de cust te doen waren, waer naer haer ooren jeuckten,. ende voornemens geweest waren om derwaerts aff te senden, dan schenen nu verandert te zyn, ende sonden ’tselve om op Macasser te vercopen, oft wel een tocht naer de Manilhas off anderwaerts te laten doen.  Gemelte ambassadeurs waren met groote statie van daer uytgeleyt ende van den gouverneur aldaer met seven lasten rys beschoncken, onder beloften van den anderen trou te blyven; waren oock van Tommagon Patty versocht, dat op Jouanna  En                                              Original from Digitized by Google                            NEW YORK PUBLIC LIBRARY 
1659	1659	nyp.33433082429956-seq_0081.txt	1-5 APRIL.                                     65  daer qualyck aen de kost conde komen, bestaende in drie slaven, daer onder twee slaven van d'E. landdrost, Jan Ferment, ende twee Balyse wyven, die de slaven volgden, als twee Chinesen met een vrou ende drie kinderen.  Dit syn schryvens was dan met ’tgallot Charlois haer Ed toecomende, dat by raads resolutie, sno tot het een als tander vorengemelt haer Ede daer by bekent te maecken, t'harer governo hadden goetgevonden aff te steecken; inmiddels souden alle debvoiren. aenwenden om, soo veele mogelyck, den Engelsman wel te verseeckeren, dat daer niet alleene niet quame in te lopen, maer oock niels te lossen off te laden, voornamentlyek buspoeder, daer den Bantammer op ’t hoochste om verlegen is.  Soo sont uyt de besellinge op negen zeevarende personen, die, vermits de berre-berry hadde, daer geen dienst conden doen, daermede naer nedrige gebiedenisse ende toewenschiinge van de segen des Heeren affbrack ende besloot.  Heden naer middagh, in vergaderinge van India, is aen den burger, Thomas de Lieffde, op syn versoeck toegestaen ende vergunt een pas voor syn jonck, groot ontrent 150 lasten, om die naer de Sumatrase WWestcust met syn volck tot opcoop van peper te mogen versenden.  De reduyt Buiren, als leggende onder het canon der stadt ende tusschen de twee groote nieuwe buyten gemaeckte sterckten, Batenburgh ende Jaccatra, is by haer Ede althans ondienstigh geoordeelt door die van de militie te laten bewaken, derhalven de beselters in te trecken ende over ’t guarnisoen te verdeelen, doch met dien verstande, dat gemelte punt Buiren echter sal blyven staen in syn geheel ende voortaen op deselve Comp" leerbereyders ...ende die plaetse beneden om deselve langs den ....kant met kuypen als andersints, tot het leerbereyden vereyssende, beguaem te doen maken.  2 d’. Op heden is by aflictie van billietten een yder bekent gemaect, hoedanigh voortaen niemanden, wie hy oock soude mogen wesen, vermogen sal aen eenigh hier te comen handelaer syn boort te varen, voor ende aleer syn ancker ler rheede sal hebben laten vallen off wel vast leggen, op poene van het vaertuygh, daer mede sullen varen, verbeurt te zyn, boven een amende van 20 rs, alsoo haer Ede tselve sodanigh ten dienste vau ’t gemeene beste bevonden te vereysschen.  5 d’. Heden morgen lichten haer anckers uyt dese rhede ende seylen naer de revier Palembangh, om deselve nevens syne spruyten te besetten ende die natie alle handelinge te weren, de jachten Bloemendael, Koukercken ende le Kath, nevens twee wel gemonteerde oorloghs chaloupen, synde de opperhooffden derselver door haer Ed op gisteren avont in vergaderimge van India hare schriftelyeke instructie ter hant gestelt, nevens een brief aen, ’s Comp opperhooft, de Goyer, op Jamby, om aldaer door de jachten Zeehondt ende de Marya, wanneer uyt de Palimhangse beseltinge opbreecken, nevens eenige comptanten, doucken, als andersints, die alsnu mede syn sendende, derwaerts te brengen, om van daer in contra weder een ladinge peper te halen, als omstandigh in ’tgenerale Batavias brieffbouck onder dato 2 deser, daer de instructie voor de besetters, als den brieff naer Jamby ingeschreven Slaen, can naergesocht ende gelesen werden.  DAGH-REGISTER ANNO 1659,                       U  as                           Original from Digitized by Google             NEW YORK PUBLIC LIBRARY 
