start_year	end_year	File	Text
1659	1659	nyp.33433082429956-seq_0223.txt	7 OCTOBER,               1      207  voor de Engelse Comp aldaer; den brief, door ’s Comp resident geschreven in dato ben deser, bevatte eenlyck, hoe op den 5e" deser, daegs naer dat van dese rhede geseylt was, tot Bantam was aengecomen, alwaer verstont, dat den Sulthan ende andre grooten, die uyt vermeyden hadden geweest, als doen daer mede weder ten hooff waren gekeert, waerop aenstonts dan getracht hadde by den Sultan te comen om syn May' de geyschte pistoolties te overhandigen, dan dat eerst den ber deser geschiede, doch soo vroeg als by den Sultan sath, die de pistoolties wel bevielen, soo verscheen Kiey Arien mede aldaer, sulcx voor die tyt met den Sultan niet verder kosten spreken ende nae de logie keerde ende ’t fregat weder met dit syn schryvens affveerdighden, ende soo besloot.  Den brieff, door den Engelsen agent, d’hr Edwarts, aen haer Ed, in dato 2er deser maent geschreven, uyt ’tEngels in ’t Nederlants overgeselh zynde, hielt dese volgende complimenten in:  Recht Honnorable'  Sedert onse laelste tot UE, dewelcke inhielt het verschil tot Jamby, het welcke, synde een onbehaegelycke lyn om aen te trecken, we verby sullen laten gaen, als een voorval, al lange verleden, als mede den 25"" d’. door Mr Mainstone, daerin gy onsen vorigen beantwoort naer ons contentement, als. daerin uytdruckende het gevoelen, dat gy hebt van onse sedige beleeftheyt t u waerts, hetwelcke sullen trachten te vermeerderen op yder occasie, die sich presenteren sal.  Aengaende Mr. Mainstone, die wel spreect van UE. gunste, soo moeten wy dit seggen, dat op syn versoeck om toe te staen svyne reyse naer Batavia wy hem dese ongelegentheden hebben voorgestelt, dat, gelyek niets en hadden van onse meesters saken te communiceren handels wyse, ende also niet gerecommandeert tot UEd: honorable, hy daerop als een spion met onse kennisse soude werden aergemerct, hetwelcke soude nadeeligh zyn die goede estime, die gy geliefde van ons te hebben, dewelcke wy tederlycken sullen trachten te behouden; maer hy, voorwendende den ontfanck van een considerable somme gelts; zynde hem schuldigh aldaer, daer benevens het copen van eenige hehoeftigheden voor syn huysvrouwe, die verwacht wert, soo en konden wy hem met reden syn cleyn versoeck niet afslaen; by aldien syn comportement vervremt is geweest van het gene wy verwachteden, gelyck gerapporteert wert, dat hy iets anders daer te doen heeft gehadt dan de vaorgaende gementioneerde pretensien, soo connen wy maer medelyden hebben met syne dwalingen; de schult sal eenlyck syne zyn ende wy sullen hem voor soodanigh aensien.  Als aerrgaende de sake van Jamby, wy verhopen, dat nu UL. resident aldaer UE. vermaninge sal hebben ontfangen, soo sullen sy meer gebruyckelyck handelen met d’onse, tot dewelcke wy sullen behoorlyck comportement ende vruntschap aenmanen, hetwelcke altyt sal werden betracht van, myn heer, UE. honorabelheyts rechte vrunden ende dienaers, getekent : John Esddwardts, Henry Page.  En                                             Original from Digitized by Google                           NEW YORK PUBLIC LIBRARY 
1659	1659	nyp.33433082429956-seq_0287.txt	REGISTER VAN PERSONEN- EN PLAATS-NAMEN.                 171  Oia Sikari, 83.                      On-soe-ke, 229.  Oldenvliet (N.), 15.                  Ontong Djawa, 74, 75, 90, 189, 199. Oliveiro (L. d’), 5, 14, 149.              p     p (riv. v), 214, 224. Ollander (S. d’), 58.                  Ooms, 45.  Oloeang Pisnokan, 85.                 Orangien (SJ), Ln  Onrust (eil.), 51, 92, 104, 116, 119, 192,  Ossen (S. van), 20 210, 211, 214, 225, 252.  P Paarl (punt de), 56.                  Pellens (G.), 246. Page (H.), 8, 17, 5255, 171, 175, 188, Peper-baai, 16, 25, 72, 92. 198, 207, 217, 249.                  -berg, 25. Paige (J.), 51.                       Peregrinus (B.), 58. Paleakate, 42, 85 105, 168, 177, 184,  Persy (J.), 118. 251, 252, 241.                Perzie, 115, 156, 151, 164, 177, 186, 199,  Palembang, 46, 27, 56, 59, 59, 66,   215, 249, 250. 67, 78, 85, 195, 196, 208, Pietersen (P.), 119, 242, 246.  210-212, 227, 252, 253,    (F.), 15, 77, 118, 222, 225. 2536, 257, 259, 241, 242,  Piscadores, 256. 246, 250, 255.          Pith (L), 42, 86, 105, 168, 184, 213,     (rivier van), 56, 46, 48, 65,    251, 252, 241, 257. 66, 94, 154, 155, 166.             Pitlavin (burger), 22, 88. Palembangers, 67, 190.              Poeloe doea, 16, 350, 49. Palikol, 85.                           pandjang, 55, 255. Pandjang (Kapitein), 6.                Poespa Raga (Bagoes), 115. Papati (Pangeran), 175.               Poetih (Intje), 76, 90. Pariba, 191.                       Polo, 25, 29, 50. Parve (J.), 126.                    Pontang, 167, 214, 225, 224, 229, Parys (schipper), 946.                 Poolman (G.), 58. Pasoeroean, 141.                   Porto-novo, 75.  Pati, 2, 4, 10, 70, 71, 75, 78, 92, 95.  Portugal, 26, 123.  (Toemenggoeng), 78, 79, 96, 98.   Portugezen, 11, 14, 17, 51, 55, 57, 45,  Patna, 75.                          55, 56, 69, 74, 75, 79, 80, 86, 128, Pays (M.), 32.                          145, 149, 150, 155, 222, 241, 245, 244. Payse (A), 118.                     Prana Joeda, 80, 96. Pearle (H.), 5555.   Priaman, 57, 83, 164, 187. Pekalongan, 12, 14, 250, 251, 258.    Prinsen-eiland, 25, 64. Pe-ko (Chinees), 2, 5.                 Put (H. van der), 189.  -  Quarles (WV), 200.                  Quinammers, 6, 48, 92, Quinam, 48, 150, 165, 258, 261  Original from  Digitized by Google                    NEW YORK PUBLIC LIBRARY  
1659	1659	nyp.33433082429956-seq_0293.txt	Digitized by Google  Original from NEW YORK PUBLIC LIBRARY  MME eee dak A am     -  EN en ee ee ee ee ee ee ae  
1659	1659	nyp.33433082429956-seq_0278.txt	262                              31 DECEMBER  1101 stucx inlantse navetten van alderhande groote ende hebben van hier ten principalen vervoert de naervolgende coopmanschappen : 120165 ryexdrs. aen alderhande witte ende geschilderde daucken,  2451 d.            comptant,  1557 d’.             goutdraet, 6156 d’.     coper, thin, loot, gommen ende out yser,  5260 dd’.     wyn, arack, oly, rys ende sout,  620 dd’.     benjuwyn, sandelhout ende barnsteen.  906 d.     suycker, wasch, vogelnesies ende comyn,  450 d’ grof porceleyn, rottangs, huyden ende soethout, 462 d.     poetsiock, fermiljoen ende casomba,  1670 d’. radix china, galnoten, cadongh, Chinese gemaeckte  kisten, droguen, als verscheyde andere Chinese ende Javase klenigheden meer.  In voorgemelte tyt van 12fm. syn hier ter aerde besteet naer de Christen wyse, buyten Chinesen, Moren ende andere onchristen natien, 929 lichamen, makende netto niet een doode meer, noch min als ’t voorleden jaer, ende bestaen uyt de volgende natien, namentlyck:  524 Comp dienaren ende burgeren, 84 soo vrouwen, als kinderen, 64 Mardyckers,  66 harer vrouwen,  136 harer kinderen, ende 69 Iyfeygenen.  Daer tegens syn aen 408 kinderen hier wederom den H. doop bedient, uyt de volgende natien:  88 Europianen kinderen,  289 inlanderen kinderen,  51 bejaerde personen uyt de inlanderen.  Soo syn alhier in 12fm. gelrout in de Christen kercken 150 paer volck uyt de volgende geslachten :  735 Comp' dienaren ende burgers, 51 Mardyckeren, ende 26 lyfeygenen.  Onder de jurisdictie der stadt Batavia wert bevonden, d’'eene maent min, d'ander meer, dat haer, d'een door den anderen, ontrent de 1400 Javanen, soo onder hare capiteyns ende meesters syn onthoudende.  Europianen,  En                                               Original from Digitized by Google                             NEW YORK PUBLIC LIBRARY 
1659	1659	nyp.33433082429956-seq_0244.txt	92                j          1317 NOVEMBER.  nu niet sonder bewys wilden affsteecken, dat dan vertroude, haer Ed voor wel gedaen souden houden.  Met een Maleyts vaertuych was hem, Michielsz, den ingeslooten brieff, van ’sComp' volck op Macassar aen haer El geschreven, toegebracht, die dan nu mede over sont; aldaer op Japara wiert sterck gerucht, dat de gerebelleerde Coningen van Mandaer (uytgenomen eenen alleen) waren afgecomen, met presentatie ’t hooft in den schoot te leggen ende haer weder onder de Maccassaerse opperheerschappy te stellen, so wanneer dien vorst, in plaetse van Craingh Catappa, eenen anderen heer over haer wilden stellen, als vertroude, haer Ed breder in't gemelte schryvens soude comen te vernemen.  Vorders bleeff de ordre van haer Ed om aldaer vlees te souten, als levende beesten voor d’oosterse gouvernos op te copen, nevens de g'eyschte vaten, etc. als eenige commiters, petolen, tapeserassen ende eenige vaderlantse provisien dagelycx te gemoet sien; ten jongsten schryft, also de Chinesen aldaer veel gelt op swarte suyckeren hadden uytgeseth om met het eynde van't mousson naer herwaerts te voeren, soo hadde haer Ed'" eysch van 1000 pl. swarte suycker niet cunnen voldoen.  Soo was mede de Japaarse gesloten soldy boeckies oversendende, waer mede naer groete affbrack ende syn schryven besloot ende dachtekende, als voren geseght zy.  14 en 15 d’. niet sonderlings om ten papier te brengen voorgevallen dan eenelyck, dat hier, vermits ’teynde van’t ooste mousson, dagelyex verscheyde burgeren ende ingesetenen, Chinesen ende andere, hare joncken, soo van Javas oostcust, als andersints hier om ende aen ter rhede met allerhande last aencomen, soo is by haer Ed mede goetgevonden ’t schip, Hoff van Zeelant, Japara en passant te laten aendoen om aldaer het geyste timmerhout voor Banda, dat daer in voorraet legt, mede te nemen.  16 d’. laet in den avont comt den schipper en boeckhouder van ’t jachje, Cleen Battavia, binnen ’t casteel by d’Ed. heer Gouverneur Generael, die syn Ed bekent maken, hoe van de bhare van Aetchin met schryvens van haer Ed commissarissen aen die croon waren affgevaerdight naer Malacca aen dE. heer gouverneur Jan "Thyssen, die haer weder naer Batavia te seylen geordonneert hadde om haer Ed’ een packet met papieren te overhandigen, als met eenen overleverde, hebbende het jacht een groot stuck buyten de rhede, vermits contrarie wint, voor ancker laten leggen ende van daer ’t met de schuyt hier aengebracht.  Waerop door syn gemelte Ede vergaderinge van rade van India beleyt ende gemelte papieren geopent ende gelesen zynde, wiert bevonden, haer Ed daer by bekent gemaect wiert, hoe hare expresse affgesondene aen ’t Aetchinse hoff met die croone soo verre waren gecomen, dat eyndelvek op haer Ede approbatie de verschillen alsnu tusschen d'E. Comp ende die cronn volcomentlyck waren afgedaen ende by de May' ondertekent, op sodanigen voet, als de schriftelycke wedersytse getekende vrede poincten medebrachten, die dan, als ’t gene verder aen dat hoff voorgevallen was, by’t apart sommier verbael van Malacca ende Aetchin onder desen datum largo can naergelesen werden.  17 d’. des naermiddachs, laet hier ter rhede het ancker vallen 't jachje, Gleen Batavia, comende van de bhare van Aetchin over Malacca, eenlyck medebrengende  En                                              Original from Digitized by Google                            NEW YORK PUBLIC LIBRARY 
1659	1659	nyp.33433082429956-seq_0250.txt	234                          30 NOVEMBER.  geweest met 512 koppen; ende hebben de volgende waren aen de marct gebracht, namentlyck : 2 stucx slavinnen, 94 lasten rys, 21 d. pady, 20 d sout, 1 d. cadjangh, 1427 picols peper, 250 de. swarte suycker, 20 d gedroocht hartevlees, 100 d. Javase toeback, 2 de. anys zaad, 56 stucx koebeesten, 50 de. soo harten, als bocken, 5000 de. gansen, eenden ende hoenderen, 1950 d’. oude clappussen, 250000 d. oude pinangh, 16650 de. gedroochde vissen, 1100 de. gesoute eyeren, 50 d. quitasollen, 650 d. jatvkistplancken, 550 d cadjanghs, 240 d’. Javase maties, 2570 d. aerde potten, 80 de. houte doelangs, 50 de. rys wannen, 56 potten geconfyte gengber, 18 'd’. met blaewe verff, 17 de,  clappus oly, 50000 bossies swarte suycker, 1600 de. tamberinde, 8200 de, looek ende ajuin,              j 500 d. rottangs, ende voorts een groote quantiteyt allerhande aert ende boomvruchten, als andere, onnoemelycke cleenigheden. Soo syn daer tegens wederom van hier vertrocken naer de omme gelegen handelplaetsen 114 stucx gelicke navetten; ende hebben van hier wech gesleept aen de navolgende ecoopmanschappen voor: 7608 rycxd. aen alderhande geschilderde ende witte doecken, 157 d’.  comptant, 97 d. Chinese kissies, 120 d’.  guinees lywaet, 22 d. gebroken isere pannen, 50 d’.  verscheyde clenigheden.  Original from  Digitized by Google                           NEW YORK PUBLIC LIBRARY 
1659	1659	nyp.33433082429956-seq_0085.txt	8-11 APRIL.       69 .                      d                 .  8 d’. Op heden wiert in vergaderinge van India goet gevonden den vendrigh. Pieter Thonissen, op gisteren hier van Bacassy gekeert, weder andermalen derwaerts te laten keren ende tot therwaerts voeren van de te hacken sparren als pagger houten ’t fluytie, de Mees, mede te laten seylen ende tot bevrydinge van de rivier voor de Bantamse prauwen, als tot bescherminge van ’teleen vaertuych ende volck, tfregath ’t Wapen van Batavia, de oorloghs champan ende 30 suldaten mede te geven.  Soo is mede gearresteert ’t fluytschip, de Vogelsangh, voor Siam aen te leggen, om aldaer in te nemen ende te laden den eysch voor Japan ende daer mede soo tydigh derwaerts te seylen, als mogelyck sal syn, om also tydigh in Japan te connen aen de merct komen.  Onder ’tfortie Batenburch, daer de chimpan legt, een houte brugge met een valdeur in ’tmidden, tot ’tdeurschieten der boots, over de groote rivier te doen maken ende de geintresseerdens, die voor dato daertoe vrywilligh hebben gepresenteert een donatie -te geven, gesamentlyek door den landtdrost ten platten lande te doen aenspreken, als die verder daeraen mochten gelegen zvn, ehde op nieus yder laten tekenen, om alsdan ’tgene meerder als ’tgene, dat zullen comen te teeckenen, mochte komen te kosten, door de Comp, die daer althans gestadigh een chiampan ende twee slaven houden moet tot de overvoer van haer volck, soo van de kruytmolens, aldaer onder Batenburgh gemaeckt, als de verdere onderhande zyrde molens, breder by de resolutie, daer over getrocken, naer te sien.  9 d’. is niet noterens voorgevallen.  10 d’. is op ’ternstigh aenhouden der aenwesende voornaemste Portugese gevangenen, om van hier naer St. Thome op de cust CGormandel met ’s Comp" eerst daeghs derwaerts te verseylen schepen mede te mogen vertrecken ende alhier niet so lange te verblyven, tot dat de Comp van hier naer Goa besendinge doet, vast gestelt den Portegesen Gouverneur van Jaffenapatnam, Joan de Mello, die daertoe gantsch niet wil verstaen, maer dat sy altsamen met hem naer (oa sullen moeten verlrecken ende sy, Portugesen, sustineren dat niet gehouden te zyn, gemclten gouverneur de Mello door twee gecommitteerde heeren Schepenen ende derselver Secretaris uyt den naem van haer Ede tot derselver naerrichtinge le laten insinueren, dat hem sal hebben te verclaren met categorise antwoorde op gemelte Portugesen versoeck, om als dan by haer Ed nader op haer versoeck geleth te werden.  11 d’. ’s morgens, tydigh, maect ’t jacht, der Goes, syn seylen by ende vertreckt van dese rheede naer Bantam, mede nemende voor de vloot eenige verversinge ende benodigde provisien, ende is voor 2 maenden geprovideert om aldaer te kruyssen, als by het brieffjen, door haer Ed aen den commandeur aldaer geschreven, dat is mede voerende ende in ’tgenerale brieffbouck geregistreert staet, can naer gelesen werden.   Omtrent de middagh sent den burger, Arent van der Helm, een cleen letterken aen syn Ed, waerby bekent maect, hoe opstonts twee van syn volek over lant uyt de Morongen, daer syn vastigheyt heeft leggen ende syn volck, die hout cappen, haer des nachts in onthouden, verbaest zyn comen lopen ende verhalen, hoe van de morgen, omtrent vyff uren, een Javaense praeu met 15 cloecke coppen daer onder haer  Original from  Digitized by Google                           NEW YORK PUBLIC LIBRARY 
1659	1659	nyp.33433082429956-seq_0091.txt	18-21 APRIL.                                 15  scheeps heeft leggen; en sullen de Portugesen, die van St. Thome in een jaer na Goa willen vertrecken, passe voor haer ende haer behoeftigheden, sonder meer, op de cust gegeven werden.  Is mede verstaen, indien door den Magolsen broederen oorlogh de wegen na Patna ende Agra noch voor den coopman onveyl blyven, den directeur in Bengalen te ordonneren 5 600 balen zyde doleria voor Suratte op te copen, die vertrout wert, daer ten minsten 1, 2 centen sullen renderen, tot een preuve ; verders aldaer alle tcapitael ende soo ...... sal connen bemachtigen, in zyde te besteden, alsoo door den oorlogh, als gesegt, daer buyten gemeen ten civilen pryse te bemachtigen sal zyn, alsmede sao vele hennip voor Batavia als becomelyck op te kopen.  In vergaderinge mede gelesen ende overwogen zynde het brieffken, op heden door een Maleyer van den outsten broeder van den Sulthan van Bantam hier aengebracht, soo is verstaen, gemelte schryvens, als van een particulier ende niet van den Sulthan comende, door haer Ede niet schriftelyek te beantwoorden, maer den brenger wondelingh tot antwoorde te geven, dat aen Pangoran Arien sal seggen, de Comp wel tot den vrede genegen is, wanneer den Sulthan daer mede toe genegen is ende soo sulex oprecht meent, dat alsdan den tamboer, nevens syn gesanten, hier sent, dat d'selve in alle billicheyt sullen ontvangen werden, als voor dato meermalen laten welen ende daer noch by persisteren blyven; ende op dat deselve redenen mogen gelooft meriteren, soo sal den Maleyer een brieffken van den sabandhaer mede gegeven werden.  19 d’. Op van de morgen den hr. ontfanger ende licentmeester by syn Ede geroepen zynde, stelt deselve ter hant de brieven, van syn Ed in antwoorde geschreven aen den gouverneurs van Patty ende Damack, met ordre die aen gemelte heeren hare aenwesende expresse aflgevaerdigdens te overhandigen ende aflscheyt te geven, welckers inhouden in ’t brieffboeck ingeschreven staen.  Item aen den Maleyer, op gisteren hier met een brieff van Bantam van Keay ria Lara gecomen, met het mondelinge bescheyt, volgens op gisteren genomene resolutie voor ’t affscheyt te geven ende daernevens door den sabandhacr een letterken by te voegen, wat haer Ed meninge zy, die haer wel bekent is.  20 d’. 's morgens, comt den advocaat fiscael, nevens twee gecommitteerdens ende den secretaris van den achtbaren raed van justitie ende den opperchirurgyn van 'thospitael ende maken de heer generaal bekent, hoe hadden gevisiteert het lichaem van een soldaet, die van de morgen, achter ’tsieckenhuys in de groote rivier om hem gegaen zynde, verdroncken was.  21 d’. Soo maect den licentmeester, Symons, d’hr. generael bekent ende overhandight syn Ed met eenen een brieffjen, op heden hem door den Maleyer, op voorgisteren van hier vertrocken met mondelinge antwoorde aen Pangoran Aria Lara, ter hant gestelt, zynde van morgen vroech met een cleen scheppraeutie van ontrent den hoeck van Ontongh Java gecomen, alwaer ses Bantamse ovrloghs tinanghs leggen, om andermael noch een brief van voren gemelte Sulthans broeder aen syn Ed. te brengen, om antwoorde weder daerop aen gemelte Pangoran te brengen.  Welcken brief in ’tMaleyts zynde geschreven, is bevonden, in ’t Nederlants overgeseth zynde, deze zin mede te brengen.  En                                              Original from Digitized by Google                   NEW YORK PUBLIC LIBRARY 
1659	1659	nyp.33433082429956-seq_0046.txt	     he me Ben en  50                 1515 FERRUARIUS.  15 d’. comt alhier ter rhede ten ancker ’t schip, Dordrecht, uit de Bantamse besetlinge ende van daer medebrengende den coopman, Willem Bastingh, hebbende aldaer ’tcommando ende ’tgesach der besetlinge overgegeven aen den coopman, Jacob Keyser, volgens haer Ed ordre.  Gemelten Bastingh verhaelt verder, hoe ’t sedert desselfls jongste schryvens van den 4 deser daer ter besetlinge niet sonders was gepasseert, dan dat den 8en verleden aldaer ’tgallot, Charlois, was gecomen met haer Ed schryvens ende eenige verversinge,. als mede een brieff aen de Engelse vrunden op Bantam, die te syner tyt heeft naer landt gesonden, welckers inhoude uyt het overgesouden affschrift hadde gelesen ende daeruvt haer Kd' mieninge verstaen, die oordeelde hooch nodich was, dat so geschiede.  Soo waren mede door ’t fregath, ’t Wapen van Batavia, ’t gedert twee tinanghs van de wal gehaelt, die tot branthout voor de vloot hadde doen hacken; hy, Bastingh, vermeende, dat de vreese soo in de Bantammers hadde gecregen, dal schier geen vaert meer ondernamen, also haer corts met ’tcleen vaertuygh dapper op te hacken geseten hadde; maer om daer in te continueren, sonder verswackinge van de macht aldaer, soo oordeelde, dat, indien haer Ed" konde goetvinden, dat men de besettinge corter maeckte, als nu geschiede; soo bleeff hy, Bastingh, van gevoelen, de Bantammers soo te benauwen waren, dat naulycx een tinangh soude connen uytsenden, te weten met 5 4 vlotgaende jachten te leggen tussen Pulo Doa, recht west ten zuyden ende oost ten noorden van den anderen; item een dito tusschen het Hollants kerckhoff ende een tusschen beyde de Pulo Doas, dat onder ’t wyser oordeel van haer Ed sodanich voorsloegh.  Den E. Baslingh geeft syn Ede een briefken, door desselffs vervanger, Kevser. aen haer Ed op heden morgen geschreven, over van inhoude, hoe, naer dat op den 8 deser Batavias rhede met ’t jacht Brouwershaven hadde verlaten, soo was hem onderwegen ’t jacht Sluys, zynde om provisien benodicht, ontmoet, die wederom mel hem hadde genomen naer de besettinge, also dessellfs provisien medebracht, doch was eerst den 12en daer aen ter besettinge gecomen, vermits de harde, deurblaesende, westelycke winden, ende hadde haer Ed" schryvens den E. Bastingh ter hant gestelt, die daerop opstonts denselven alle de papieren als verdere victualien, etc. der besellinge, die onder hem, Bastingh, waren berustende, overhardicht; ende was aldaer noch geen gewach sonderlingh van ’tvertreck van ’ttweede Engels schip, d'Advys, werwaerts ’t selve de wil hadde om de steven te wenden, waer mede naer groete syn schryvens affbrack ende besloot.  14 d’. wert des middachs voor het stadtshuvs door ’teerweerdich schepen collegie den gevangen Polo van Balv, Ivffevgen van Hopeko, Chinees, over begane moordadige mauslach gexecuteert; ende wiert levendich op een cruvs gebonden ende alsdoen met gloeyende tangen de twee borsten uvtgenepen ende van onderen op van lidt tot lidt gerabraeckt; ende werde ’tlichaem ’s naermiddachs naer buvten op ’t galgevelt gesleept ende aldaer tot aes der vogelen op een rath geseth.  15 d’. Des middachs wiert door den Ed. heer, Carel Hartzinck, directeur generael van India, by openbaren beeckenslach, ten huyse van den chinesen Cap,  En                                             Original from Digitized by Google                          NEW YORK PUBLIC LIBRARY  
