start_year	end_year	File	Text
1659	1659	nyp.33433082429956-seq_0276.txt	60                      31 DECEMBER.  17 rycxdaelders aen comptanten,  54              de,                    e iserwerck,  670              de.                    TYyS. 18              de. grof porceleyn, 15              de,                     ajuyn.  Volgens de rolle der dootgravers syn alhier in de maent December 70 lichamen van afgestorvene personen ter aerde bestect, uyt de volgende natien:  40 Comp dienaren, 2 burgers, 4 vrous personen, 4 kinderen, 5 Mardyckeren, 2 vrouwen, 12 kinderen, 1 Iyfeygen, Waer tegens hier weder in gemelte maent, so in de Nederlantse, als Maleytse ende Portugese kercke, den Christelycken doop aen 24 kinderen bedient is, namentlyck: 5 kinderen van Europiaense, 16 van Mardyckeren, 5 van lyffeygenen. Soo syn mede in gemelte tyt hier door den echt te samen weder verbonden 7 paer volcx, te weten:            . 4 Comp' dienaren, 1 burger, - 2 Mardyckers. By de rolle, door d’heer lantdrost, Joan Fermant, gehouden, van de hier remorerende Javanen, so is bevonden, dat op heden deselve noch 1437 coppen sterck syn ende syn bescheyden ende wonen, als volght:  50 Europianen,    20 inlanderen.  buyten de Nieupoort, onder den Javaensen cap Zittra........ 464 koppen. by de rivier Grocot, onder den Javaensen cap Schilder. ....... 455    . onder den ouden Javaensen cap" Wangsa Pietsock, ende syn luytenant...... eee eee eee eeen 275      ’ onder de Mardycker burger, Joan de Britte, onder de poort Diest 21    , onder d'heer lantdrost, als burgers ende Chinesen............  84    . (samen... 1457 koppen.  Van primo January deses jaers tot ultimo December daer aen volgende, soo wert bevonden, dat alhier, soo voor als binoen de rivier, met verscheyde coopmanschappen ende goederen van verscheyde, hier om ende aengrensende eylanden, als vaste cust, voornamentlyck van dit eylant, aengecomen syn 1291 inlantse handel vaerluygen van alderhande groote ende kleente, hebbende op gehadt 9080 coppen, welckers aengebrachte, boven verscheyde medicinale Chinese kruyden, cramerien ende fruyten, ten principale in ’t volgende bestaen heeft :  Original from  Digitized by Google                             NEW YORK PUBLIC LIBRARY 
1659	1659	nyp.33433082429956-seq_0289.txt	Pd  REGISTER VAN PERSONEN- EN PLAATS-NAMEN.                 si  So-ko, 97. Spanjaarden, 127. Spanje, 149.  Speelman (C.), 22, 108, 118, 126, 180,  240.  Springer (J.), 118.  Steenhoff (B.), 119.  Stel (A. van der), 215.  (S. van der), 215.  Sterekenberch (J. van), 2.  Sterthemius (P.), 5, 10, 11, 94, 108, 128, 150, 212, 215, 242, 246, 251, 252, 254, 256.  Steur (D.), 3, 51, 108, 118, 215, 252.  Straat Sunda, 7, 11, 25, 24, 120, 155, 167, 175, 177, 189, 200, 201.  Street of Streeter (R.), 8, 5254, 198, 199, 218.  or  Strycker (L), 175,  Suamuy (eil), 257.  Suisen (D.), 209.  Sumatra’s Wk., 56, 65, 92, 124, 164, 176, 178, 248, 255.  Surey, 50.  Swaeb (F.), 243, 244.  Swart (.), 246.     (J. G), 56.  Symon (M.), 185.  Symonsen (S.), 2, 12, 41, 45, 45, 56, 67, 70, 71, 75, 76, 95-95, 98, 102, 1035, 105, 107, 116, 120, 121, 156, 158, 139, 141, 146148, 171, 174, 176, 182, 184, 188, 189, 191, 192, 197, 201, 214, 225, 225, 250, 258, 240242, 254, 258.  Tr.  Tagal, 10.  Taioean, 46, 82, 87, 9295, 97, 105, 111, 115, 119, 121, 122, 128, 1553, 142, 2356, 258, 255, 258, 261.  Tanara (riv. van), 214.  Tartaren, 47.  Tegenapatnam, 251.  Terhorst (H.), 31, 35, 222.  Ternate, 9, 28, 54, 127, 149, 150, 190, 192.  Texel, 138.  Thomas (A), 175, 185.  p (J), 51.  Thomaszen (P.), 69, 65, 99.  Thome (W.), 58.   (SP), 69, 74, 75, 86.  Thonissen (P.), 68, 69, 77, 88, 101, 109, 116, 119, 149, 158, 176, 181, 199, 206, 210, 230, 258, 255.  Thy (J. H. van), 225.  Thyssen (J.), 42, 58, 88, 102104, 117, 121, 164, 176, 215, 215, 228, 229, 293.  DAGH-REGISTER ANNO 1659.  Digitized by Google  Tidore, 9, 28, 127, 190, 192.  Tiebout (W.), 56, 45.  Tikoe, 57, 164.  Timor, 19, 29, 51, 55, 187, 222, 225.  Tjen-ke (nachoda), 58.  Tji-liwoeng, 44, 46. Tjitra (kapitein), 85, 112, 131, 156, 205, 220, 255, 260.   Pada, 4 Toeban, 242. Tomoeti, 17, 18, 22. Tongkin, 82, 98, 256, 245. Eoppers-hoedje, 200.  Troet (J.), 190, 251. Trompert (J.), 2, 15, 41, 43, 105, 108,  118, 158, 161, 215, 215, 216. Truytman (J.), 4-6, 28, 56, 41, 66,  67, 82, 94, 105, 108, 109, 156, 159,  147, 168, 210, 212, 252, 256, 242. Twist (L. van), 5, 10, 145.  Tijgersgracht te Batavia, 152.  18  Original from NEW YORK PUBLIC LIBRARY  ae en Tee oe TTE PT AN   a 
1659	1659	nyp.33433082429956-seq_0260.txt	44                      10 ex 1 DECEMBER.  ververssing te kopen, met ordre hem om de oosthoeck van Japara, werwaerts naer toe wilde seylen om aldaer eenigh wilt te schieten, souden volgen ende bycomen; waer gecomen zynde, soo gonzgh ’t volck, d'eene om wilt te schieten ende d’andre om hun goet te wassen aen lant ende ses derselver in ’t bosch haer op de vlucht naer Japara, die, daer gecomen zynde, hem, resident, verhaelde alles hadden bekent gemaeckt; daerop hy, resident, dan datelyek een bode naer den boom sont om naer t schuytie te sien ende dat met een man vindende, genaemt Michiel Martynsen, synde des Swaechs luytenant, soo hadde hy die man gevraecht, wat daer te verrichten hadde ende waer van daen quam; hadde tot antwoort gegeven, syn groot vaertuygh op Damae in ladinge lagh ende aldaer om eenige ververssinge te copen gesonden was, die hy dan opstonts dede vast setten ende om de andere hadde gesonden, die uyt vreese haer rhede met ’t prautien hadden in zee begeven, die dan datelyck naer schepte ende achterhaelde ende gebonden in de logie bv den eersten sette, nevens twee Portugesen; waerop datelvek hy, Michielsz, svn prau met twaelf musquettiers dede mannen om naer den hoeek, daer ’t vaertuvgh met den Swaeb lach, te varen ; dan hy was al van daer dwers in zee gesteken met een man, genaemt Jan Hanssen, ende noch eenen onnoselen Duvtsman, nevens twee Portugesen, een swarte kock ende een gestoolen swarte jongen, also hv deor de Portugesen verkontschapt was van ’t aenhouden van syn volck in de logie; doch hadde hy, Evert Michielsz, opstonts een vaertuych met den assistent Licton uytgesonden om denselven op te soecken ; dan was naer vyff dagen uytwesens aldaer vluchtelons gekeert ; doch was hem van 5 4 vaertuygen sekerlyek bericht, dat dat vaertuvgh in zee hadden gerescontreert ende dat het syn cours recht na de cust van Bornco stelde.  De Portugesen, over het vangen van haer volck verstelt staende, te meer wisten, den bommel uytgebroken was, soo spoeden haer op ’tseerste om van daer te schepen, hebbende omtrent de waerde van 150 rs aen planeken gekocht, die mede meenden te nemen, dat haer door den resident, also de verkopers aen de Comp' schuldigh waren, belet wiert, sulex sonder planeken mosten vertrecken, doch mel voornemen alvorens, des nachts, ’s Comp logie te willen aflopen ende de twee vryluyden, Cornelis Schuyftangh ende’ Hendriek de Meer,.aldaer in ladinge leggende, hare vaertuygen met vierpolten in den brant te goyen, waertoe rede wel twee picols kruyt opgekocht hadden; dan was haer sulex van eenen Codja, Abrahim, Maccassaa rs paap, afgeraden; want, soo sulex onderstaen hadden, souden noyt tot de helft van haer voornemen gecomen hebben, oft souden van de Javanen al gebonden ende belet syn geweest; soo waren zy, Portugesen, van den 16 der verleden maent met twee vaertuygen, excepto Codja Brahim, die in 4 5 dagen daer naer te volgen stont, als sluypdieven van daer geseylt, naer dat vele moeyten hadden aengerecht om de twee, in de logie gevangen siltende Portugesen ontslagen te hebben, dat hy haer geweygerd hadde, also die in zee genomen hadde ende de Javanen niet en raeckte; echter dat deselve niet soude weeh senden, voor ende aleer ordre van den gouverneur uyt de Mattaram daertoe beeyuam, waermerdle afbrack ende syn schryven besloot.  11 dd’. Tegens den middach comt hier ter rhede seylen ende laet daer het anker druvpen ’( fluytie, Hilversum, comende  droieture, met den E. Zacharias Wagenaer,  En                                              Original from Digitized by Google                           NEW YORK PUBLIC LIBRARY 
1659	1659	nyp.33433082429956-seq_0274.txt	958                                       29-31 DECEMBER.  van schip ende goet, dewyle de zee achter Engelant door Zweetse kapers onvevl- gehouden ende 'teylant S'. Helena door de Engelsen gesterct ende in possessie genomen wert.  Wat aengongh de verdre omstandigheden van't voorgevallene, waren haer gedienstigh gedragende aen de copie harer genomene resolutien ende gehouden extract dachregister, die oversonden, waer mede haer schryven afbraken ende sloten; in ’t jacht, den Erasmus, den 182 September 1659, get. Pieter Gerritsz, ende Vincent Vette.  50 d’. ’s morgens, d'Ed. heer Gouverneur Generael, den sabandaer Symons doen roepen hebbende ende gecomen wesende, stelt syn E. ter hant een brief, aen Tommagon Patty geschreven, nevens ’tgene haer Ed. tot wedergeschenck aen gemelte heer was sendende, om ’t selve aen syn, Pattys, hier aenwesende dienaren te overhandigen ende daermede in derselver name af te vaerdigen.  Van gelycken soo geeft syn Ed. noch twee brieven met bygevoechde schenckagie aen gemelte Symons om d’selve te overhandigen aen de dienaren ende ’t volck van de opperste gebieders van Craoan en Pacalongen, die van meninge zyn mede van daech, beyde van hier, tot hare heeren te vertrecken, welckers afschriften in ’t Batavias uvtgaende briefboeck geregistreert staen.  Op den middach comen hier binnen ’t casteel de soldaten van ’t schip Malacca, op gisteren hier ter rhede gecomen, sterck synde 95 koppen, werdende deselve door den corporacl opgevoert, also den serjant aen de Cabo eeb manslach door nootweer soude gedaen hebben ende derhalven gesloten hier gebracht wiert.  Welck volck, door haer Ed. verwellecomt ende tot weldoen, alsmede haer voor den Indischen dwanck voor eerst te wachten vermaent hebbende, werden door t guarnisoen v erdeelt.  51 d’. ’s morgens, seylt van hier naer Bantam ’(fluytie, Cortenhoeve, met den coopman, Sr. Dirck van Lier, geordonneert om den brief, van haer Ed. aen den Sultan geschreven, te overhandigen ende by dien vorst te insisteren, dat de restitutie der wechgelopen slaven volgens de jongste besloten vrede articulen gelieft te doen cracht nemen ende effect sorteren; soo neemt gemelte van Lier mede een brief aen den agent van de Engelsen aldaer, d’heer Edwarts, in antwoorde van desselfs schryven, rakende de voorgevallene questien tusschen ’s Comp dienaren ende de Engelsen op Jamby; item een dito aen ’s Comp' resident, Fredrick Hendrick ; wat haer Ed. by derselver gemelte letteren aen den Sultan, Engelsen ende ’s Comp residenten tot Bantam, als ’t gene gemelte van Lier by derselver schriftelycke instructie t'syner gouverno in mandato geven, werden alle onder desen datum gevonden in ’t Batavias uytgaende generale briefboeck naer te lesen.  Gedurende dese maent December, soo syn van de hier om gelegen Javase handelplaetsen 98 stucx inlantse handel navetten aengecomen, buyten 2 jonckjes, Leene van Quinam ende ’tander van Tayouan, ’tleste den hier wonende Chinesen coopman, Sjoocko, toebehorende; ende hebben van daer mede gebracht ende hier ter vente gepresenteert de naervolgende coopmanschappen ende goederen:  14 stucx Iylfeygenen,  bi  Original from  Digitized by Google                    NEW YORK PUBLIC LIBRARY 
1659	1659	nyp.33433082429956-seq_0248.txt	252                             26-28 NOVEMBER.  Item ’t gene door d’heer gouverneur, Joan Thysz, op Malacca daerinne voor Batavia doen schepen is, bestaet in 2194, picol chappanhout ende 547 picols, 77 cattys suiveren peper, als 260 stucx beschadighde musquets ende 16 vuirroers, tsamen ten bedrage van f 10520:14:9.  Met gemelte bodem becomen haer Ed schryvens van de heer gouverneur Pith ende den raedt. uyt Paleacatte, ftem van de opperhoofden van Masulipatam, item van d'heer Rykcloff van Goens, over de cust geschreven, als mede van de opperhoofden van Jaffenepatam, ende laestelyck van d'E. heer gouverneur, Joan Thysz, ende den raad van Malacca, alle welckers inhouden onder dato deser in de aparte sommier verhalen van Chormandel, Ceylon ende Malacca naer te lesen zyn.  Met gemelte Mars becomen haer Ede mede een briefien vande E. van der Laen- ende Truytman, gedateert 42 deser, seylende over de droochte ende naer binnen de Palembanghse revier, waer eerst op dien dach, naer 17 dagen stribbelings, met de vloot aengecomen waren, de schepen ende ’t volck der besettinge wel hadden bevonden, doch uyt d’opperhoofden, also daer niet voorgevallen was, het minste van ’s vyants constitutie hadden connen vernemen; dan hadden zy, besetters, eenige vaertuychjes met allerhande leefftochten becomen, daer ’t volek meest van ontvlucht was; ende also sy haer op haer schryvens vaerdigh vonden om naer boven te seylen met de geheele macht om haer commissie te volvoeren, soo waren (Godt der heyrscharen biddende, hy ’s Comp wapenen doch genadelyek aldaer met victorie geliefde te segenen; ende alsoo sy ’t Seepaert daer alle uyren om naer Batavia te seylen waren wachtende, soo hadde goetgevonden ’t gene verhaelt is, haer Ed te beclachtigen; ende braken aff.  Des naermiddachs wiert in de vergadersaal van de hooge regeringe van India alhier by openbare verhoginge aende meestbiedende, die daertoe, als de gequalificeerste door een ondercoopman ende d'andere door den bode ende ’t becken, genodight waren, vercocht de boecken, by zalr d’E. heer Adriaen van Aelinonde, in syn leven raadt ordinaris van India, naergelaten; dan wierden de principaelste, door dien niet wel het costende in’t patria conde halen, opgehouden ende onvercocht gelaten.  27 d’. Tegen den middach wiert ten huyse van Bingam, cap" der Chinesen, door d’heer directeur generael, Carel Hartzinck, ende d’heer ordinaris raad, Arnold de Vlamingh van Oudtshoorn, ten overstaan van d’E. heeren ontfanger, bailliuw ende lantdrost, als gecommitteerde heeren Schepenen, opgehangen den pacht van’t gemael van ’t coorn met ’sComp' molen; ende wiert by openbaren afslach gemynt by den burger, Robbert Silliart, voor den tyt van 15 maenden, primo December aen vanck nemende, tot 225 rycxd. ’s maents, makende 8100 gulden in ’t jaer, op sodanige conditien, als hy ’t generale resolutieboeck onder 51e" deser can naergelesen werden, zynde acht duysent een hondert gulden ’s jaers.  28 d’. is in vergaderinge van India goetgevonden ende vastgestelt den equipagie meester te ordonneren ’t jacht, de Mars, alhier voor gisteren van de cusl aengecomen, spoedigh claer te laten maken om voor ’t vaderlant geballast te werden, tsy om by langer tardance van ’t jacht, ’t Zeepaert, dat naer Jamby om peper is, alsdan voor d'eerste hesendinge, in plaetse van gemelte jacht, te connen dienen ende  -  En                                              Original from Digitized by Google                           NEW YORK PUBLIC LIBRARY 
1659	1659	nyp.33433082429956-seq_0089.txt	17 ex 18 APRIL.                    73  besloot, naer groete ende wenschinge van heyl affgebroken ende gedagteeckent hadde als voren. Volght het translaet uvt het Engels van ’4 protest, door d'Engelse hooffden van t jacht, de Coopmans Vermaeck, voor Bantam aen den commandeur onser besettinge gedaen, ende luyt, als volght : Naerdien het schip, Coopmans Vreuchde of Vermaeck, Thomas Bel commandeur zynde, affgevaerdight was op den 6r" dach van February 1658 door den eerwaerdigen Thomas Chambres, agent, etc, consul van ’t fort St. Joris, voor de eerlyeke Engelse Oostindise Gomp van 'tnieu generael vereenight capitael van Porto Novo op de cust Chormandel, met ordre van directelycken ’t seyl te gaen naer de haven van Bantam tot ontladinge van een notabel cargasoen van goederen en coapmanschappen, geconsigneert aen den eerwaerdigen agent, etc, aldaer consul synde voor de Engelse Oostindise Comp.; ende naer dien dito Thomas Bel, in vervolgh van gemelte ordre, (met Gods toelatinge) dit gemelte schip gebracht heeft op den 2ter deser voor de rheede van Bantam, om naer te comen de ordre van den gemeltn agent, etc, consul van het fort St. Joris, tot ontladinge van de goederen, die aen boort waren, maer geweygert was tweganck op de gemelte rhede door heer Jacob van der Meersche, admirael van de Duytse schepen op die rheede, beyde, hy selffs ende de resterende schepen, schietende verscheyde scheuten naer ons, soo dat wy gedwongen wierden te anckeren ende alsa verhindert ende geweygert de ontladinge van de goederen voornoemt, uyt kracht van een order (gelyck hy seyde) ontfangen te hebben van den generael van Batavia voor de Nederlantse Oostindise Comp, tot groote schade ende verlies van de honorable Engelse Oostindise Comp, derhalven ick, gemelte Thomas Bel, maecke myn wettelyck protest ten voorbate van gemelte Engelse Oostindise Comp, de eygenaren van gemelte schip ende alle anderen, deser aengaende, tegen den gemelten admirael Jacob van der Maersche, den generael van Batavia en de gem'e Nederlantse Oostindise Comp voor alle verlies, schaden ende verhinderingen, soodanigh als sy souden mogen syn, dewelcke ter oorsake van gemelte schips ophoudinge van te mogen ingaen in gemelte haven van Bantam, om dien volgens syn goederen te leveren, sullen oploopen, voor de gemelte Engelse Oostindise Comps, de eygenaers van gemelte schip, Gooprmnans Vreughde, ende alle anderen, die het aengaen; verclarende, dat gemelte Nederlantse Oostindise Gomp verplicht syn om satisfactie te geven voor alle verlies ende schade, hoedanigh die oock zyn mochte, dewelcke daer door sullen geleden syn; met getuygenis mynder hant gedateert aen boort het schip Coopmans Vreuchde, den 28" dach van Maert 1659; was geteeckont: Thomas Bell, verder stont: aldus geteeckent, gepresenteert, gepubliceert in tegenwoordigheyt van Jonathan Led, Jan Andrews. 18 d’. comt den hr. ontfanger Croon ende den licentmeester syn Ede bekent maecken, hoe alhier, binnen de rivier, met een cleen-vaertuygh aengecomen is een Maleyer, zynde alhier woonachtigh, hebbende vrou ende kinderen, dewelcke haer E. hadde verhaelt, hoe met syn prau voor weynige dagen van den Bantammers was  Original from  Digitized by Google                   NEW YORK PUBLIC LIBRARY 
1659	1659	nyp.33433082429956-seq_0062.txt	46                            Jl MARTILUS.  ververssinge, voorts dat haer geene tsamen sprake off conferentien langer sal mogen vergunt ende gegeven worden.  De jachten Bloemendael ende Koukercken, nevens noch een te noemen jacht, als twee oorlogschaloupen, tot besluytinge van de Palembangse revier met hare spruyten, derwaerts tot vervangh der aldaer zynde jachten, de Zeehondt ende de Marya, aen te leggen ende, soo tydigh gereet sullen zyn, derwaerts te laten seylen.  Ende is mede vastgestelt d'opperhooffden der gemelte jachten, de Zeehont ende de Maria, te gelasten, wanneer voor Palembangs revier opbreken, dat alsdan na de rivier van Jamby sullen zeylen om van daer een ladinge der aldaer gereet leggende peper en passant mede te brengen.  terr een twee handige jachten, nevens sooveel oorlogs chaloupen, tot besluytinge van de Benjermasserse revier tot weringe van den peperhandel, die sy met den Macassarees, als andere zyn dryvende, aff te steken, also de Comp op die natie over begane moort ende aflopen harer schepen ende volck, voor eenige jaren begaen, noch een rechtvaerdige actie heeft, om alsoo door dat middel te sien den vremden handelaer van daer geweert ende den peper aen de Comp alleen can gelevert werden.  Ten jongsten is by haer Ed mede gearresteert de corps du garde, die onder de punt Grimbergen, aen de oostzyde van de kant op de groote rivier is leggende, als onnodich zynde, door dien aen d’ander zyde van de brugge de poort en de punt Diest is leggende, daer een hooftwacht leght, aff te breken ende wech te laten nemen.  8 d. 's morgens wierde door den raad van justitie den misdadiger, Frederick Metsker, over dootslach den scherprechter overgelevert ende ter gewoonlycker plaetse met een sweerde ter doot gebracht, als mede eenige soldaten over ’t by nacht absenteren van hare punten als op schiltwacht slapen gestropieert; oock eenige gaudieven gegeesselt.  Naer middachs comt hier ter rheede ten ancker een jonck, alhier thuys horende, komende van Johoor, hebbende en passant op Malacca aengeweest, welckers nachoda verhaelt, hoe eenige Chinesen van Malacca was medebrengende, die aldaer van Tayouan aengecomen waren ende een schip van de Comp, dat door hart swaer weder van Tayouans rheede met verlies van drie anckers verdreven was; ende dat aldaer drie dagen daeraen noch drie schepen op Malacca van Tayouan behouden waren aengecomen; ende braght geen brieven van den gouverneur aen haer Ed mede, alsoo eerstdaeghs een schip van daer herwaerts stont te komen.  Den nachoda verhaelt mede, hoe in Johoor een jonck, in China thuys horende, was aengecomen, met meypinge om syn ladinge aldaer om te setten, van welckers nachoda verstaen hadde, datter mede met hem een joncke uytgelopen was om op Malacca te handelen; oock datter wel ses seven joncken op Aymuy voor Batavia in ladinge lagen, dat den Chinees hier vry courageert ende moet geeft.  9 en 10 d’. is alhier niet waerdich te stellen voorgevallen.  11 d’. ’s morgens, seylt heel tydigh met de lantwint van dese rheede naer de Bantamse bessettinge het jacht, der Veer, om aldaer eenigen tyt gebruyckt te werden, waermede den E. majoor van Dam eens een keer derwaerts toegestaen  En                                              Original from Digitized by Google                     NEW YORK PUBLIC LIBRARY  
1659	1659	nyp.33433082429956-seq_0076.txt	60  31 MARTIUS.  290 lasten rys,  5  padie, 11, sagou, 1 last sout, 1  boonties, 6820 picols peper, 11, lange peper, 730  swarte suycker, 111,  anys, 106  taback, 210  benjewin,  40 a thin,  8  drakenbloet, 7  hartevlees, d commer,  2  Ivnsael,  1  cardamon, 2    caltoen,  78 stuex koebeesten,  7  hartebeesten,  19  bocken,  16 gansen,  9075 eenden ende hoenderen, 5500 allerhande, koock-, drinck- 910000 oude pinangh, 4480    , clappus, 15560 dammers, 6920  cadjangs, 1820  Javase maties, 180  rys wannen ende manties, 650  ysere pannen,  40  copere the ketels, 2000 allerhande groff posteleyn, 1000 drooge visch,  12200  soute eyeren, 1050 kuyt, 7000 ingesoute vissies, 360  doelangs, 475 riemen ende bengaven, 6500 bossen suycker, 1350  tamberinde, 10000  loock, 5006  ajuvn,  Digitized by Google  ende kalek-potten,  Original from  NEW YORK PUBLIC LIBRARY  nn en ne ng en eee 
1659	1659	nyp.33433082429956-seq_0116.txt	100                                           16-18 MAYUS.  den voorgemelten Maleyer onder anderen verstaen hadden, dat gemelte schip niet in Lampon, maer seer verre boven in een seer groote rivier was opgehaelt ende daer soude laden; tot opsoecken deselffs, soo soude op daegs naer syn schryvens de visite aldaer rontomme door ’t jacht Domburgh laten doen, doch bleeff van gevoelen, sy die bodem niet licht souden vinden, alsoo het lant daer seer gebroken is, veel eylanden, spruyten ende inhammen heeft, die men met soo een jacht (als niets te schoon daer synde) qualyck can doorsnuffelen, daer by comende, het in vyanden lant is, sulcx daertoe beter eenigh cleen, sneedigh vaertuygh soude vereyssen, daer dan noch al peryckel in gelegen ware.  By aldien den Maleyer nochmalen weder aen syn boort om antwoorde quame te verschynen, soo soude hem, volgens ordre, een corte antwoorde geven.  Het uyt- ende invaren der oorlogs prauwen ende vissers, als ander cleen vaerluygh, uyt en in Bantam seylende, conde by de beset tinge niet beleth ofte voorgecomen worden, alwaer ’t,dat de besettinge noch ende nochmalen grooter ware, als nu is, wanneer alsdan by nachte over de vlacke gronden souden lopen.  Op 'tsluyten syns schryvens, soo quam den Maleyer andermalen aen boort, die syn E. den ingeleyden in ’t Duyts ter hand stelt, met mondelinge versekeringe, ingevalle haer Ed. conden resolveren brieven van versekeringe voor de Bantainse gesanten te senden, sy bereyt syn alsdan opstonts naer Batavia te comen, waermede affbrack ende besloot.  Het briefjen, door van der Meerssen boven van gemelt, van Bantam aen syn Ed. geschreven ende door den Maleyer overhandight, volght hieronder:  5", Jacob van der Meerschen, Admsirael.  Dese weynige regulen dienen eenelyck om UE. bekent te maken, dat den Sulthan jegenwoordigh volcomen macht aen Pangoran Papaty Tommagon  Ranta Baggus ende Keay Kandouroan heeft gegeven, om in de saecke van  vrede tusschen haer Ed. van Batavia ende haren Coninck te handelen, sonder  datter eenige andere grooten aldaer haer sullen mede hebben te bemoeyen ; tselve versoecken dese bovengenoemde grooten UE. by gelegentheyt aen haer  Ed. op Batavia gelieft bekent te maken. In de stad Bantam desen 12 Mey  1659. Onderstond: met haest uyt den naem vande bovengemelte personen.  17 d’. Den Mardycker, alhier op gisteren uyt de Moronde met een briefjeu aen haer Fd. van den fabrycq Liftingh gecomen, keert op heden weder derwaerts, medenemende een brief van haer Ed. aen Liftingh in antwoorde, staende in ’t generale briefbouck geregistreert.  Tegen den middagh wiert alhier door den achtbaren raedt van justitie deses casteels eenige militaire misdadigers drie malen gestroppieert ende eenige gegeeselt over moetwille ende dieverien.  18 d’, retourneert hier van Moronde ’tjacht, den Zaphier, geladen met branthout, dat aldaer geladen ende ingenomen heeft van ’tvolck van Sr, van der Helm, waermede hier wederkeert ’s Comp' fabryck, Johannes Liftingh ; ende rapporteert  Original from  Digitized by Google                           NEW YORK PUBLIC LIBRARY 
