start_year	end_year	File	Text
1643	1644	pst.000053235183-seq_0151.txt	OCTOBER 1644.                                           133  De conspirateurs door hem becomen, had int aensien van de Joorse gesanten doen executeeren ende van leven ter doot doen brengen. Gemelte gesanten hadden haer in hun aenwesen tot Malacca seer stouwt ende onbetaemeliek aengestelt ende waeren dese gesanten den 24 October soo haer gelieten met contentement vertrocken.  Met Rombou ende Nanningh wast noch als vooren, onlanex hadden noch eenige slaven van de inwoonderen uijt de N voorstadt gerooft, in somma de RKombouwers benauden sijn E., des wenschte dese rebellen hacre verdiende straffe konde doen ontfangen.  De Perasche gesanten waeren sonder brieff off antwoort te geeven werom vertrocken. S" Walraaven was haer met ’tjacht de Maccareel gevolcht om te sien off met den econinek een contractken treffen ende ons den handel alleen gunne, soo ja was hem gelast de besettinge van voor de revier te doen vertrecken ende wederom een comptoir te restabilieeren, doch dat alles voorsichtich most aenleggen ende goede contracte maecken.  Den commissaris Vlamingh had in Aetchin omstandelicken gerelateert, ende gesocht de besettinghe voor Perach smaeckelick te maecken, maer wert hetselve gansch qualick genomen ende soude tselve noch meerder onlust hebben veroorsaeckt, soo d'’coninginnen ’tselve voor waerachtich had connen aennemen , maer hadde gesecht die van Perach altemet op onwaerheijt bevonden had.  Evenwel acht Peras besettinge noodich, want Perach was de welvaert van Aetchin, ende daerom soo noemdent de coninginne haeren lusthoff ende most geconsidereert worden soolangh Perach floreerden soo was Aetchien Malaccas verderff, want wat door den opulenten toevoer der Mooren over Aetchin naer Perach wort gevoert ende daerdoor alle de omleggende plaetsen gans met doucken vervult wierde, most Malacca missen; ende tot contract te comen gelijck met die van Queda geschiet, die wel sien dat haere neringh daerdoor begint te mineeren, daertoe sullen niet raecken, alsoo d’ coninginne daertoe niet souw willen verstaen. Daerom nochmaels oordeelden de besettingh gewichtich was ende oock perijckel liep soo niet de besetting gecontinueert wert de Aetchinders daer macht tegens brengen (en d'onse souden doen wijcken, echter daerop te letten stont.  Dat sijn E. d'Aetchiensche gesanten tot Malacca met den E. Vlamingh gecomen utloopich voorgehouwen had om wat reden t comptoir Perach gelicht ende de rivier beset was, om redene dat sijne voorsaet soo hij oock dede om een bondich contract met de radia te maecken gesoliciteert had, om door dien middel eenich proffijt uijt dien handel te trecken, doch daer nooijt toe had connen geraecken ende alles te vergeeffs was geweest, daer tegens soo gefacxeert dat geen voordeel hadden connen doen ende bovens dat vrunden van de Neerlanders vijanden waeren gebleven, waerop hun geseijde gesanten modest getoont hadden ende niemant in het ongelijck gestelt hadden ende dat voornemens waeren de Generael sulcx te comuniceeren.                                                Original from Digitized by Google                                    PENN STATE 
1643	1644	pst.000053235183-seq_0145.txt	MEI JUNI 1644,                                            127  dat van s te suparbe ende voor hem incompatibel was, dat met ander te seijn- den hoopte voor te coomen.  In Quede wast slecht gevallen, communiceerden dat de Siamsche beroer- ten daer van d'’oorsaeck waeren, doch 't was hoet wilde, 't voor desen aldaer genooten respect was heel achter de banck gestelt, d ooranghcaijs hadden om geringe oorsaeck eenen Nederlantschen jongen selffs gestraft ende voorgegeven dat een ider in gijn eijgen lant gelijck wij oock deeden justitie mocht doen, sulex altijt geobserveert hadden, in somma alle desen hoop wenschen ons off met het heelle off halve eer quijt waeren.  d'Effecten van tcomptoir Queda bedroegen op Walravens scheijden f 40676.0.5, ende d utstaende schulden f 22308 2,  In Oudiangh Salangh resteerden per cargasoen de somma f 30213.5.9, ende aen uijtstaende schulden de somma van f1i1148.8.4, dat mede al veel was,  In Perach waeren de schulden cleen ende d'effecten van daer gecoomen monteerende de somma van f 4175.2.2, bestaende in divarsche grove waeren.  Walraven had in Quede gecontracteert dat hem binnens jaers 100 bhaer peeper tot 22 reaelen d'bhaer soude leveren ende gaff den selven hoop dien handel daer dapper multipliceeren soude.  In Oudiangh Salangh souw naer S" Walravens rapport in December aenstaende ende eerder niet omtrent 100 bhaer tin in voorraet wesen, des voor- nam de te coome schepen uit Taijouban int gaen paer Cormandel, Souratte ende Parsia die plaetse te laten aendoen, ten eijnde het tin van daer haele ende ter gerequireerde plaetse brenghe.  Den 28 Junij passado had sijn E. andermael advertentie becomen de eruijssende jachten 4 mijlen bij noorden Malacca twee Engelse scheepen, nament- liek een fluijt genaempt d'Hiade ende een jacht het Seepaert gemoet ende ver- sproocken hadde, alsmede naer Maccao tendeerende doch eerst Malacca soo voorgaven wilde aendoen, doch alsoo sijn E. dubieerden aent effect van dit haer voorgheven, hadde met den E. commissaris advies alle de scheepen doen onderseijl gaen omme d'aengetogen Engelsen ter reede te brenghen die anders 800 met haren hoogen cours genouchsaem bewesen hadden Malacca souden gepasseert hebben ende nu niet connende escapperen ter reede quamen, alwaer sich gedachte Snouck aen boort transporteerden en de visite mitsgaders dat d'opperhooffden gelieffden naer den gouverneur te varen geproponeert hadde. Teene namentlick de visiete was bij bun willich geconsenteert, maer aen lant te gaen gexcuseert, alsoo haer soo seijde van hunnen president verboden was ergens aen te loopen, off uijt de scheepen te gaen. Kvenwel naer veel cavilatien over ende weder voorgevallen waren eenige smalle jonckers beweecht geworden haer naer den gouverneur te transporteeren, daer seer wel onthaelt ende sij in- tegendeel seer trots ende hoochmoedich geweest sonder eenich geheijm te open- baeren ende des anderen daechs sonder imants weten werom naer boort gevaren  .                                              Original from Digitized by Google                                   PENN STATE 
1643	1644	pst.000053235183-seq_0192.txt	174                             PERZI  hier op dato per gemelte Engelse Swaene aengebragt, wort vernomen dat sijn E. meest alle de coopmanschappen, uijtgesondert de 80 lasten peeper die 't pack- huijs bewaerden ende laeckenen met de dupperaes bedragende f 28305.18.1, die (ultimo Meij nevens den ondercoopman Nicolaes le Gouche naer Spatan om den mercktprijs te halen opgesonden waeren, vercocht hadde. 'tSweeds en Ongers (') cooper was tot 50 larijnen de 30  gedebiteert. Den Persiaensen coningh Chasophie was den 11 Meij in Cachian vier dagen reijsens van Spahan over- leeden. Des oudsten soon, 12 a 13 jaeren oudt sijnde, op den 15 dito te Chachian als coningh van Persia in sijn vaders plaets gecroont, deswegen den E. Geleijns nodich achten sich derwaerts (om continuatie ofte renovatie der ver- cregene ende meer vrijheeden van sijne Maij' te verwerven) met een tamelijcke schenckagie transporteerden. Hij wierd voor een goet naturel en vrundt der Christenen gehouden ende met den naem van Choabas na sijn grootvader vereert. Of dese veranderinge int rick iets voortbrengen of jalosie onder de groote veroorsacken soude, moste den tijt openbaeren. d’ Comp stond in reeckeninge met den overledene coningh effen en of d’ Engelsen hun competerende souden becomen sonde men eerlangh vernemen. Bij d’ nieuwe boecken bleeff Persia noch f 570560.13.14 an't Comtoir generael schuldigh. Den ondercoopman Lagouts was 13 Junio in Laar aen den heete coortse overleeden endo d’caffilla onder d’ op- sichte van twee adsistenten den 15 dito van daer naer Chiras vertrocken. Soo had den E, Geleijns den 5 Julij sijve reijse van Gamron naer Spahan aengevangen, alwaer den 5 Augusti aengelandt ende sijn Maij' (doordien naer Casbijn 9 dagen reijsens van Basschan vertrocken was) niet beliep. d’ Geruchten gingen dat desen nienwen coningh sich van daer naer Misschet omtrent 50 dagen wegs van Spaban vervoegen soude, deswegen sijn E. den raet beroepen en in consideratie gegeven heeft wien men best tot verrichtingh van Comp' affairen ende begroe- tinge van sijne Maij', ten aensien vooreerst niet in Spahan te verschijnen stond, derwaerts soude afvaerdigen, vermits den E. Geleijns soo langen tijt om die besoignes te verrichten niet om de comste der scheepen vaceeren conde. Soo was bij den raet beslooten dat men den oppercoopmau Hendricq van Tuijnen ende den ondercoopman Hendrick Walchaert en Bartholomeas den toleq met de geordoneerde schenckagie tot begroetinge van den nieuwen coning Chia Abas ende verdere verrichtinge van Comp' affairen aldaer naer Casbijn met behoorlijcke instructie depescheeren, dienvolgende den 21 Augustus huane reijse aenvaerden souden. d’ Opgesondene laeckens ende dupperaes bleven in Spahan uoch onver- cocht, soo conde ’t gemaeckte coperwerck op verre naer sijn costende niet haelen. Voor d’ Cambodjaes cardemon wierd geen geldt geboden, d'olij van specerijen was daer piet getroekken, d’ confituijren ondienstich; op d’'Agraes lijwaten hadden d'’ecooplieden naulijcs 8, 10 a 15 p' avance becomen. Seecker caffila 200  (1) Hongaarsch.                                                Original from Digitized by Google                                   PENN STATE 
1643	1644	pst.000053235183-seq_0186.txt	168                            SURATTE  directeur Croock ter handt gestelt ende vereert. Sijne Maij' versocht door d’onse in Japan twee palkijns volgens d’ modellen vier mael soo groot met constich gecouleurd lackwerck mochten gemaect en eenige fijne laeckenen van die couleur als d’ monsters uijt . . . .() ontbooden en derwars gesonden werden, dat hem aengenaem wesen soude. Soo thoonden sich mede begerich naer 5 a 6 stux Nederlantse paerden, 't welck sijne Maij' door d’h" Assaletchan ende d'onse ten deele uijt het hooft gebracht, doch daerover te schrijven bevolen was.  Wat andtwoort sijne Maij' den grooten Mogol op d’hier vooren geinsereerden brieff aen den h" Gouverneur Generael geschreven, ende hoe de firmannen verleent heeft, can hieronder vervolgens bij de copijen der translaten geleesen werden.  Doorlughtigen Hooghgebooren Heer.  Uwen naem onder de helden is uijtmuntende, en staet int centrum van Uwe natien. Sijt verseeckert van mijne genegentheijt ende conincklijcke gunst t uwaerts, d’ missive en geschenck ’t welck UE. gesonden hebt, is gecomen voor mijnen throon, alwaer is de vergaderinge van alle grootsten van de werelt, welcken throon is uitmuntende booven alle waerheden ende is soo hoogh als den hemel van der aerden. Den inhoud van UE. missive daeruijt gesien hebbe de gonste ende genegentheijt tonswaerts, heb met groot contentement gelesen ende oock ontfangen. 't Is altijt noodich de vrundschap te onderhouden ende vermengt sij met toegenegentheijt ende proffijt. Oock bewaert worde in de handt van de fidele, ende dat met een oprecht ongeveijnst herte, Alle coopman- schappen onder UE. gewelt sent gedurich in mijn coninckrijck. Geschreven den 14 van Soban den 17 van mijn rijck, ende in’t 1052 jaer naer Mahometh op een saterdagh.  Translaet van ’sconincx firman, nopende de thollen in Souratten , geschre- ven den 11 dagh van de maent Rammasan van sijne regeringe A 16, ende van Mahometh 1052,  De Hollanders sijn gecomen voor de poort van 'sconinx hoff, ende door hulp van haer favoriten (staende onderaen de voet van sijnen throon, welckers luijster is gelijck de son, ende streckt tot aan den hemel toe) in’t gesichte van den coninck, ende hebben door d favorijte gedoleert, dat sijn dienaer (in Souratta regerende) hun in't verthollen der goederen die in Agra ende Amadabath incoopen ende in Souratta brengen, veele travaillie aendoet ende versocht, dat sijne Maij' gelieve door sijnen divan daerop soodanige wijse te stellen ’t welck de tollenaers in Souratte sullen moeten volgen ende soodanigh aen sijn Maij' weder in reeckeninge brengen. Daarop heeft den coninck gemandeert dat de thollenaers haer  (1) Onleesbaar.                                                Original from Digitized by Google                                   PENN STATE 
1643	1644	pst.000053235183-seq_0190.txt	172                            SURATTE  134 blasen met confituren. 559 balen caneel, 30 October per d'Engelse Swaen uijt Goa gebracht. 106 sacken Mallebaerse peeper.  43 packen notenmuscaten.  12 d eattoene gaeren.  10 vaten canfager.  8 d Spaens groeu.  20 packen borreborrij ende pertij Bantamse peeper, behalven noch 3542 packen, balen, blasen ende sacken met diverse coopmanschappen door particu- lieren na Engelant gesonden. Soo hadden die vrunden van Gamron ende Bassora A passado per hunne jagten Zeehors, Prospees ende Coilin 1400594 Realen becomen , twelck met hun hiervooren verhaelde aengebrachte 200.000 R' 3400594 R" contant uijtmaken sou, waermede ongetwijffelt een groot gedeelte der 960000 haerer opgenomene ropias souden connen afleggen. Die van Courtijns Comp' was hun verrigten int Visiapourse rijck weijnich te beduijden; waeren met die van d'oude Comp'" gans viandich. Den 8 Februarij waeren hunne scheepen de Discouvre en Suplij met partije cleeden en 927 packen Moorse vragtgoederen uijt Suhalij's com naer Gamron genavigeert.  De fluijten Uitgeest en ’t Vliegende Hart arriveerden 26 Februarij van Gamron in Suhalij's chom met wat Mochaes als ander cargasoen, bedraegende f 17671.15.14. Gemelte Uijtgeest soude half Maert naer Mocha God te voorste verseijlen. Op den peeper met Uijtgeest daer gecomen was volgens de Persische factura 4 percento onderwigt, dat veel is, bevonden, 'twelck den vercoop beswaeren en de winsten daerop veel verminderen soude. Alle soorten van lijwaten waeren ia Persia ontrent 12 per gedaelt, gulexs d’Comp de verhoopte avance op d'Agraes doecken per Leeuwarden derwars gesonden niet becomen sal, waerdoor haeren eijs van lijwaten licht wat besnoeijen moghten.  Den commandeur Croocq, wiens huijsvrouwe den 29 November 1642 over- leden is, neemt de maentelijeckse 30 gl. verbeteringhe sijner gagie dancklijck aen ende continueert met sijn versoeck, siet sijn vervanger met de van hier ver- treckende scheepen tegemoet, opdat in April 1644 vandaer herwaerts keeren moghte. D'oppercoopluijden Cornelis Weijlandt, die een jaer over gedient heeft ende Arent Barens, wiens tijt mede geexpireert is, versochten oock haere ver- lossinge, 't welek hun lieden na Croocq's opinie wel sonder schade van de Comp conde ingewilligt werden, vermits den coopman Verburgh naer Agra ende Jan van Teijlingen in Amadabath met opmerckinghe om die oppercoopmans plaetsen door becomene oudervindinge te zijner tijt waer te nemen gesonden hadde, soo was door hem den ondercoopman Kittesteijn op aprobatie van d’h"" Gouverneur Generael ende Raden van India voor coopman een tractement van 70 gl. smaents toegevoeght. Den ondercoopman Juliaen Holscher wierd in Brodra ende Brootcha  Original from  Digitized by Google                                   PENN STATE 
1643	1644	pst.000053235183-seq_0184.txt	166                             SURATTE  dan te ordonneeren dat goodanighe onhehoorlijeke tacxatien moogen afgeschaft werden ende de goedren volgens factura als ten tijde van sijne Maij' ende sijn b" vader hl. m. firmannen verleent moogen passeeren, alsmede dat sijne Maij' firmannen, die door verloop van tijden bij veele niet geobserveert en werden (waervan d'onse kennisse hebben ende sijne Maij' aenkundigen sullen, vernieuwt ende beeter geobedieert moogen werden, jae soodanich dat wederomme sijne Maij' niet moeten lastich vallen. Welek doende sijne Maij' ons sal verobligeeren , sijne landen meer ende meer te doen frequenteeren ende sodanich te sijnwaerts geneegen maecken, dat Godt den Heere voor sijn persoon sullen bidden, onder wiens schaduwe alle justitie connen becomen.  Een Ceijlons oliphant, een copre staende candelaer, eenige stucken laeckenen ende anders die wij aen onsen commandeur Paulus Croock gesonden hebben, sullen aen sijne Maij' overhandigt worden.  Hiermede beveelen sijne Maij' in de genadighe protectie des Alderhoogsten. Onderstond, sijne Maijt' oodtmoedigen dienaer, was get. Ant’ van Diemen. Ge- schreven int casteel Batavia adi p" September 1642.  Waerop sijne Maij' datelijck ordre aen Isaacq Beeck gaff, dat hij den- selven de onse om in Persiaens te doen translateeren ter handt stellen soude, twelck geeffectueert ende andren daegs sijn Ed' in die taele ter handt gestelt wierde, gevende ordre aen Seechsadul om naer die saeke bij Mirmosa en Hakim Masijd Somma te vernemen, dat geruijmen tijt aengeloopen ende tot den 29 October noch niet volbracht was, waerbij 'tachteraen loopen des hoffs wel af te meten stonde. Ten selven dage als wanneer den brief en schenckagie aen sijne Maij' overgelevert waeren, wierd de candelaer andermael door d'onse op een plaets genaemt Gosselhamme in des Maij" en alle de grooten tegenwoor- dicheijt tot desselfs verwonderinge opgeseth. Sijne Maij' deede op stondt alle de goudt ende silversmits ontbieden, gelastende haer twee derselver soo van goudt ende gelijcke twee van silver te maeken, twelek des andren daegs int werck gestelt ende begonnen was, doch waeren die werckhaesen beducht geen eer veel min voordeel daeraen te sullen behalen. Den 4 November had Seechsadulla in jegenwoordicheijt van Mirmosa rapport over die saecke vant vertollen en taxceren der goederen ten ondienste van de Comp" aen sijne Maij' gedaen, verhalende dat Mirmosa (ongehouden wesende de goederen voor den incoop te vertollen) noijt meer als recht was van de Comp" genomen hadde, 't welck den mogol t'sijnen voordeel mede doenmaels soo begreep, dat d'onse bij den hartogh Assaletchan deede clagtich vallen ende versoecken dat eenelijck maer antwoort op d’Hr Generaels brieff sonder meer wilde verleenen, vermits sij van sijn Ed' gelastet waeren de penningen door Mirmosa, Hackiem en andre in den wegh d’onse-onbehoorlijck afgedrongen, te vorderen en bijaldien sijne Maij' daertoe niet conde resolveren ofte verstaen, dat alsdan, doch ongaerne, genootsaect souden                                                Original from Digitized by Google                                   PENN STATE 
1643	1644	pst.000053235183-seq_0153.txt	VERBAEL te samen gestelt uijt d’ advijsen ende andere pampieren desen jaare 1644 successive uijt Siam gecomen van den E. Reijnier van Tzum, opperhooft aldaer.  Den 25 Januario 1644 arriveert naer eene peuible ende seer dangereuse voijagie 'tschip Nieuw Delft sijnde op 25 November van Siams bhara vertrocken met een cargasoen monteerende f 19058.3.12, bestaende in 60 jatij- balcken, 79 plancken ende gwalpen, duijsent picol sappangh, 4364 last rijs, 17600 eatti tsia, 2275 catti gommelack, ende 4 olijphanten, daervan drie stucx door ongemack der lange voijagie gestorven waeren.  Adviseert dat den afftreck der cleeden noch in voorige staet ende gans slap was; op des Compangies schulden was maer eeneliek 200 ecaeti agerhouwt ontvangen van Sediammet Onthang.  Wegens de wissel was geaccordeert op 161 taijll fijn Siams silver tegens 20 taijll swaerte eruijsdaelders, in voegen ider eruijsdaelder 46 stuijvers 5 penningen schaers valideerden, dat wijnich was ende f 700 op 8000 stuckx verlooren was.  Tot proeure van groove groote plancken ende swalpen dede devoir ende waeren ongevaer 150 voorhanden; de houwtcoopers werden tot sagen geanimeert, baleken waeren 110 gereet.  Thin ende gommelack had op insicht van den goeden coop meer als den eijsch met bracht ingecocht, te meer alsoo door de geresenonlusten in Cam- bodia van die sorteringh niet te becomen souw wesen.  Had te wech gebracht bij den barckelangh dat niemant rijs uijtvoeren mocht, waerdoor de Poortugeesen oock verlegen waeren, ende soot hem niet aen scheepsruijmte ontbroocken had, souw boven de affgesonden 800 coijangh noch well 100 hebben connen seijnden.  Weijnich coopmanschappen als alleen 25 duijsent hartevellen had tot den Japanschen handel in voorraet. De Japanners hadden alleenlick de herte- vellen g'encorpereert ende was der Nederlanders vermogen tegens hun practiecq seer cleen, alsoo den handel meest in de Jappanders bestont.  Niettegenstaende de 8000 ricxdaelders ende de 20 catti op deposito gelicht, soo stont door ’taffgesonden soo naer Battavia alls naer Malacca des Comp" casse wederom ten achteren, soodat op bet silver ende ontset van Japan was wachtende.  Den 27 d arriveert de fluit Castricum met een cargasoen van f 5482.15, bestaende in EVO picol sandelhouwt, 30 jatibalcken, o4l                                                Original from Digitized by Google                                   PENN STATE 
1643	1644	pst.000053235183-seq_0147.txt	zuur 1644.                                   129  coopmanschappen die hem met peeper tegens twaelff reaelen per picol betaelt hadden.  Alsoo den gouverneur van Vliet, desen brief den 11 Julij geschreeven ende claer hadde om sanderen daechs aff te schicken, soo was den 13 ditto door de ecruissende jachten aldaer opgebracht den Deenschen president Barent Pessaert (') met een cleen Portugees jacht dat 4 lepelstucken ende 36 manu op hadde, mitsgaders geladen met 25 duijsent rochevellen, een pack roode moeris, 2 cassen rooswaeter ende partij snuisteringh naer sijn seggen geladen hadde om daer met naer Jappan te navigeeren. Ende alhoewel gemelte Pessaert over deese sijne aenhaelinghe geer tonvreeden was, soo hadde sijn E. hem niet darven largeeren ut vreese dat met Poortugeesche goederen off haere negotie mocht belemmert weesen des Pessaert daertegeuns met monde geprotesteert ende verclaert met geenige Poortugeesen ietwes uijtstaende hadde, buvens dien ge- presenteert Malaccas gerechticheijt te willen betaelen, dat hem ontseijt ende naer Batavia te varen geraden was, waertoe niet connen resolveeren, maer bij desen aen den H" Generael een missive geschreven, dicteerende dat sich be- claechde overt ongefondeert aenhaelen.  Naer sijn KE. uijt Pessaert die hem evenwel seer geslooten hielt vernemen conde, stont het met de Deensche Comp gans slecht, sijne vrouw ende kinder waren tot Massalapatnam voor 63 duijsent reaelen aen schulden bij de Mooren in ostagie gebleven, ende hadde den tweeden president off comandeur Willem Leijel per ’tschip Cristiaenshaven het Moors schip, in Februarij passado uijt Queda vertrocken, gestroopt ende genomen, alle den thin ende peeper, oock het gouwt daeruijt genomen ende de Mooren niet als vijff eliphanten laeten behouden.  Desen roover onthielt hem nu jegenwoordich omtrent Coulan ende wert onder de Deenen gerucht de voorseijde Leijel nae 't Roode Meer tendeerden om d' een off d’ ander Moor te stroopen ende ’t volck over boort te smijten ten einde de naclachten mochten geweert werden ende niet aen den dach komen.  Desen Leijel hadde cort te voren soo als Pessaert voor Emedij ter reede lach, denselve mede een jacht affgenomen ende wech gevoert, waerover hij Pessaert ende sijnen raet van sijn commando dat in Trancquabhaer gehadt hadde, gedeporteert ende een ander in sijne plaets gesurrogeert was. Wat het uijteijnde van desen Leijel sijn bedrijf wesen sal leert den tijt; dit ende niet meer hadde sijn E. van der Deensche gelegentheijt connen verneemen.  De missive van den commissaris Arent d’ Vlamingh aen den H" Generael ende heeren Raaden van India per voor aengetoogen fluijtschip notificeerden siju spade arrive op 15 Junij passado in Malacca ende aldaer sijne ordere prompt naergecomen hadde, ende om sijne te doene saecken niet te verachteren, aent Atchiens hoff d’ een ende d’ ander uijtgestelt hadde.  1) Vgl. Heeres, Bouwstoffen III, 194,  Original from  Digitized by Google                                   PENN STATE 
1643	1644	pst.000053235183-seq_0351.txt	En                                 Original from Digitized by Google                            PENN STATE 
