start_year	end_year	File	Text
1643	1644	pst.000053235183-seq_0302.txt	984                         KOROMANDEL  ven te voeren. Maar ick hebbe alreede mijne dienaers belast dat alvoorens den eijsch van coopmanschappen senden, wel overleggen sullen wat tot dienste van 't Singierse land nodigh hebben ende goo haest dan de selve op Tegenepatnam aencomen bij haer sooals geseijt is sullen werden ontfangen.  Ten tweeden dat bij mijn volek anders geene cleeden, indigo, salpeter, etc, sullen worden gemaeckt dan haer bij den coopman wegens d’E. Comp" in Tegenepatnam in quantite en qualite volgens de monsters worden opgegeven ende wat buijten gemelte monsters, oock in quantite van de mijne gemaeckt wort, sal de Comp' niet gehouden sijn aen te nemen, maer vermogen sullen ’t mijnen laste te laten, dogh sal iek goodanigen ordre stellen dat alles conform u lieden mousters sal werden gemaeckt.  Ten derden geve iek U macht om mijne inwoonders resideerende op Porto Novo, Poeleceere ende Tegenepatnam, mitsgaders de dorpen of coepans daeronder behorende, tot ulieden dienst (eenelijck betalende ordinarie dagh- loon) te mogen gebruijcken, sonder alvoren de sabandaers dier plaetsen eerst om licentie te moeten vragen, maer cen ijder van geseijde inwoonders sullen bij daeh ende bij nacht op U bevel ten dienste gereet moeten staen, ende haer ’t gij van ’t quaet weder als anders niet vermogen te excuseeren ende bij weijgeringe oft onwilligheijt geve ik Ulieden macht de alsuleke met slagen te straffen ende alsoo tot den dienst te dwijngen.  Ten vierden sult ghijlieden vermogen soo veel personen in Uwen dienst 'tsij 10, 20, 30, 40 tot 50 te gebruijeken als U sal goet duneken, sonder dat daertoe naer desen van mij hoeft vorder licentie te versoecken  Eijndelijek belove iek ’t voorstaende vast ende onverbreeckelijck te onder- houden en doen onderhouden, gelijek ooek ’teontract en d'artijckelen daerin be- grepen in der maent Maert deses jaers aen de E. Heer gouverneur Arent Gar- denijs verleent ende tot bevestinge van dien sweere ick op mijnen vader Wencke- tapancijek ende hebbe dit met mijn eijsen hant onderteijkent.  Wat hier op volgen gal ten aensien d'werekluijden diekmaels door aange- dane travaillie verloopen, ooek op d'geschilderde eleeden niet voor den aenbe- steden prijs behouden blijven eonnen, leert den tijt. Den incoop der lijwaten nam op Masulipatnam sijn voortganek en soude het daer eerlang aen comptanten manc- queren, bijaldien Mirsumela geen penningen voor de coopmanschappen (die hij alle in een massa copen wilde) versorghden, ende uijt vrese desselfs doordien haer geen andre coopluijden openbaren, ’t welek de Comp schadelijck valt.  t Schip d'Nepthunes was door den schipper Jacob Jacobsen Struck tus- schen 3 ende 4 Oetober savonts 8 glasen in d'eerste wacht seer schandelijck door pure achteloosheijt op d'eust van Oriexa vvor Carrapar sonder d’minste onweer ofte drooghte aen de grondt jegens d'wal verseijlt en aen stucken gestoten, t volck nevens 12 oliphanten, 7 p. geschut ende eenige cleijnigheden waeren ge-  .                                              Original from Digitized by Google                                   PENN STATE 
1643	1644	pst.000053235183-seq_0289.txt	JuL1 1643.                                               211  aencomende ende uijtgaende vaertuijghen, als hieronder breeder en bij desselfs copije can gesien ende gelesen werden.  Translaet uijt het origineel caul van den coninck van Car- natica aen den gouverneur Arent Gardenijs gegeven in Palliacatta adij 29 April 1643.  In den jare Sittrebanno in de maendt Weijsackham naer de nieuwe mane hebbe ick Serangaraije den geluckigen, Heere der Heeren, Godt der Heeren , ende vermaert voor een seer cloeckmoedich soldaet, aen Arent Gardenijs, gouver- neur van de Hollanders geschoncken dit naervolgende caul. Door het gebod van den prince ende Heere der Hollanders, sijt gij in ons land Palleacatta gecomen met oogemerck om uwe negotie ende commercien daer te drijven, gelijck gij op heden oock doet, hierom late ick U toe dese onderstaende vrijheijt in maniere als volght. De goederen die gij met Uwe schepen hier aenbrenght ende wederom die gij uijt dese landen wechvoert, schencke ick U voor uijtschepen ende in- schepen de vrijheijt van alle tollen ende gerechtigheden ende dat meer is tot Uwer eere gult gij genieten den halven tol van alle vaertuijgen die te deser plaetse eenige goederen disbarequeren, ende soo oock van diegene die sij sullen inbarequereu, sooals den duan daervoor geniet, sult ghij de helft ontfangen in dier voegen dat Uwe goederen die ghij hier te lande brenght, ende wederom wechvoert, voor inschepen ende uijtschepen vrij sullen sijn van alle tol, maer van andere vaertuijgen sult gbij de helft van de gerechtigheijt naer u nemen tot Uwen proffijte. Den import die de cooplieden van de stadt betaelen, de ge- rechtigheijt van den vigiadoor, ende andere tollen des landts, bevele ick dat sij sullen betalen in forma als voor desen is geschiet, soo dat al ist saecke ick dese stad Palliacatta voor mij selven houde, ofte verpachte, ofte ter oorsaecke van eenigen dienst ofte uijt schenckagie aen een ander laete, nochtans het boven geseijde gal ick al te samen volvoeren, even gelijck als ick geseijt hebbe. Ick hebbe oock gemaeckt dat geen vigiadoor ietwes U gal comen afvorderen. Soo onder de coopluijden van de stad ofte vigiadoors een saecke van gewichte voor- valt, dat sult gij mij wel overschrijven, doch soo het dingen sijn van weijoich importantie gij moet niet meenen dat gij verobligeert sijt mij altijt daervan de wete te doen, maer gij sult sulex met het hooft van de stadt remedieren , opdat het niet meer en geschiede. Met dese liberteijt dan vermoocht gij U negotie te drijven met een ijder die gij selfs wilt, en gij en moet in geenige saecken het minste achterdencken hebben. Dit caul moet gij bewaren opdat hij voor altoos sijn cracht behoude, want opdat gij mij betrout ende gerust mocht weten, hebbe  ick den selvigen aen U geschoncken. Stondt geteijckent : Cirama.                                                Original from Digitized by Google                                   PENN STATE 
1643	1644	pst.000053235183-seq_0262.txt	VERBAEL getrocken uijt de successive advisen becomen van d’cust Choromandel, Bengaele ende Peguw sedert November A. 1642.  Anno 1643 adj 15 Februarij becomen per 't Engelse jacht d’ Advisa over Bantham eenen brieff den 14 Januarij passado door d’h" gouverneur Arent Gardenijs op d'eust Choromandel int casteel Geldria herwaerts geschreven , waerbij vernomen werd dat den Carnaticaschen coningh Weijneketapatij naerdat vijf a ses daegen aen een heete coortse sieck gelegen hadde overleeden was, desselfs bijsit had haer den 12 October in Narrewarom, sijnde achtien mijlen te landwaert van Pallicatta, in’t vier geworpen ende verbrand, geen wettige kindren doch een bastaerd (die nae des landts wetten int rijck niet succedeeren conde) naer- latende. Deswegen wasser nae veele dispuijten onder de grooten den 29 October Serangereijl sijnde den overleeden conings broederssoon , voor coningh van Carnatica uijtgeroepen en in dat rijeck met d'vereijste cermonijen bevestigt, alhoewel gerucht wierde sommige grooten ’twel anders gaerne gesien hadden.  't Was seecker dat dien coning Dammere Weijneketapaneijek die heer over Ponnemillij, Madraspatnam, met meer andere daarontrent gelegene plaetsen geweest sij, en jaerlijex ongeveer ses hondert duijsent pardaris aen landt onder sijn gebiet gehad heeft, vermits met des Goleondaders volek correspondentie gehouden en d’Mooren in die tijt om hun fortuijnne poussieren aengeport hadde , bij den cop doen vatten, alles (uijtgesondert Ponnemillij met eenige daeronder behooren- de dorpen tot desselfs onderhout dienstich) verbeurt gemaeckt, ende hem in hechte- nisse gehouden hadde. De Golcondaders hadden eenelijck Weijneketegierig, 't welck bij Willegotijs volck verlaeten was, in besittinge genomen. Wat ordre den nieuwen coningh int gouverneeren sijnder landen stellen, en de landbedervers leeren soude, moste den tijt noch openbaeren.  Chinanna was den 18 November passado onder des coninghs geleijde op-ontbooden en naer Trijpetij met een aensienlijcke schenckagie om sijne Maij' te begroeten vertrocken, deftich ingehaelt, ende met de fortgens Catoer, Couloer en eenige daeronder sorteerende dorpen beschoncken, doch bleeff daer ongesontheijtshalven noch met groote eere te genieten continueerende. Den gouverneur Gardenijs had een briefken van complementen nevens een schoone verrekijcker tot verselschappingh van Chinanna aen sijn Maij' (met belofte van in toecomende wat groots) gesonden.  Op 19 October was den Gouverneur Gardenijs over S' Thome per expresse gelias toegecomen een missieff van den 7 September passado door den vicereij conde d'Aveiras uijt Goa aen sijn E. geschreven tot verselschappingh der ge-  Original from  Digitized by Google                                   PENN STATE 
1643	1644	pst.000053235183-seq_0276.txt	258                                         KOROMANDELBENGALEN  geniet wat voordeel gijlieden gult erlangen is onnode nu te seggen maer sult namaels met de wercken bewijsen. In mijn landt gijn goudt, oliphanten ende edele gesteenten. Oock vint men quieksilver in alle plaetsen, soo gruot is mijn landt. Mijn gemoet is soo goet om te geven; soo gijlieden becomt d’ eere en faem van mijne verlossinge, alle rijekdommen van mijn landt sullen u niet ont- breecken. Eertijts gaff ick eens mijn woort aen een Portugees ende hielt het oock na sijn doot, hoe soude iek mijn woort nu aen Ul. niet houden, soo langh ick geen antwoort ende hulp van Ul. ontfangh sal mijn een dagh een jaer schijnen te weesen. Desen brieff die mijn volck hier brenght in wat plaetse daer Hollanders sijn 'tsij te water off te lande mach van haer gelesen worden, den inhoudt can UE, laten oversetten in uwe Hollantse tale ende senden naer Jacatra ende een aen de heeren van Hollant onse vrienden. Niettegenstaende het peijs is, de Portugeesen hebben verborgene ordre om Gale met list te occuperen, soo daer noch ietwes secreet voor valt, sal UE. verwittigen; met desen is dit den 9 brief die ick UE. heb geschreven, hoeveel UE. geintregeert is mij onbekent, dit altemael moet Ul. bekent sijn. Ende was onderteeckent  Iek ben onuijtspreeckelijeck bedroeft in dese stad Columbo de Keijser Vigeopalla.  'tJacht Grijpskerck was den 24 Januarij van Pipelij voor Palliacatta aengelant met een ladinge bedragende f 23074.10, bestaende in 14 packen cleeden, 1953564 witte poijer suijcker, 7857  sgingelijolij, 42852  tarruw, 1496 PB wasch, ses leggers aracq ende 34 soo slaven als slavinnen. Soo waer de ladingho voor de fluit de Rogh volgens S" Junius schrijven mede in Pipelij bijvaer vaerdigh. Den oppercoopman Martinus de Vroede soude derwaerts om in de Bengaelse negotie opgetrocken te worden tot assistentie, vau gemelten Junius vertrecken. Hij had 19 Januarij den nieuwen babab met een redelijcke schenckagie begroet, ende den ouden couwel van A 1641 doen vernieuwen. Sijn E. versocht aen d’ onse assistentie jegens des conings van Arracans geliassen, 't welk hem als sijnde sij beijde onse vrunden wierde geweijgert en beleefdelijck afgeslagen, alsoo sulcx in haer vermogen niet was, waer over den selven (soo vourgaff) aen d’h" Gouverneur Generael schrijven ende uijt des mogols name sulcx versoecken goude. d’Oncosten om den op den loop wesenden oliphant te vangen wierden naer overslagh bijnaer svo hoogh als d'waardije van dien getacxeert, deswegen bleeff S" Junins van opinie dat beest gelijck 't loopt voor ontrent 300 ropias te vercoopen. Mirsia Melckbeecq had al 1500 R' voor ’t selve gebooden. Den assis- stent Jacob van Bost was met 87 pack rouwe Beugaalsche sijde (die door 't hooge water vrij dierder als anno passado had ingecocht) van Casimabasaer in Pipelij verscheenen. Claeghden over 't groot gewelt der thollen die hem in Naringoor ende Oricxa waeren afgeparst, waerover d'onse aen den nabab geclaegt ende hoop van restitutie becomen hadden. Het Portugese jacht van Coutchijn was voorgaets  Original from  Digitized by Google                                    PENN STATE 
1643	1644	pst.000053235183-seq_0060.txt	492                              BATAVIA  ende 60 baar peper. Ende 2 gillioens d'eene van Linga daerop 11 man geladen met sagou, d'ander van Palembangh met 16 man, 30 picol peper, ende weijnich cattoen, daermede comen eenen nachoda Amat, ende Malimpout, brengende een brief aen den Gouverneur Generael, luijdende in onse tale overgeseth als beneden op 23 deses te sien is.  22. Arriveren 3 tinganghs, een van Manjuta, een van Caliwongen, ende de derde nevens een contingh van Serrabon, een balou van Samanca, ende noch een econtingh van Craoan, ophebbende 55 man, geladen met 30 bahr peper, 6 lasten rijs, weijnieh padi, partije olie, suijcker, .  Vertreckende dan jegens een contingh, tingangh ende gillion na Caliwongen, Bantam, Grissic, uijtvoerende 137 realen aen cleden, ende 56 realen Chinese coopmanschappen.  23. Vertrecken den cap" Hendrie Harous, oppercoopman Sijmon Jacobsen Domkens, als vice commandeur ende schipper Jonathan de Necker, schout bij nacht met de jachten ende fluijten Leeuwere, Kivit, Wakende Boeij, Noortster , ende Dolphijn, mitsgaders 5 chaloupen ende een tingangh na de riviere van Cambodia, om revengie vande erudele moort door den coninc aldaer aen on- nosele Nederlanderen begaen, gemant met:  soldaten  matrosen  swarten  Chinesen coppen. Leewere . . . . . 40 . . . 50 . .. 6 . . . 4  . . 100 Kivit . . .. .. 40 ... 50... 6... 3 .. . 99 Wakende Boeij . . . 10 . . . 30 . eee 40  Noortster . . . . . 40 . . . 60 . .. ee ee ee Dolphijn . . . . . 30 . . . 50... 6 86  Samen . . .160 . . .240 . . .A 1 ... 431  Voorts treffelijek voorsien van alles tot sodanigen exploict vereijscht, sijnde bij instructie gelast de riviere Bassac in te lopen ende door het Musquite gat, ist doenelije na boven te corten, latende den schout bij nacht met de Noort sterre aen dese sijde van hetselve op de wacht, om het incomen ende uijtvaeren der joncken ende vaertuijgen langhs dien wegh te beletten. Maer inge- valle het Musquitengat gelije gevreest wort, door den conine ondertussen gestopt ofte toegemaect mochte wesen, sijn gelast de Noordster, gelije voorschreven, neven een der jachten aldaer latende, met de voordere schepen weder uijt te drijven, ende de Japanse riviere te kiesen, cortende met alle vlijt langhs deselve soo hoogh opwarts als doenelije, aengesien den tijt middeler wijle al sal beginnen op 'teijnde te lopen. Cans siende sullen eens ganghs tot boven voor de stad sien te comen, andersints aen het musquite gat van die cant mede blijven be- settinge houden, waermede Cambodia dan niet alleen van de zee maer ooc de beneden landen, daer den meesten rijs valt afgesneden sal sijn, sonder nochtans voort eerst hostiliteijt ofte vijantschap te bewijsen, als eenelije dat de vaertuijgen                                                 Original from Digitized by Google                                    PENN STATE 
1643	1644	pst.000053235183-seq_0074.txt	66                             BATAVIA  Arriveeren twee gillions d'eene van Sillebhaer, d’'ander van Priaman ende een tingangh van Macquita opbebbende 47 man, geladen met 103 bhaer peper. Vertreekende daer jegen twee tinganghs d'eene na Bantam d’'ander na Gimpongh, uijtvoerende 9 p' roode percallen ende 180 realen Chinese waren.  8. Retourneert Mr. Winter met d’Aviso weder na Bantham ende over- lijt den ouden capt der Chinesen deser stede Bencon, werdende de weduwe toegestaen het lichaem een maant a twee binnen haer huijs te houden, gelijck onder de grote Chinesen in China gebruijckelijek sij, tot dat sijn graff gepre- pareert ende opgemaect zoude wesen, mits dat het lichaem ondertusschen versorght sal werden dat het geen stanck van sich en geve, daer giecte door mochte werden veroorsaect. Jegens den middach verschijnen Lowijs Carvalho de Sousa gedeputeert Geral ende Manuel Fernandos in Maco nevens verscheijden andere der voornaempste Portugesen voor den Gouverneur Generael ende de Raden van India, versoeckende aengesien sijn Ed' haer toesegginghe van te vertrecken hadde gelieven te doen, ende niet alle in de cho van Christophoro Suarez conden overgevoert worden, het tjacht van Anthonio Varelles hem tot redelijcken prijs mochte werden vergunt, ende accorderen eijntelije op 1800 realen van achten te betalen 1500 contant ende 300 ’t aenstaende jaer met zijde stoffen ende coopmanschappen, passerende Anthonio Varelles daervan obligatie bedingende dezelve daerbij sijn persoon neven andere ooc gelargeert zal werden ten aensien 10 kinderen in Macao sij hebbende ende weijnich middelen daertoe, als wel voornamentlijek omdat d'onse voorleden jaer in Macao in vele saacken scer gedienstich is geweest, geliek ooe van d'onse getuijcht wort, ende ten opsichte den grave vicereij in Goa 25 van ons voleq van de Pauw gelargeert heeft, gelije uijt de advijsen verstaen, soo doet sijn Ed' haer toesegginge be- sijden degene die rede op haer vrije voeten waren gestelt noch gelije getal van 25 van de haere los te geven om te vertrecken werwaerts ’t hen goet dunckt, ende zullen bij provisie 8 derzelver daeronder 4 geestelijcken om dat volcq van den hals quijt te wesen met 'tjacht Lis ende de fluijt Broeckoort toegestaen werden te navigeeren, eenelijeck zal den fidalgo Domingo da Camera hier blijven tot dat de resteerende van het schip de Pauw los gelaten zullen wesen.  9. 's Nachts wort wederom een Chinees buijten int suijckerriet van Bingam van den tijger gevath ende doot gebeten, doch het lichaem doort schreeuwen der andere Chinesen van het beest verlaten. 's Naermiddachs retourneert de chaloup van Bantam met een brief van den president Ralph Cartwricht, sijnde niet anders als een courtoise danckseggingh over de Europase provisien hem toegesonden.  10. Arriveeren volgende vaertuijgen, 3 continghs, twee van Grissic ende een van Tegal; 2 tinganghs d'eene van Mannae, d'ander mede van Tegal, een gillion van Sillebar een solor van Indragiri ende een jonck van Palimbangh ophebbende te zamen 88 man, geladen met 83 bhaer peper, ende veelderbande cleijnicheden. Per voorschreve joncq comt een brieff van den capiteijn Hendrick                                          Original from Digitized by Google                            PENN STATE 
1643	1644	pst.000053235183-seq_0048.txt	30                               BATAVIA  tallen tijden bereijt te wesen van gelijcken te doen, bij aldien voornoemden Mataram op Batavia mochte toeleggen. Voorders versocht dat Narrentacque ge- licentieert mochte werden eens op Batavia te comen om met den Gouverneur Generael wegens eenige saken te spreken. Op 16 deses was een vaertuijgh van de Oost tot Bantam gecomen met brieven van Queeij Nebij Direndacca aen den sultan pangeran, Wanghsa Dipa, ende Mindicipati, bij welcke uijtten name van den Mataram was clagende, over dat den sultan ende pangeran telckens slechte geringe liedens aen hem waren sendende ende geen lieden van staet om over een vrede tusschen hem en Bantam te handelen, mitsgaders ooc dat om adsistentie van de Hollanders na Batavia gesonden hadden, weshalven voortaen geen vaertuijgen meer om de oost hadden te senden, aengesien alle als vijanden aengetast souden werden. Hebbende ooc gissingh te maecken den Mataram eer- langh Bantam soude comen besoecken. Op welcke brieven den pangeran niet gewaerdicht hadde te antwoorden, maer eenelije door Mindicipati mondelingh laten seggen, den sultan Mataram hem geen wetten hadde te stellen, wat doen ofte laten soude, ende bij aldien lust hadde Bantam te comen besoecken, sulex wel getroost waren, hebbende haer al lange daerop geprepareert, als diergelijcke Javaensche praetjens meer, die bedenckelije sijn wel op d'een of d'ander schel- merij sijn. Den president Cartwricht had aen den sultan van Bantam vercocht 10 picol buseruijt tot 40 realen den picol, denselve had jegen den resident geclaecht de Javanen meer cleden van Batavia waren halende als van haerlieden copende, waerom genootsaect waren geworden Mr. Montfort met partije naer andere quartieren te senden.  21. Arriveren 2 gillions van Sillebhar ophebbende 51 man behalven 5 lijfeijgen (een kint ende vier vrouwen), geladen met 88 baer peper. Een tingangh van Malacca daerop 9 Chinesen ende een vrouw, sijnde voornemens geweest na Jambij te seijlen, maer door onervarenheijt des stiermans de riviere voorbij geraect, geladen met out ijser ende 5 picol out plat loot. Hadden brieven van den gouverneur van Vliet aen den oppercoopman Puijt in Jambij die aen den Gouver- neur Generael overleverden.  Mitsgaders een jonc toebehoorende Intsie Assam, Maleijts coopman alhier , van Jambij, ophebbende 25 man, geladen met 1274 picol peper voor rekeningh van de Comp door den oppercoopman Puijt daerin gescheept, mitsgaders noch 350 picol voornoemden Assam sefs competerende; daermede becomen brieven van voorschreven oppercoopman van dato 13 stantij tenderende niet anders als tot geleijde van voornoemden peper.  22. Arriveren een gillion van Lampongh ophebbende 18 man leggende al t'saem siec aen de coorts, ende verhalen den pangeran van Bantam op grote straffe verboden had, eenigen rijs uijt Lampongh na Batavia te vervoeren, alsoo deselve te Bantam dier was. Ende vertrect een gillion nae Bima met weijnich eleden, Chinese waren, ende 14 picol out ijser.                                                 Original from Digitized by Google                                    PENN STATE 
1643	1644	pst.000053235183-seq_0049.txt	20 -26 rennuarr 1644.                       31  23. Vertrect een tingangh na Pamanoucan met 16 realen aen cassa.  24. Arriveren Inche Manghsou met een gillion van Patanij over Jambij ophebbende 16 man, geladen met 40 picol peper, ende brenght een brief van Datou Bendahara van Patanij aen den Gouverneur Generael beneden geregistreert. Ende een gillion van Johor daerop 13 man geladen met weijnich peper, sagou, ende cadjanghs.  Ende vertrecken de fluijt Berchout ende het jacht Welsinghe na ’t eijlant Mauritius, de fluijt om het gereede ebbenhout als d Engelsche goederen uijt het verongelucte schip Henri Bonventura gebercht van daer te halen ende herrewaerts te brengen, maer het jacht om te dienen tot den handel van gemelte eijlant op Madagascar (1), tot procure van lijfeijgenen, rijs, en 't gene daer meer gevonden sal werden, ende gaet op de fluijt Berchout den oppereoopman Wijbrant Beverwijc als commissaris om de visite van genoemde eijlant ende de eonstitutie ende ge- legentheijt desselfg , mitsgaders ’t bedrijf der dienaren aldaer residerende te doen ende daervan sijn relaes over te brengen. De fluijt is gemant met 52 ende 't jacht met 30 coppen, geprovideert voor . . . () maenden, sijnde daerin ge- laden aen provisien ende verscheijde nootwendieheden voor geseijde eijlant, als- ooe eenige coopmanschappen voor Madagascar ter somme van f 7828 .  25. Arriveren 2 joneken uijt China ophebbende d'eene 5 ende d’ander vier hondert man, geladen met alderhande Chinese waren, sijnde 27 dagen onderwege geweest.  Dato worden eenige Javanen weijnich dagen geleden van de Oost hier gecomen, soo voorgeven om te visschen, gelije die van Bantam door last van den Gouverneur Generael bij de cop gevat, ende in de keten gecloncken op pregnante suspitie niet om te visschen gelije voorgaven sijn gecomen, maer om 't een of 't ander schelmstue uijt te richten, het sij dan bij gelegentheijt met eenige ge- qualificeeerde persoonen ofte Nederlantse vrouwen door te gaen, ofte wel eenigh ander desperaet faict bijderhant te nemen.  26. Arriveert een jone van Palembangh, ophebbende 40 Chinesen ende 5 vrouwen geladen met over de 300 picol peper.  Ende vertreet den oppercoopman Claicx met het jacht de Leeuwerc na Bantam met een brief aen den Engelsen president Ralphe Cartwricht nevens 3500 8 boeghspijckers door den selven te ecoop versocht, belopende tot 64 realen van 8 in specie het hondert 218 realen; daer nevens ginc mede een brief aen Comp resident Jarich.  Dato worden de 4 Chinesen met de Noortster van Cambodja opgebracht bij den raet van justitie gepijnicht, ende tot confessie gebracht, namentlijc dat, naer dat d’oppercooplieden Regemortes ende 'Broecmans mitsgaders de voordere Nederlanderen uijt laste des coninex om den hals gebracht waren, sij lieden  (1) Vgl. Heeringa, De Nederlanders op Mauritius en Madagascar (Indische Gids 1895). (2) Niet ingevuld.                                                Original from Digitized by Google                                    PENN STATE 
