start_year	end_year	File	Text
1643	1644	pst.000053235183-seq_0126.txt	S c  108                                                        AMBOINA  Op 12 Jalij passado wierden van voor Manipa naert n. w. eijndt van Bouro de jachten Leecq en Jongen Prins om ebbenhout affgevaerdicht, met ordre den quimalaha Fackirij op Tamahouw met een cleijne erkentenisse te begroeten, ten welcken eijnde den cap" Jacob Verheijden met 16 zoldaten die met gemelte quimalaha alvoren langen tijt op Combello verkeert heeft mede gesonden wert om in aenspraecke te comen, dat uijt vrese niet anders wel geschieden souw, gelijck ree alle, uijtsonderende weijnige jonge quanten, met geweer, vrouwen ende kinderen naert geberchte gevlucht waren, zoodat d'onse tot geen aenwijsinge comen, maer ’t hout selffs gaen soucken mosten. Eijndelijck quamen den quimalaha te spreecken, die hunne meijninge te verstaen gaven, waermede alle vruntschap bewesen wierden en zooverre brachten, dat den quimalaha ende den quipati Lelela, hooft der negrije Baro Bessi, aen wien ’t opperste gesach langhs die custe, vermits out ende selffs naer den coninck gaet laet verblijven , met d'andere hooffden der omtrent gelegen negrije op 'tvertreck der jachten aen gemelte cap" den eed van getrouwicheijt gepresteert hebben. Op ’tvertrecq gaven een cleijn brieffken, welcs translaet nevens gaet, aen den gouverneur en versocht gemelte quimalaha met ons jachten tot in de bocht van Caijelij ’t westeijnd van Bouro alwaer zijne correcorren ter vertreck geprepareert wierden gebracht te werden , dat geschiede.  28 Augusti retourneren de jachten met ruijm 53000 ebbenhout, bestaende in 694 stucken. Int toecomende gsecht noch wel te becomen, waertoe ordre verwacht.  Over de gepleechde moort A 1636 aen d'onse is den gevangen Xulabessi per voornoemde jachten en Sougi verblijven bekent te maken, mede derwaarts gesonden. Terbile staet toe de movorders te straffen en laet Sougi verlossinge                niet schriftelijek maer mondelingh doen, die tot nader ordre van Batavia aldaer -               verblijfft.  Den gouverneur eijscht een nieuwe groote distileerketel met eenige ver- glaesde potten.  Vermits 't aenstaende seer goet en vrouch nagelgewas wert goede scheeps- ruijmte versocht ende per de voorlopers de couranste cleden, de g'eijschte zijde petolen, Patavische off Atchijnsche sijde cleeden, partije Guinees linnen , swarte grove baffta, peta maleije, witte chabenijs ende andere fijne lijwaten, als cassa Bengala, Ternatanen ende fijne bethilles.  Sent de gesloten jachtbouxkens, weesboucquen, verscheijde affgedane processen, 't vervolch des Amboinas daghregister en resolutien.  Versouct ordre int reguarde der schult te weescamer van 300 R' capitael en 2712 R verloopen interest van Jan Peijs, een der getrouste orancaijs en gewesene secretaris des lantraets, met 30 gl. maentlijek gegagieert en vijff                   Jaren sonder eenigh genot gecontinueert hebbende, die zich beroept op 's capitaels 3  ontlastinge door d'heer gouverneur Ottens zaliger, waerfvan eenich en geen  En                                            Original from Digitized by Google                                 PENN STATE 
1643	1644	pst.000053235183-seq_0118.txt	An NN L.A  te OVS  er en  100                                                           AMBOINA  gesaecht werden, zoodat meer stenen off pannea, ja selffs slaven van costi te genden zullen excuseren.  Den gouverneur discoureert wijtlopich over de fortificatien ende ’t lichten off verminderen der guarnisoenen van Hitou als andere noch niet wel ge- raeden is, voor en alleer Capaha iu devotie gebracht zij, want 't gnarnisoen der sommige meer dienstich om ons van haer dan wel d'een voor d'ander te ver- sekereu is; ’t guarnisoen van Amboina int geheel 475 coppen.  Wijders wert goede sorge gedragen wegens de vivres, amunitien van oorloge, en verdere gerequireerde coopmanschappen; der forten ende comptoiren , ijder naer behooren versien wert.  Den godsdienst der Christen onderdanen zoo bij en omtrent ’t casteel, int Litimoersche geberchte, d'eijlanden Boanbessi, Uliasser ende Nussalauw wert beijvert, scholen wel onderhouden ende nemen verder zeer toe. De derde visite is verbleven doort vertrecq vau den predicant Pontcasen naer Banda, vocq met verwonderingh ervaren dat oude personen hun meer als oijt te voren genegen tonen, ja meijskens (dat voor schande gerekent wiert en noijt voor desen meer geschiet zij), indifferent zoowel als jongens nu ter scholen comen; in d'eijlanden alleen met de jongste visite 125 bevonden. Tu generael sijn stercq 25 scholen en meer dan elff hondert kinderen, die 'tsedert anio passato noch wel een derde vermeerdert sijn.  In de twee gedane visiteu zijn 680 kinderen gedoopt, en twee hondert en veertich paer in den hauwelijcken staet bevesticht, desgelijcs een goet getal vintreut ’t casteel.  Die van Alangh ende Lilleboij zijn besich met ’t voltrecken van kerck en school, waertoe meesters zullen versoecken,  Van Caijbobo () wert noch niet vernomen, alzoo den Quimalaha die van Louhouw en '’sconincs gesanten daertegen zijn, als strijdende directelijc tegens 'tecontract art. 14, en iusgelijes bij den tolcq Alonso swaricheijt is gemaect van qualijek bij den coninck genomen te sullen werden, dan 'tecontract vermaende van Christenen ende mooren; zijn en blijven de heijdenen daer buijten, waeraff per naesten advijs.  ’t Generael advis wegens f 4161.1.5 aen de Comp omme in ’t patria aen de behoeftige uijt te keren, goet gedaen, laet sich den kerckeraet wel gevallen. Item het mogen uijtkeren van 1000 guldens, zoodat met veel volcs ) (dat) tot ’t gehoor van Godts woort comt, nu wel cunnen toecomen.  De groetenisse nevens schenckagie van 3 balen rijs aen ijder des lants- raets, was haer seer aengenaem ende zijn zeer dankbaer voor, met getrouwe beloften haer iu alles wel ten dienste van de E. Comp en ’t gemeene beste te zullen quijten en ontschuldigen sich wegens den oppercoopman Outhoorn en  (1) Heeres, Bouwstoffen III, 213,  Original from  Digitized by Google                               PENN STATE 
1643	1644	pst.000053235183-seq_0130.txt	112                      BANDA, FEBRUARI 1644,  het secreet ochmerck geweest is, daerom eenige swaricheden wegens Bandas gelegentheijt voorstelt.  Daerom meent dat noch twee hondert coppen behooren gesonden te woorden voor een jaer off twee tot dat d'Amboijnesche gemoederen gestilt sijn ; dat sulex maer 25 a 30 dusent gulden souw costen ende door Banda wel gedragen kon worden, ten aensien jaerliex de Comp" 8 a 10 tonne gouwt was opbrengende.                   :  In Banda was over den gantschen omslach een guarnisoen van 400 coppen, namentlick :  Int casteel Nassauw op Neijra . . . . . .  coppen 89 In Belgica.  .   eee  n 30 Op de redout boven Belgica es       sn  10 De redout Kuijlenborch ende die omleech op Salamma.    20  Op Neijra coppen 149 Op Hollandia. . . .  . coppen 40 De redout Lackoij .            De Op Waijer. . . . eee eeen  24 Op Rossengeijn, Demmer ende Ourien ieder 12 coppen . eee eeen   36  op oro AD rr 60  Op Poelo Ron                     .       eeen     12 De voorder Compangies dienaers die de waepenen niet ge- bruijcken dan in tijt van noot bestaen in    69  t Saemen coppen 400.  En                                            Original from Digitized by Google                                  PENN STATE 
1643	1644	pst.000053235183-seq_0124.txt	106                            AMBOINA  op hun versoucq noch voor een tijt gecontinueert. Op Manipa was alles mede noch wel en de reduijt aen de Zuijtsijde in de negrije Tomelehu 44 voeten buijtens muers begrepen en ’t voleq zeer bewillich tot behulp van alles en op Louhouw bij Gommasongi de reduijt 40 voet binnens muers, waertoe al goede pertije steen met 2 cleijne calcqovens van 11 en 16 vadem in voor- raet was.  Vertrect naer Capaha en door ’t quaet weder verliesen 3 anckers op ’t riff van ’t Duijven eijlant. De joncq van radja Pallawan, Maleijer van Batavia gecomen, raecten in stueken dan wierd ’t meeste goet geberght. Naer dato met veranderingh en affnemen desselffs crijgen noch twee affgecapte anckertouwen weder.  Voor Louhouw hadde mede een lager wal en was insgelijcs omtrent 't casteel een swaer en onstuijmich weder geweest, zules dat veel bruggen der negrijen wech gedreven, des casteels westelijcke lantpunt in de gracht gestort , d'andere aent wijken, d'oost guardijn tenemael vervallen en de vordere muragie op veel plaetsen gescheurt. De secretarij, soldijcomptoir, de huijsingh langhs d’oostguardijn, de winckel, de verdere logiementen aen de lantsij vant gouverneurs- huijs aff tot de poort incluijs en al wat eenighsints vergaen, was geremedieert ende vernieuwt, zoodat in de eerste 8 10 jaren buijten ’t geen noch onder- handen is, geen ommesien meer naer wesen zal.  ’t Fluijtschip Oostcappel braght goet hout aen en doort behulp der in- woonders oncostelijck.  Wert mede noch een nieuwe calcqoven vereijscht, dat wel de meeste moeijte om hout en steens moeijelijkheijt te becomen geeft, versouct smeecolen nevens ’tgene de vordere petitie betrefft en meent alles wel te mesnageren.  Geen hemden tot  R" zoo wel voorgegeven was tot accomodatie der burgerije, zijn genaijt gewerden, maer willen 8 stuijvers buijten de zijde hebben, zules hoewel 80 packen Guinees linnen verschenen, geen hemden genaeijt noch nagelgewas geweest is, bij al de comptoiren geen dosijn overich sijn, wes de novo 100 packen eijscht, mitsdien een goet nagelgewas voorhanden is, dat meer vertieringh geven sal en secht dat rijckelijek zoo roode salampouris, mouris, percallen, tapeserassen, sijde petholen als anders geeijscht heeft, alsoo wel gesocht ende met goede advance vertiert werden, sich vorders tot de petitie refererende.  Boven 't geen resteert eijscht sijn E. noeh 50.000 realen in contant, op- dat niet als ’t voorleden jaer in gebrecq blijven mogen, maer vermeent eer meer dan 1580 bhaer nagelen te becomen.  Door 10 Maleijtsche als Javaense joncquen sijn 294 lasten rijs tot 55 R" per last aengebracht, die weder met eleden tot f 50.000 voldaen, en f 6752.8, voor ’sComp' gerechticheijt ontfangen sijn, goede sorge over ’t uijtvoeren bij hun van nagelen wert gedragen.  a AA mn  Original from  Digitized by Google                               PENN STATE 
1643	1644	pst.000053235183-seq_0332.txt	                                              Original from Digitized by Google                                    PENN STATE 
1643	1644	pst.000053235183-seq_0326.txt	308                                           CEILON  geweest disava van de Sete corlas, derhalven tracteert hem naer dat d’plaets die hij heeft meriteert. Wanneer iek den gescijden disava hebbe affgevaerdicht, heb ick geordonneert dat soo langh als hij conde onderhouden de landen van Mature onthoudende sich buijten, dat sulex doen soude, ende soo wanneer dat hij t niet soude conden doen, sich soude begeven met het swart volck in dese mijn fortresse, indien hij sich daerin compt begeven, UE. herberge hem.  Iek hadde gemeent dat dit jaer het mij mogelijck soude hebben geweest UE. te sien ende te vergelden de gastos die UE. tot mijnen dienst van wegen de Comp gedaen hadt, met mijn swart volek de welcke geadsisteeert hebben in dit mijn fort den gandtschen tijdt dat belegert geweest is, doch en beeft Godt soo niet gelieft, derhalven soo sendt mij het register derselve over Battacaloa om te weten wat se bedragen. 't Sedert dat dit mijn fort Gale belegert is geweest tot dat daer naer toe gegaen is Mampe Rala, hebbe ick eenige reijsen van Batticaloa secours van maintimentos gesonden naer dit mijn bovengeseijde fort, ende sendt in verselschap van ’t andre geseijde register een register van hetgeen UE. overgelevert hebben, opdat ick wete wat sij U hebben geintregeert. Sijnde eenige dachreijsen van Maricarware naer Cander, hebben se mij geseght dat de Hollanders waren gedisembarqueert in Caliture off in Alican in een van dese twee plaetsen ende dat haer daer fortificeerden hetwelek ick niet gelove, doch indient waer is (uijtgenomien om coopmanschappen te doen ende andre negotien indien andermael imbarqueren) alhoewel het waer tot mijnen dienst offte dattet door Uwen raadt dienstich waer bevonden off om onse vijanden aff breuck te doen, dat niet en disembarqueren om te fortificeren in eenigh gewest van dit eijlant Cheijlon, sonder mijn licentie.  Oock hebben se mij geseght dat een swarte vrouw van dit eijlant Cheijlou in dit mijn fort Gale met een Hollander was getrouwt Naerdat de Portugesen in Colombo geweest sijn, de wijll dat de naturele van dit eijlandt geen wettich ende natureel coningh gehadt hebben die macht hadde om haer te onderhouden ende te verdedigen, soo sijnder eenige gedoopt, aten ende cleden sich van de geseijde Portugesen, ende eenige vrouwen, latende de eere ende schaemte aen een sijde, trouwden met haer, doch nu nadien door Godes genade ick ben wettich ende natureel coninek, d'welek voorhebbe te vermeerderen ende te conserveren mijne weth ende costuijmen, latende de quade gepasseerde costuijmen der Portu- gesen, UE. en sult niet toelaten dat ter sodanige huwelijcken geschieden. Niet meer en valt voor. Godt beware UE. etc. Uijt dit leger van Bilacam den 23 Maert 1644.  't opschrift                             Was onderteijckent  Aen Jan Mathijssen                           Raija Singa. Capt moor van mijn fortresse Gale.                                                Original from Digitized by Google                                    PENN STATE 
1643	1644	pst.000053235183-seq_0285.txt	JUNI   1643.                                                         2617  onbewust, d'gecommitteerdens hadden mede aen dneijck in Sinsier versocht jaerlijex 800 a 1000 stucx slaeven (gelijck wel voor desen) te mogen coopen ende vervoeren, ’t welek ronduijt affgeslagen ende ten antwoorde gedient hadde, dat menschen te vercoopen niet alleen seer schandelijek voor de werelt, maer oock groote sonde bij haere goden gerekent wierde.  Den gouverneur Gardenijs bleef voornemens soodrae 'tjacht Lie van Ceijlon op Palliacatta soude aengelandt wesen, 't selve met weijnich coopman- schappen tot een preuff onder d'opsicht van een ondercoopman en adsistent naer de Suijt (om de negotie te onderstaen) af te vaerdigen en hunne residentie in Tegenepatnam te laten houden. ’t Succes van die uieuwe negotie soude eerlangh dan tijt openbaren. d’H" Gardenijs had aen de wevers van Caussewaron 1000 pagoden comtant op leverlnghe van Guinees lijwaet (dat schaers was) uijtgeseth.  tLeeger der Mooren was met groote conquesten tot 2 a 3 mijlen van Tripetij geavanceert, niettegenstaende gesustineert wierde, 't Jentieffs off Carnaticas leger vrij sterker als d'’Mooren te wesen, soo hadden echter de couragie niet tselve ’thooft te bieden off slagh te leveren: De geruchten liepen sterck dat den Moor Palliacatta belegeren en vermeijsteren wilde, 't welck d’negotie daer- ontrent soude doen stilstaen.  Wat den capiteijn generael van Negapatnam tot antwoorde van de ge- daene insinuatie over de betalingh der resterende 42000 R' aen d'h' Gardenijs geschreven hebbe, can hieronder pertinent bij ’t translaet van dien gelegen werden.  Copia translaet van seecker missive door den capt Generael in Nagapatnam aen den gouverneur Arent Gardenijs geschreven.  Door den brief dien UEd' heeft gesonden den 4 Februarij, hebben wij ver- nomen hoe dat in UE. fort was aengelanght de ratificatie van den trefves ge- maeckt tusschen den doorluchtichsten coninck don Joan den vierde mijnen Heere ende de lo. Mo. Heeren Staten Generael ende den Prince van Oranje. In der waerheijt door woorden can ick niet genoechsaem beteijckenen de blijtschap ende smaeckdie ick hebbe datter is een vrijheijt off gemeijnschap tusschen ons, daer- omme soo lange gewenscht hebben. Ick hoope dat Godt 'tselve met geluckige voortgangen voor langer tijd sal laten continueren ende wij, sijnde ondersaten, moeten houden met den anderen (gelijckt betaemt) een goede correspondentie ende UE. meucht voor seecker geloven dat iek mij sal laten vinden om te dienen niet alleen aen een ider int generael gelijck in den trefves is goet gevonden, maer oock int bijsonder sal ick dit presteren aen UEd' soo dickmaels ghij mij gebiet ende alle ’tgene ’t welck UEd' soude mogen goet vinden, d'occasie van UEd: dienst sal ick groot achten te genieten in ’t welck ick UE. mijne genegeut- heijt sal bethonen. Excuseert mij dit met meerder schrijvens te betuijgen, want ick belovedit te bethonen door de wercken.                                                Original from Digitized by Google                                    PENN STATE 
1643	1644	pst.000053235183-seq_0291.txt	JULI-SEPTEMBER 1643.                             2713  1347 indigo, voordesen door S" Pit om 2 in eoopmanschappen ende  In contant te betalen gecontracteert.  De coopre beckens per de Haen daer gebracht, stonden niet boven de helft van hun ecostende te gelden, soo was ’t gochij cooper mede niet gewilt, sulex veele coopmanschappen in de packhuijsen bewaren mosten, ter tijt ende wijle de landen van Carnatica vrediger geregeert, ende voor den inval der Mooren bevrijt wierden. Chinanna had uijt Veloer, alwaer den Carnaticaenschen coningh sijn hoff hout, geschreven dat ’t Moors leger meester van de stercke frontiere Oedigherij (op een bergh 24 mijlen noortwarts van Palliacatta geleghen en bij de Jentiven voor d’Mooren onwinbaer gereeckent) geworden was. Doch namaels wierd gerucht sulex onwaer, en in plaets van dien maer ’t hooft der geseijde sterckte in hunne handen vervallen wesen soude, de seeckerheijt stond noch te vernemen. Invoegen d’Mooren eerlangh wellicht ontrent Palliacatta met hunne macht verschijnen mochten. Deswegen recommandeerde Chinanna Palliacatta te verseeckeren ende liet te dien eijnde ontrent 1500 pijons aannemen, ’t welck mede al in den cleedhandel obsteren soude.  De geconfisqueerde 35 bondelkens robijnen van den oppercoopman Jan de Lange en Comp’, waeren in jegenwoordicheijt van d'h" commissaris Boreel, d'oppercoopluijden Paets ende Pit, nevens den ondercoopman Paauw geopent, ende door drij mackelaers of robijnkenders naer den althans merckt op 8264 Paliacatse pagoden geestimeert, versoeckt ordre off 't comptoir generael voor de tacxatie sal crediteeren offte niet. d'Maccause als Teijouans stoffen hadden bij vercoop maer 32 ten hondert avance gegeven. Op ’t Louwse gout per de Haen daer gebracht was door d’slechte des aloijs f 3699.10 (dat 124 p is) verlooren. Integendeel had ’tTeyouans f 24163.8.10 of 213 ten hondert avance gegeven, dat evenwel met ’t vorige gout per d’Waterhont daer gebracht 10 pc differeerden, ten aensien met meerder kennisse was ingeecocht.  Uijt seecker brieff van 8 Junij door den EE, Cornelis van Sanen uijt Wingurla per twee expresse patamers na Coromandel gesonden en op 6 Juli d’h" Gardenijs overhandigt, seit sijn E. verstaen te hebben dat naer ’t vertreck onser vloote in Goa twee jachten (namentlijck 't eene uijt Portugael ende ’t ander van Masambijecque) waeren gearriveert. Van gelijcken dat sich de Portugeesen dapper tot den oorlogh prepareerden, hebbende ten dien eijnden al eenige macht tot assistentie naer Colombo ende Maccauw uijtgeseth.  Den 3 Julij was schipper Blocq uijt eigen curieusheijt of plaijsier met d’groote sloep vant jacht Lis (in comp van den ondercoopman Jan Kemaet, ses cloecke scheepsofficieren ende sijn jongen) om de buijtencant vant riff te gaen diepen, onder geijl gegaen, ende nadat ontrent anderhalff mijl, vant scheepsvolck naergesien wesende, geseijlt hadden, is deselve geer subijt uijt hun gesicht ge- raeckt, ende naer alle apparentie met seijl overladen sijnde omgeslagen, ende alsoo de sloep van sinckhout gemacekt was gesamentlijek te gronde gegaen,  18                                                Original from Digitized by Google                                   PENN STATE 
1643	1644	pst.000053235183-seq_0246.txt	228                                           GOAWINGURLACEILON  alle d'gevangene ter hand gestelt, waermede naer landt gekeert zijn, largerende in tegendeel vijff en twintich matrosen van ’tjagt d'Pauw, die op d'vloot verdeelt wierden. Soo uijt Wingurla verstaen wierde soude den hartogh Mustafghan, sijn soon Assetchan, ende Saijsahel met haeren aenhangh int Visiapours hoff gevangen, den tamadaer van Wingurla gevlucht ende den houweldaer van Ponda, die eertijts ’t onvolbrachte accoord met d'Portugiesen (om sijn geldsucht te boeten) jegens de Nederlanders aengevangen, naer Goa geloopen sijn, vermits alle door den hartogh Eecleschan (die in Mustafghans plaets gesuccedeert is) beschuldicht wierden conspiratie met den mogol jegens 't Visiapourse rijck aen- gevangen te hebben.  Den geweesene president Wollebrandt Gedeijnsen was dikmaels doch vruchteloos aan boort geweest doordien d'’minste kennisse van den Portugiesen staet off doen niet (vermtis sijne continneele gijselinge in een cloooster) becomen hadde. 't Engels jacht d’Planter twelck 11m. onder wegen en op Cile om bloetco- ralen te halen geweest hadde, was den 22 October van Ragiapour bij de vloot ver- schenen en na gedoogde visite binnen Goa (om luttel caneel te halen) geseijlt. Soo was den Willem op den 24 dito mede van Ragiapour nadat aldaersijn ladinge ’t meerendeel tot aflegginge der op interest genomene 19000 p gelost hadde, ter selffde rede verschenen met intentie om te Goa, Carreware ende Baticaloa eeuige gereet leggende peeper te inberqueeren ende daermede na Ragiapour te retourneren.  Den commandeur Claes Cornelissen den 27 d op Wingurla verschijnende, quam den nieuwen gouverneur van Coudael in Comp' woninge, met eenige verdichte moorse praetgens, die aldaer met een goede schenckagie begifticht wierd. d’Engelsche Discouvre was primo November oock van Mocha ende Coutchijn en d'Expeditie van Bantham met 2 Portugese papen die pas van d’h" Generael hadden, na Souratten comende, bij onse vloot verschenen. Soo was hunne Planter den 11 November uijt Goa met 150 quintalen caneel bij d'com- mandeur ('k weet niet uijt wat redenen) te vervoeren gelicentieert.  Naerdat d'H" Portugiesen ende onse gecommitteerdens wedersijts opt stuck van d'vreede ofte lijmijtschijdinge der Ceijlonsche landrijen ende ’t largeeren vant schip de Pauw en sijn ingeladen goederen, dickmaels bij malcandren geweest, en door der Portugesen halsterck ende ongerechticheijt niets verricht, maer wel snodige dreijglijcke woorden gehoort hadden, soo was eijndelijck den commandeur Block met sijnen raedt te rade geworden haer dit volgende protest ten overvloede den 29 October binnen Goa toe te schicken.  Protest tegen, etc. ()  Op welck protest dit in antwoorde van ’t selve uijt Goa van hare  gecommitteerdens becomen hadden, Riposte welcke doende, etc. (1)  (1) Niet ingevuld.                                                Original from Digitized by Google                                    PENN STATE 
