start_year	end_year	File	Text
1675	1675	wu.89105697205-seq_0343.txt	10 er 11 DECEMBER.                         555  En dewyl dese Tonquinsvaarder aan ’teylant Timaon heeft ontmoetet de schepen, komende uyt Japan, soo heeft de E. Martinus Caesar by een preadvisje van den 5den deser haar Ed genolificeert, hoe al de 4 bodems dit jaar na Japan behouden gevaeren; en syn met deselve 29 November de retour tot aan poelo Timaon verschenen; en den Sten desselven maants uyt Japan vertrocken was, hebbende Comp saaken aldaar in redelyken goeden stant gelaten, maar, Godt betert, al weder desen jare, mits de schandige taxatie des gouverneurs, op Comp kostelyke coopmanschappen niet meer als 46 percento advance behaalt, waarom ook ’t capitaal niet soo groot, als wel gemeent, uytgevallen was; en stonden volgens ordre 5 schepen mettet geordineerde capitaal van daar ua Malacca voort te gaan; en syn er met Goylant, nevenfdesen, herwaarts te volgen.  Wwyders is heden in Rade van India verstaan om de onlusten, op en omtrent Timor, ontstaan, en tot dempinge der rebellien aldaar derwaarts te senden 6 schepen en 2 chialoupen met een aantal van 200 militaire koppen, verdeelt in 4 compagnien onder haare oflicieren en de sorge en uytvoeringe van die expeditie aan te bevelen het opperhooft aldaar den coopman, Jacob van Wyckersloot.  Item ook den predicant, Jacobus Rynsdyk, na Timor te beroepen ende hem aldaar te laten resideren.  Gelyk mede noch om wigtige redenen goelgevonden zy naar Ternaten tot gouverneur te verkiesen den Ede David Harthouwer om, soodra mogelyk, sich van Macassar derwaarts te begeven en den opperkoopman, Wybrant Dubbeldekop, provisionelyk voor eerst ’t gesag aldaar weder aan te bevelen.  11 d’. ’s Morgens erlangen per Javaans vaartuyg een brieff van onsen resident, Willem Caaff, tot Bantam, eergisteren getekent, en van volgenden inhout:  zedert syn jongste schryven van 20 November had by 4 deser per addresse van den licentmeester, Ockersen, 4 fugative matrosen, door d’Engelsen heer agent hem weder inhandigt, van daar terug herwaarts gesonden, gelyk nu wederom geschiedde met 5 andere, welke egter gemelte Engelse agent vrundelyk versogt, ditmaal van haar verdiende straffe mogten werden gepardonneert, met belofte van in toekomende ook sulke weglopers te sullen altyt restitueren ;  de Conink had 5 dagen na syn vorigh schryven van 20 November doen vragen, waarom ouse vertrocke retourvloot met geen koebeesten en andere verversingh was versorgt, alsoo hy daartoe bevorens al ordre had gegeven en ’t welk egter doen door pangeran Kidol, mits de Mayesteyts absentie, was verhindert, sulx te dien dage cito cito op gemelte Coninx begeren noch per 4 Javaanse vaartuygen met 50 ossen en 5 kalveren de vloote omtrent de Prince eylanden weggesonden en noch even te passe aan deselve overgegeven waaren; hebbende wyders gemelte Sulthan versogt met een diamant slyper van hier te mogen werden geaccomodeert ;  op Bantam liepen de gerugten, hoe de Engelse agent ginder hadde verhaalt, dat de Comp Bantam in korten wilde komen beoorlogen en sulx noch om der Engelsen als anderen wille wierde gelaten; en waarop de Konink soude hebben geantwoort: sulx te willen verwagten en altoos tot defentie gereet te syn;  Google 
1675	1675	wu.89105697205-seq_0223.txt	8 rn 9 AUGUSTUS.                             215  gordel chindos, tapechindos en moerissen, nevens een vat pik, 1 vat theer en een riem papier, etc., tot voortsettingh der negotie als de voldoeninge der aghterstallen, hoe eer hoe liever ten hoogsten van nooden waeren.  's Middags krygen per Javaans vaartuygh een cleen briefje, door d’opperhoofden van de fluyt, Spanbroek, geschreven tot advertentie harer komste in de Straat Sunda, dato 5 deser en verder hoe se 24 January van de camer Hoorn uytgeseylt en over de Caap in comp van meer andere schepen tot soo verre geluckigh overgeseylt waaren.  9 d’. Voormiddags komt hier aan lant per een chaloup, van de werf eergisteren afgestiert, de onderkoopman met de brieven van ’tschip, Japan, uyttet vaderlant gebragt, dewelke alhier niet werden aangetrocken, en daar besyden ook een originele missive van d'heer gouverneur, Isbrand Goske, en raat der Caap de Goede Hoope, van den 4tee Junius, meldende al sulx, als daarby staat te lesen en onder anderen van de aankompste der verscheyde schepen uyt het Patria, als insgelyx de 4 laatste retour schepen onder d’E. Ludder Brummer van hier, gelyk sulx nader by een cleen briefje van denselven E. commandeur, Brummer, (nu mede erlangt) wert genotificeert onder dato primo May jongstleden, namentlyk hoe zy alle op 18 April sonder eenige tegenspoet geluckig de Caap hadden beseylt en als doen weder zeylvaardigh lagen om neffens de Ceylonse bodems, President en ’t Wapen van der Goes, samen in Godes naam de reyse verder na ’tlieve vaderlant voort te setten.  Kort namiddagh krygen per 5 diverse Javaanse vaartuygen drie briefjens der schepen, ’t Huys te Cleef, Odycke en Buuren, komende uyt het vaderlant in de Straat Sunda mettet volgende advis:  dat van ’tHuys te Cleef dato 6 deser: hoe zy op 24 January deses jaars met 9 Comp: schepen waren uyt Texel geloopen (daar onder 2 gehuurde fluyten met materialen voor de Caap) en 9 Juny daaraan de Caap hadden beseylt, van waar na 4 weken leggens weder herwaarts waren gestevent in comp der schepen, Japan en Spanbroek, item de Beemster en Romerswale na Ceylon, en eyndelyk op dato in Sunda’s engte verschenen met gesont volk:  en dat van Odycke, gedateert 7 deser: hoe zy 22 February uyt Zeelant waren geseylt, gemonteert met 54 stucken canon en 229 coppen, waarvander op de reyse maar 2 waren gestorven en wyders 51 May aan de Caap quamen, van waarse 15 Juny voorts herwaarts vertrocken met gesont volk ;  item dat van d’fluyt, Buuren, mede van 7 deser: dat gemelte bodem met 101 man 22 February deses jaars van de camer Delf was uyt Goeree geseylt en over St. Jago, na ’tontmoeten van noch eenige andere herwaarts gedestineerde schepen, 30 May aan de Caap de Goede Hoop verschenen, daarse den 15den Juny weder vandaan na herwaarts quamen in comp van ’tschip, Odyk, dat nu met haar in Straat Sunda ware aangelant.  ’s Avonts verseylt wederomme naar Japara ’t jagt, Amerongen, medenemende:  22 packen diverse gesorteerde cleeden, van daar geyscht, ter montura van f 10260: 11:12.  Google 
1675	1675	wu.89105697205-seq_0237.txt	29 ex 30 AUGUSTUS.                            929  en voor 15 rd’, tot kleeding aan den nu terug gaanden Ceylonsen prins alhier verstrekt, samen monterende f 56666:17:13; behalven een recreut van 76 militaire koppen;  Ende daar besyden ook een originele missive van haar Ed: aan d’'Ed heer gouverneur, Ryklof van Goens, de jonge, en raat tot Colombo van dato deser en sodanigen teneur, als het afgaande briefboeck kan uytwysen.  30 d’. ’s Morgens vroeg verzeylen naar Japara ledig tot afhaal van jaty houtwerken de fluytscheepen, Elburch ende Swarte Leeuw, met een dubbelt briefje aan den coopman en resident, Jacob Couper, gisteren getekent en van volgende advertentie:  hoe zedert ’tafgaan van ’tjagt, Amerongen, de fluyten, Peguw en Swarte Leeuw, hier terug verschenen met schryven van 16 d’, neffens de eene groote champan, werdende nu de andere, neffens de twee onderhandse chaloupen, mede op ’tspoedigste verwagt;  en staan dese bodems in korten noch van de fluyt, Peguw, te werden gevolgt om met eenen de gecontracteerde sware masten en spilhouten af te voeren;  schynende verders des Sousouhounangs becommeringe (mits syn sware siekte) niet ongefondeert over den oproer, die met syn doot onder de soons ligt konde ontstaan, hoewel sulx ecgter niet en hoopen, als sullende soo wel voor dat ryk en ook ons alhier, bysonder in dese gebreckelycken rys tyt, gantsch niet wel komen; en dat wyders verstaan zy UEd aan te bevelen noch 4 zeyl chialoupen door den borger, Daniel Dupree, voor de Comp ginder te doen maaken, als een van 50, twee van 46 en een van 58 voeten lank over steven.  Voor den middag komt de gesant des Coninx van Abassina, geleyt door den sabandar, Ockersen, binnen ’tcasteel, eerst by syn Ed" den heer gouverneur generaal en soo vervolgens ook by de heeren Raden van India, ider in ’t bysonder, syn afscheyt nemen, wyle hy op morgen met het schip, ’t Wapen van Middelburgh, wederom naar Suratta staat te vertrecken om van daar dan verders naar syn lant en Konink te keeren; doch en wert door haar Ed als nu aan synen Vorst geen briefje in antwoort geschreven, maar sulx gelaten aan d’Ed heer commissaris, Willem Volger, in Suratta om ’tselve naar tyts gelegentheyt en vereysch van saaken ten dienste der Comp van daar als uyt haar Ed: naame te mogen doen concipieren en voortschicken ten geleyde van het wedergeschenk, dat als nu tot recompense van de becomen 2 rare woutesels en 2 Persiaanse paarden voor denselven Conink van Abassina mede in ’tschip, ’t Wapen van Middelburg, is afgescheept, bestaande uyt het onder gespecificeerde:  een kas daarin: 12 ellen scharlaken; 12 groen laken;  12 blauw 20 rollen Chineese goude lakenen ;  Google 
1675	1675	wu.89105697205-seq_0009.txt	2 JANUARY.                                  5  De Gouverneur Generaal en de Raden van India hebben al voor desen in haare brieven den Conink ende de regeeringe van Bouton bekent gemaakt, hoe dat die van Bouton geene vaartuygen souden mogen senden naar Ceram Laout ofte Kelfingh ofte andere plaatsen, dien wegh uyt, en datse maar alleen sullen mogen vaaren naar Amboina aan ’tcasteel, alsmede dat die van Ketfingh ofte Ceram Laout met haare vaartuygen tot Bouton niet en mogen komen; en evenwel heeft de Gouverneur Generaal tot leetwesen verstaan, dat niet alleen dit jaar weder eenige Boutonse vaartuygen op Keffingh geweest syn, maar ook dat Paducca Siry Sulthan op het versoek van den capteyn, Jan Francen, geweygert heeft den Keffingsen orangcay d'Joumat, die met syn vaartuygh in de rivier van Bouton lagh, aan hem over te geven, latende denselven ontvluchten, ’t welck soodanigh uiet en hadde behoort, want dat ook geen teeken van opreghte vrundschap is; doch evenwel was het den Gouverneur Generaal noch aangenaam uyt een brief van voorschreven capitain te verstaan, dat Paducca Siry Sulthan, naar ’t vluchten van den orangcay, drie mannen van syn volck met ses bassen en 625 Javaanse cleeden aan den capitain ter hant gestelt hadde, ’t welck soodanigh wel en reght gedaan is om noit tusschen de Comp en die van Bouton eenig verschil te veroorsaaken: en sal ook de Comp van haare zyde bethoonen, dat zy tot Paducca Siry Sulthan en het Boutonse volck van opreghter herten seer genegen syn; uyt Paducca Siry Sulthans eersten brieff hebben de Gouverneur Generaal en Raaden van India wel verstaan, dat Paducca Siry Sulthans afgesanten, genaamt Quitchil Lahassa en de capteyn, Bongeport, voorleden jaar naar Batavia gesonden, de reyse niet hebben konnen gewinnen en dat se weder terugge op Bouton syn gekeert; doch hebben ook uyt Comp volck, die op Zaleyer leggen, vernomen, dat zy door Quitschil Lahassa seer qualyck syn bejegent, het welcke den Gouverneur Generaal bedroeft heeft; want het is Quitchil Lahassa wel bekent, die soo lange met de Hollanders heeft omgegaan, dat men op de plaatsen, daar Comp volck legt, niet magh aankomen sonder sich met vrundschap bekent te maaken; ook hadde Quitchil Lahassa den sergeant, die op Bouton was, onder de oogen van Paducca Siry Sulthan met sooveel kleynaghtinge niet behooren toe te spreeken, als doenmaals geschiet is; maar, dewyle de Comp altoos getrouwe vrundschap soeckt te houden, soo wil de Gouverneur Generaal dit gepasseerde vergeten, vermanende niet te min Paducca Siry Sulthan ende de groote van Bouton, dat zy van haare zyde de gemaackte contracten mede getrouwelyck believen naar te komen ende degeene, die wegens de Comp in haar landt verschynen, met vrundschap en behoorlyek respect te bejegenen, als wanneer er noyt, soo lange son en mane schynen sal, voor eenige verwyderinge tusschen beyden te bevreesen. is, waarop sich de Gouverneur Generaal ook sal verlaten; voorts laten de Gouverneur Generaal ende de Raaden van India Paducca Siry Sulthan ook weten, hoe dat de groote almagtige Godt de Hollandse wapenen tegens haare France en Engelse vyanden seer genadelyk  Google 
1675	1675	wu.89105697205-seq_0021.txt	1113 JANUARY.                              15  in den brant met partye pady doen versorgen; hebbende de gemeente voor yder huysgesin eenlyk 20 bossen tot onderhout erlangt; en was door dit verteerend ongeval de rys ginder ten eersten van 20 tot op 50 rd" ’tlast opgeslagen ende de pady als verdere eetwaren soo mede naar advenandt.  2 vaartuygen met rys en pady waren daar noch van de Javaanse Oosteust gekomen, gelyk mede 2 andere met noch 50 60 Maecassaren, die de Konink al toegestaan had binnen te mogen schieten; de Chinees Conkos jonk quam soo even van Macauw met allerhande coopmanschappen; en de ladinge van ’t Cormandels Moors scheepje, ’t Claverblat, bestont uyt 1000 diverse packen met cleeden en eenige picols amphioen.  De Engelse schepen, Suratte, Marchiant en Johanna, stonden tegen 25 deser na Engelant te retourneren, hebbende de capteyn van ’teerste, mits syn swakheyt van volck, 40 France matrosen in hun dienst aangenomen om mede na Europa te keeren, etc.  12 d’. Niet bysonders voorgevallen.  13 d’. ’s Middags verzeylt naar Bantam tot overvoer der France gevangenen volgens resolutie van 4 deser het jagt, de Beurs, medenemende een cargasoentie voor ’t comptoir aldaar van:  1000 Spaance realen;  8 packen diverse cleeden;  1 kasie met 100 stucx zyde chindos, item partye schryftuygh en  tafelreetschap ;  4 stroyen Japanse porceleynen tot tafelgoet ;  1 kas Persiaanse wyn;  40 boter;  15 kannen oly; 50  azyn, etc, kostende......................  f 6655 : 6: 15.  En daarby een missive aan den onderkoopman en resident, Willem Caaf, op gisteren gedateert, van substantie:  dat na onsen laatsten weder 5 briefjes van Bantam hebben ontfangen, gedateert 11, 14 en 18 December, item 2 en 5 January, waaruyt gesien is, de Konink en de Chinesen etc. mettet verlies der jonken op de cust van China al een sware slagh hebben gehadt, hoewel egter gelooft wert, zy die negotie daarom soo voort niet slaaken sullen; wat de pangeran van Jambys soon om adsistentie tegen Johor voor bescheyt sal krygen, wert nader verwagt te verstaan, alsmede wegen der Macassaren versogte hulpe tegens Bima, die sulke zeerovers gantsch niet meriteren ;  dat de verkoop van 25 picols nagelen door den tollenaar, Secredana, haar Ede leet zy als een coopmanschap, hun bekent de Comp ontstolen te wesen; wesende wyders ook verstaan de aankomste en ’t aanstaande vertrek der Engelse schepen, item van ’t voorval des donders omtrent hun vlaggestok, gelyk mede van den swaren brant in de stadt Bantam, daarby al veel rys en pady sal syn vernield, qualyk slagende in dees schrale tyt;  Google 
1675	1675	wu.89105697205-seq_0035.txt	25 JANUARY.                         29  een memorie voor den schipper, Gerrit Koster, en verdere opperhoofden deser nu vertreckende scheepjes t'hunner naareghtinge van haar Ed’, per gisteren gedaghtekent en verselt met diverse toehoorende bylagen, en bysonder mede 4 originele brieven aan de Coningen van Bima, Dompo en Tambora, als crain Montemarano, gelyk dan ook boven des door d’Ed heer Cornelis Speelman insgelyx aan de Coningen van Bima en Dompo by die van de regeringe syn verselt 2 alsulke briefjes ende alle van alsulcken teneur, als hier onder vervolgens staan uytgedrukt; ende voor eerst de brief aan Radja Palacca tot Macassar.  De Gouverneur Generaal, Joan Maatsuyker, ende de Raden van India senden desen brief uyt een opreghte genegentheyt aan den hooghgebooren en kloekmoedigen Radja Palacca, die nu ook Konink is van Bonee, van Bontheyn en veel andere landschappen op het groot eylant Celebes, Comp' getrouwen bontgenoot, beroemt in wapenen, te water en te lande, soodat hy ontsaggelyck zy by alle Vorsten benedens wints, wenschende denselven een lanck voorspoedigh leven en alle geluck op deser aarden, soo lange het den hoogen Godt believen sal, en doen daar benevens aan hem haare hertelycke en genegen groetenisse.  Voorts wert syn hoogheyt Radja Palacca by desen bekent gemaakt, dat in ’tvoorleden Oostermousson by den Gouverneur Generaal ende de Raden van India wel syn ontfangen twee syner brieven, de eene van den 17den May op den 50"en van deselve maant met het jagt, Cochin, ende de andere sonder dato met het jagt, de Blauwe Visscher, op den 7den dagh van de maant September; hebbende uyt den eersten wel geerne verstaan, dat hem onse gesonde vereeringe van cierlyk geweer met den capteyn, Jan Francen, seer aangenaam was geweest, maar ons was ook leet te vernemen, dat syn hoogheyt doen vry wat onpasselyck was en dat hy daarom niet meer en kopde schryven; sulx is de Gouverneur Generaal ende de Raden van India in den laatsten brief lief geweest te lesen, dat Radja weder tot voorige gesontheyt gekomen ware, ’tgunt de goede Godt lange belieft te laten continueren.  Belangende het geene, dat wy voorleden jaar aan Radja wegen het gedoente van de uytgeweeken Macassaren en die van Sumbawa hadden geschreven, hebben wy naderhant van den president verstaan, dat het niet nodigh was, geweest eenige magt derwaarts te senden, omdat de gesanten van den Gonink van Sumbawa tot Macassar aan ’tcasteel Rotterdam waaren gekomen om haar voor de Comp te verootmoedigen, soodat se, mede haar contract gemaackt en heylighlyck beswooren hebbende, tot bontgenooten aangenomen syn gewerden; doch niet te min prysen de Gouverneur Generaal ende de Raden van Indien des Coninx genereusen yver, als hebbende sich al ten eersten gereet gethoont om in persoon met eenige vaarluygen derwaarts te trecken; zedert sal ongetwyffelt Radja wel ter kennisse gekomen syn, hoe het de capleyn, Jan Francen, op Sumbawa buyten verwaghtinge heel  Google 
1675	1675	wu.89105697205-seq_0023.txt	15 ex 16 JANUARY.                          17 aan de Westzyde:  In ’t block F, Adriaan van Lier, coopman ;    K, Gillis de Hont, borger.  Ende soo syn ook heden op de voortgebragte genomineerde by d’eerwaarde kerkenraat voor desen loopenden jare tot ouderlingen en diaconen in dese christelycke gemeente gecontinueert ende verkosen de naar genoemde broederen, naementlyck :  tot ouderlingen :  Sr. Barent Hobbe. ........  Gysbert de David Strantwyk ( by continuatie ; Wybrant Dubbeldekop.....  Adriaan van Nieuwelant  Nicolaas Baukes. .....  Warnaar Reulerius..... nieu verkoren ; Adriaan van Beeckum..  Dionys Kelck........  item tot diaconen:  St. Jacques de Bucquoy  Lourens Kruyskerke. ( by continuatie; Jacob Overduyn.....  Mattheus van Luchtenburgh  Jacob Snickers...  Adriaan Strykersbergh....  Guilliam don Loopes... ..  nieu verkoren. Bartel Claessen ..........  Cornelis Martiny en...  Bastiaan Pittavin.........  16 d’. Namiddaghs becomen per borger vaartuygh een briefje van den boekhouder, Pieter van der Beeck, tot Palembangh aan haar Ed van den bden deser maant, als by 'taankoment briefboek zy te vinden, onder anderen verhalende de gerughten, die daar liepen, van soo groote sterfte tot Atchin van duysenden menschen, dattet lywaat selve tot begraven derselver seer dier in prys gesteygert ware.  ’s Avonts al laat in den avont verschynt hier ter rheede van Cormandel het schip, Dordreght, met een retour des comptoirs Masulipatnam van:  157 packen diverse sorteringen cleeden ; 391 of 60901  gesponne Iyk- en cabelgaren ;  10600 stucx goeny sacken ;  5500 fyne goenys;  DAGH-REGISTER ANNO 1675,                                                          2  Google  nne 
1675	1675	wu.89105697205-seq_0037.txt	25 JANUARY.                                51  Noch recommandeert de Gouverneur Generaal ende de Raaden van India, dat Radja Palacca aan syne bevelhebbers in ’tlant van Bonee believe te recommanderen en sterck aan te bevelen, dat aldaar geene vaartuygen werden aangenomen ofte toegelaten als soodanige, die eerst aan ’t casteel Rotterdam geweest syn en licentie van den president becomen hebben, mitsgaders dat oock geene. Bougys gepermitteert werden sonder passe van den president ergens naar toe te vaeren; want andersints, by ontmoetinge in zee, kan men niet weten, of het goet of quaat volck is, alsoo al bereets ondervonden zy, dat de Macassaarse rovers haar mede voor Bougys weten uyt te geven, daar de Comp schade by lydt; insonderheyt sal het ook noodigh syn in Bonee de Bougys sterkelyk te verbieden, dat zy met haare prauwen voorby Bouton naar Ceram niet en vaeren om met de Keffingers en elders daar omtrent te gaan handelen; want dat geensints geschieden magh, omdat van ouder gewoonte sulx een scherp verboth is, werdende door de Comp diegeene, die men daarop komt te betrappen, swaarlyck gestraft, sulx sal het den Gouverneur Generaal ende de Raden van India seer aangenaam wesen, indien Radja Palacca daarin behoorlycken believe te voorsien en al dese saaken in goede aghtinge te nemen.  Eyndelingh stieren de Gouverneur Generaal ende de Raaden van India tot een teeken van hare groote genegentheyt, alsmede tot een kennisse van syn hoogheyts goede gepresteerde devoiren, wederom hier benevens:  5 stucx schoone geprobeerde snaphaan roeren ;  4  puyk van pistoolen;  5  allegias met goude streepen ;  5 fyne mallemollen ende  35 basta brootchia.  Geschreven in ’t Casteel Batavia op den 18den dagh van de maant January 1675. Onder stond: De Gouverneur Generaal van Nederlantsch India. (was onderteekent): JOAN MAATSUYKER.  Aan den Conink van Bima.  De Gouverneur Generaal, Joan Maatsuyker, ende de Raden van India hier tot Batavia stieren desen brief aan den Conink van Bima, denselven als bontgenoot van de Comp groetende met genegentheyt, hem toewenschende van goeder herten landurige gesontheyt, ruste en voorspoet in syne regeringe en insgelyx aan Turilia Gampo.  Wyders naar dit laaten de Gouverneur Generaal ende de Raden van India aan den Conink van Bima en Turilia Gampo weten, dat haar brief door den capteyn, Jan Francen, uyt de pagger op Sumbawa naar herwaarts gesonden is, denwelken wy met het schip, den Hannibal, op den 10de dagh der maant October alhier wel hebben ontfangen en daaruyt ook met contentement verstaan, dat des Coninx gesanten op Bima behouden  Google 
1675	1675	wu.89105697205-seq_0221.txt	Ser 6 AUGUSTUS.                          215  Ternaten en de Comp gemaakt door Paducca Siry Sulthan, aan alle de grooten voorgelesen en bevonden, dat het tusschen myn heer vader en den Gouverneur Generaal, Carel Renierse, gemaakt en op Batavia besworen was, gelyk ook het contract op Macassar en Bouton, ’t geene Paducca Siry Sulthan en alle de grooten aan de Comp versoeken, dattet selve, soo ’t beswooren is, onveranderlyk voor altyt magh onderhouden werden, alsoo Ternaten broeders en vrunden in alle opreghtigheyt en vromigheyt van de Comp syn, want de Comp geen quaat aan haar bontgenooten doet en wy sullen het contract, dat besworen is, onveranderlyck tot onse kints en onse kintskinderen onderhouden.  Voorders heeft Paducca Siry Sulthan en alle de grooten capteyn Baccary versonden, die in comp van Bappa Majuda van hier is verseylt, maar capteyn Baccary is op ’tlant van Pangsiano gebleven om aldaar ordre te stellen, alsoo Lummanipa Radja Woena oprockende, ’t geene ook de oorsaak is, dat de volkeren van ’tlant Pangsiano ons niet willen gehoorsamen ; dierhalven hebben wy aan Bappa Majuda en capteyn Baccary volkomen ordre en last gegeven ’tbeste te beraden, dat tot welstant van Pangsiano soude strecken.  Soo sent dan Paducca Siry Sulthan en alle de grooten Bappa Majuda als gesant naar Batavia om by de Comp te verschynen en met ernst te versoeken ’tlant van Ambon, omdat wy Conink van dat lant en volck syn; want, indien wy geen volck hebben, is ’t niet noodig, dat den naam van Gonink voeren; dierhalven sal ’tgoet wesen, dat de Comp ons ’tselve weder geeft, op dat des Comp naam daardoor in alle opreghtigheyt geroemt magh werden, want wy vertrouwen, dat de schult van ’tlant van Amboina al vergeten en vergeven is.  Noch versoeckt Paducca Siry Sulthan aan den heer Gouverneur Generaal, den president op Macassar geliefl aan te schryven ons te laten toekomen veertigh paar getrouwde luyden van Zaleyer om het graf van myn heer vader te bewaeren; noch laat Paducca Siry Sulthan aan den heer Gouverneur Generaal weeten, dat, wanneer Bappa Majuda weder naar Ternaten sal gekeert wesen, Paducca Siry Sulthan van meeninge is dat fregat naar Solot te senden om het gedoente van de volckeren van Solot te besightigen, alsoo ’tonse volckeren en onderdanen syn, alsmede om te sien, watter. in dat jaar gepasseert is, gelyk in den brief van den coopman en president van de Molucecos, Willem Coornput geschreven is, waaruyt de heer Gouverneur Generaal alles ter degen kan sien en verstaan.  Verders heeft Paducca Siry Sulthan voor dees tyt aan de Comp niet anders te senden, dan een geschenk van vier jongens.  6 d’. ’s Morgens becomen per Javaans vaartuyg een briefje van de opperhoofden van ’tschip, Japan, komende uyttet vaderlant in de Straat Sunda, dato 5 deser, eenlyk met advis, dat zy tot daartoe de reyse volbragt en gedurende deselve 30 dooden, neffens 4 weggelopene verloren hadden, met verder gesont volk.  Google 
