start_year	end_year	File	Text
1675	1675	wu.89105697205-seq_0334.txt	526                     30 NOVEMBER.  146 stucx vaartuygen, per transport.  25 vaartuygen van Grissee met 92 mannen, 97 lasten rys, 121600 stucx kneppel suyker, 26 potten oly, 5 picols buffels smeer, 60 bossen pady en 7000 stucx suyker Sombaar.  5 van Bantam met 20 mannen, 2200 stucx potten en tresellen, 700 potjens met oly, 400 met kalck, 1000 stucx oude clappus en 11000 stuex oude pinangh. 11  Rambangh met 48 mannen, 890 stucx planken, 1150 stucx balcken, 80 slucx swalpen en 70 korven witte suyker. 2 Banjer met 17 mannen, 270 picols en 15 cattys peper, 40000 stuex oude pinang en 1000 stucx cadjangs, t'samen 187 stucx groot en kleene vaartuygen, dewelke t’samen generalyk hier hebben aangebragt d’naarvolgende coopmanschappen en andere proviand nootlykheden:  557', lasten rys;  7000 stucx suyker Sombaar ;  2 witte boontjens;     500 gadja; 10 zout;                 122000  kneppel suyker; 500 poltjens met suyker;                6 slaven en slavinnen; 400 potten met kalck ;                 80 diverse stoflen ; 1055     olye;                  20 damasten; 2200 stucx potten en tresellen ;         220  pangsjens; 22 canassers ajuyn;                    40  gilams; 8               ,            buffelsvlees;                                        41  hoekiens; 701 korven witte suyker ;              20  buffelshuyden; 200 swarte suyker;            1000  gesoute eyeren; 400 bossen gomoet touwen;            40 hoenders; 2500     tamarinda;                   6 picols koperdraat ; 580            rottangs;                                         1952 peper; 5500 pady;                                                 360  spiaulter; 91000 stuex oude pinangh;                12  zyde; 2000    .     clappus;                70 radix China; 2300 cadjangs;                                           60  lanquas;  8500 duygen;                                                    35 thee; 2890        balcken;                                  2 stik zyde; 4840 planken;                      17  toebacq Java; 1130            s  swalpen;                                                               4 harpuys;  50        knieshouten ;                               2   comyn; 21500    arrax pullekens;               5 buffels smeer; 2900     suyker jaty;      30 rycxdaalders aan contanten.  Daarentegens syn in deselve tyt wederom vertrocken 108 stucx diverse slagh vaartuygen na de ondergemelte plaatsen : 8 vaartuygen naar Grissee met 3571 rd aan cleeden, 57 rd oud koper, 21 rd aan diverse porceleynen en 42 rd aan oud yser; 8 slucx vaartuygen, die transportere.  Google 
1675	1675	wu.89105697205-seq_0320.txt	313                    21 NOVEMBER. in ’tfluytschip, den Gehuurden Hovelink, voor Amsterdam :  128 packen diverse sorteringen cleeden en lynwaten ; 6600 wit Cormandels cattoene garen in 44 packen ; 4830  Surats cattoene garen in 28 packen ;  10070  gommelak aan de stokjens; 8410 Bengaalse caatchia ; 3625 borax; 749 rood zegellak ; 106497  Japaarse poeyer suyker ; 194480 Bengaalse geraffineerde salpeter ; 45791 divers sappanhout; 65 moten swart en 33 moten root Mauritius ebbenhout 36815 groot schuytloot ; 29 stucken out yser canon; 5500 geconfyte notenmuscaten in 5 vaten; 340156 cattys swarte peper................evveervenns f 125499:2: 2,  in ’tschip, Hendrik Maurits, voor Zeelant :  18000 ruwe Persiaanse zyde legia in 100 balen; 3254’,, Bengaalse rouwe zyde in 22 balen; 1 kist met 180 stucx Bengaalse armosynen ; 271  packen diverse gesorteerde cleeden ; 3450 ft Surats cattoene garen; 6900 Cormandels cattoene garen ; 6570     gommelack op de stokjens; 1885    ongeraflineerde caatchia; 19080 indigo biana; 690      Surats zegellack ; 3545    mirabolanen; 152      alo Succattorra ; 5625 borax; 20025    calliatourhout ; 21290    Cormandels ebbenhout; 48995    Bimas sappanhout; 50000 Japans geraffineert staafkoper in 400 kisten ; 1000 cattys witte peper; 227040 diverse geraffineerde salpeter: 88 koek oly van notenmuscaten; 49805     Bataviase poeyer suykeren ; 50808 vette notenmuscaten ; 58905    giroftel nagelen;  Google 
1675	1675	wu.89105697205-seq_0283.txt	15 OCTOBER.                       235  de groote affaires van de Comp, soo boven, als beneden wints, om alle de verschillen, soo te water, als te lande, te vereffenen, en ook seer medogende met alle kleene en geringe lieden; en syn faam wert beneden wints door de geheele werelt over syn godtvrugtigheyt geroemt.  Verders maake aan den heer admiraal bekent, als dat er tegenwoordigh niemant anders is, waarop, soo in ’t goet, als quaat, ons vertrouwen konnen stellen dan op den heer admiraal; en omdat wy niet weeten de gelegentheyt en costumen van de grooten, dierhalven versouken wy aan den heer admiraal, dat alle jaaren met alle vaartuygen en schepen een cleen briefje ons gelieft te laten toekomen en ook niet naar laten met alle schepen, die naa onse plaatse vertrecken, indaghtigh te wesen, opdat wy ’tgeene van de grooten ons opgeleyt is naar vernoeginge mogen verrigten en naar behooren uytvoeren, opdat wy in geen onguust mogen geraaken; want naar ons gevoelen, indien wy oorsaak waaren van eenigh quaat tegens de CGomp, soo souden wy den heer admiraal affronteren, want wy hebben ons en ons lant aan den heer admiraal overgegeven; daarom gelieft ons de heer admiraal een goeden wegh te wysen, dien wy mogen gebruyken; want soo lange de werelt duuren sal, sullen wy van teontract van de Comp niet scheyden ; dierhalven versouken wy aan den heer admiraal ons gelieft aan te wysen, waarinne wy eenige aangename dienst aan de Comp souden konnen doen; want, voorwaar, wy syn gantsch onkundigh om de magt en heerlykheyt van de Comp naar behooren te erkennen, of de heer admiraal moet ons den wegh wysen; wy hebben de Comp wel gekent eer den heer admiraal, maar hoedanigh, dat wy ons als bontgenoten van de Comp sullen gedragen, weten wy tegenwoordig noch niet: dierhalven verstouwten wy ons by den heer admiraal, op wien wy vertrouwen, want door den heer admiraal syn wy onder de Comp gekomen, soodat wy by gelyckenis als een vogeltje aan den heer admiraal vast blyven hangen, even als van een grooten boom, onder wien wy onse schuylplaats nemen, soo is ’tmet ons en den heer admiraal; daarom de heer admiraal gelieft geen gehoor te geven aan aanbrengers ofte aghterklappers, opdat wy van onse schuylplaatse niet verjaagt werden.  Verders ’tgeene onse sabandar belooft heeft, dat sullen niet vergelen ; en hebben ook onder onse onderdanen vernomen, offer imant in ons lant was, die sappanhout wilde verkoopen voor , rd ’t picol en 'f, rd: voor des Coninx geregtigheyt, waarover de coopman, de Bocq, ons veel moeyelykheden heeft aangedaan; gelyk ook aan hem versogt, wanneerder imant sappanhout wilde wegen, dat hy ’taan ons soude bekent maaken om door ons gewogen te werden en de geregtigheyt van ', rd daarvan te trecken, want van de Comp kunnen wy viel eysschen ; waarover de coopman, de Bocq, verstoort is geworden en, wanneerder gewogen, ons niet heeft willen bekent maaken; en doen wy ’ hem vraagden, wert hy op ons verstoort in presenlie van sehipper Coster, schipper Claas en capteyn Jan Francen en heeft geseyt: Lis nu de eerste reyse, dat de Conink van Bima 25 perceuto van thiol  Original from  piokized by (SO   gle                    UNIVERSITY OF WISCONSIN 
1675	1675	wu.89105697205-seq_0297.txt	30 ex 31 OCTOBER.                          289  500  zeylgaren, 900 stucx zeyl en 450 stucx lyknaalden ; 15 sacken met mosch ; 60000 stucx geele klinkert steenen; 15 gesorteerde ankers, wegende samen 11269 ; 150  Luykse slootplaten en 8  speerhaken; 76 legger schoven en 25 stucx varkens schoven, belopende samen f 55257:12:1.  31 d’. ’s Morgens gaat het jagt, de Cabeljauw, naar Japara met schryven aan den resident, Jacob Couper, van gisteren en volgende advertentie:  dat dit jagt nu gaat om de reys, voor Macassar geprocureert, herwaarts over te halen en de wanladinge desselfs voort met ligt hout te werden gesuppleert; item, dat de jagten, Beurs en Amerongen, 25 deser hier ook verschenen en ’teen goede saak sal syn, soo Elburg van Rembang dus laat de nieuwe chiampan kan medebrengen, gelyk ook, indien noch party rys, al was ’t schoon dierder als d'andere, voor Batavia konde werden geprocureert om de groote schaarsheyt derselver en ’t verlopen Oostermouson, waar door noch in lange niet veel zy te verwagten.  Werdende wyders nu een ander bussemaker in plaats van den onbequamen scheepscorporaal derwaarts geschickt tot gebruyk.  ’s Avonts arriveert voor het laatste schip uyt Amboina de fluyt, de Spreeuw, geene nagelen en niet als eenigh ongetaxeerl geweer medebrengende, te weten:  B1, stucken out yser canon en 20 stucx ysers ankers;  10 compassen, 5 nagtglasen en 5 lantaarns;  2 dommekragten, 8 dreggen en 2 klokjes, beneffens drie kassen met alle de schrifturen dier provintie en een missive van d’heer gouverneur, Anthonio Hurt, en raat aan haar Ed’, gedagtekent 20 September, van sodanigen inhout, als 'taankoment briefboek kan uytwysen, en dat het presente bloeyende nagelgewasch voor ’taanstaande jaar een seer ryken en opulenten oeghst beloofde; en dewyl dese bodem (als gesegt) geen speceryen inheeft, soo is Japara aangegiert en ter ordre van den resident, Couper, daarin noch gescheept:  500 stucx kleene balkjens en  92 kleene kromhouten, kostende... ................. f 340:10.  In geleyde van een cleen briefje, door den onderkoopman, Everard van der Schuur, aan haar Ed' dato 24 deser en volgende substantie geschreven:  hoe na 'tafgaan van de Beurs en Amerongen de resident Couper na Rimbangh was vertrocken om met de houtleveranciers afreekening te houden, de over te blyven houtwerken eens pertinent op te nemen en haar Ed’ als dan berigt van te geven: inwylen verscheen daar 22 deser ledig, neffens veel sieken, uyt Amboina dese fluyt, de Spreeuw, met 42 picols Ceramse massoy voor Japara, die dan geligt en ten eersten de voorstaande balkjes, etc. weder in plaats gescheept waren; en stinde de fluyt, Elburg, van Rimbang in 1 2 dagen mede herwaarts te volgen.  DAGH-BEGISTER ANNO 1675.                                                  19  Google 
1675	1675	wu.89105697205-seq_0268.txt	260                           Tern 8 OCTOBER.  Besyden een briefje van den coopman en resident, Jacob Couper, dato 50 passado, meldende eenlyk, dat de beloofde tweede chiampan van den borger, Daniel Dupree, door nalatigheyt van den Rambangsen sabandar nu niet had konnen mede gaan en om de laatheyt des tyts derhalven dit mouson daar al swarigheyt in gemaakt wiert, hoewel men egter dese -fluyt nogmaals ten eersten gaarne wederom derwaarts verwaghte.  Van ’t Mattaramse hof, noch Wirat Macka’s gedoente wiert thans niet gehoort, maar de versogte contanten van hier andermaal met eerste occagie verwaght.  8 d’. ’s Morgens verschynt het jagt, de Cabeljauw, voor de laatste besendinge uyt Ternaten over Macassar, eenlyk van Ternaten medebrengende 7750 wax, kostende f 4464, nevens de originele missive met alle de bylagen van den raat uyt ’teasteel Ternaten aan haar Ed de dato 14 Augustus, dewelke in copie op 29 verleden maants per ’thoeker, de Hengelaar, al is ontfangen en by ’t aankoment briefboek kan werden naargelesen; sullende de nu mede erlangde brieven der Moluxe Koningen ’t haarer inhalinge in desen werden geinsereert.  Onderwylen dit jagt enpassant tot bestellinge van partye bastlont als anders Macassar hebbende aangegiert, soo brengt het van daar ook mede, beneflens 100 picols Bima’s sappanhout tot f 500, een missive, door den Ed president, David Harthouwer, en raat uyt ’tcasteel Rotterdam aan haar Ed gecarteert in dato 24 September, neffens ook een secrete missive van gemelte syn Ed’, onder selver 24 September geschreven, over ’t gedoente en den toestant der saaken wegens Radja Palacca, etc, sooals by ’taankoment quartier van Macassar staat te beoogen.  ’s Middags verschynt voor het jongste schip deses saysoens uyt Banda ’t jagt, Muyden, inhebbende:  511 heele en 9 halve sockels met foelie; 28875 cattys Banda notenmuscaten ; 400 f nooten marmelade in 61 doosjens en 12 halve leggers gepekelde nootenmuscaten, ten bedrage van f 57517:17:12.  De missive met diverse bylagen, daar beneffens van den E. Marten Roos en verderen raat des casteels Nassauw aan haar Ed' geschreven, is van den 16de des voorleden maants en onder huydigen dato ingeschreven, meldende onder anderen noch al van de continuatie der groote sterfte in die provintie.  Ende hoe by een opgenomen en nu mede overgekomen lyste ’t getal der menschen over gants Banda was bevonden tegenwoordigh te bestaan uyt 6595 zielen, soo Comp dienaeren, borgeren, inlanderen, slaven en vrouwen, als kinderen.  Namiddags becomen per den Bimanesen sabandar, Codja Roeboe, per ’t eygen inlants vaartuygh van daar een briefje, door den onderkoopman, Paulus de Bock, uyt Comp wooninge ginder aan haar Ed’ geschreven, dato 5 September, beneffens ook een Maleytse missive van syn heer en meester, den Conink van Bima, dewelcke na translatie bevonden is van volgenden teneur.  Google 
1675	1675	wu.89105697205-seq_0240.txt	252  31 AUGUSTUS.  Dese afgeweken maant Augusto bennen hier van verscheyde quartieren met allerhande coopmanschappen ook mont, als andere provisien en whaaren ter merkt gekomen een aantal van 185 stucx,  soo borger, als veelerhande inlanderen vaartuygen, te samen bemant met 865 coppen, als:  5 vaartuygen van Caliwongen met 12 mannen, 4000 stucx jaty legger duygen, 6 picols alluyn, 1000 bossen tamarinda en 200 gindiens. van Madura met 8 mannen en 60000 stucx orangje appeltjens.  Le   to lm LD  al  te te  16  17  10  Dermajoe met 17 mannen, 7 lasten rys en 160 stucx planken. Terbaya met 4 mannen en 1000 stucx oude clappus.  Baly met 19 mannen en 25 stucx slaven en slavinen.  Tadoenang met 8 mannen, 3 picols alluyn, 5 potten blauwe verwe, 200 bossen tamarinda en 3 lasten zout.  Brahan met 8 mannen en 7', lasten zout.  Singenap met 4 mannen, 5 lasten groene cadjang, 20 potten oly en 50000 stucx oude pinangh.  Cherita met 23 mannen, 15200 stucx oude clappus en 60000 stucx oude pinangh.  Rambangh met 96 mannen, 2400 stucx jaty planken, 1080 stuex balken, 4 lasten zout, 1000 bossen rottangs, 1 last rys en 16 korven witte suyker.  Samarangh met 64 mannen, 110 korven swarte suyker, 20 korven witte suvker, 71f, lasten rys, 53800 stucx gedroogde baggers, 400 bossen tamarinda, 650 stucx planken, 4 lasten Chineese hoontjens, 50 stuex hoenders, 5500 stuex duygen, Hy, last groene cadjang, 5 picols alluyn, 50000 stuex oude pinangh en 100 bossen goemoet touw. Cheribon met 76 mannen, 52000 stucx arax pullekens, 155 korven swarte suyker, 4', lasten rys, 650 bossen pady, 5000 stucx pees pada, 50 stuecx rysmanden, 15 korven witte suyker, 18 lasten zout en 600 stuex gedroogde baggers.  Grissee met 97 mannen, 3511, lasten rys, 25 korven swarte suyker, 62 potten oly, 80000 stuex oude pinangh, 400 stuex steenbrasems en 20 stucx slaven en slavinnen.  Bima met 15 mannen en 50 stucx slaven en slavinnen.  Tegaal met 48 mannen, 16 lasten rys, , last zout, 50 stucx hoenders, 60 eenden, 50 bossen rottangs en 800 hossen pady. Damaecq met 12 mannen, 110 stucx balken, 500 stucx planken, 1, last rys en 20 korven swarte suyker.  Paekalongen met 40 mannen, 17, lasten rys, 50 stuex hoenders, 5 koebeesten, 2 paarden, 1000 stucx gesoute eyeren, 100 bossen pady, 1000 oude clappus, ', last groene cadjang en 10 potten oly.  127 stucx vaartuygen, die transportere.  Oe                                              Original from piokized by (SO   gle                    UNIVERSITY OF WISCONSIN  NN 
1675	1675	wu.89105697205-seq_0254.txt	246                          13 SEPTEMBER.  1920  Ceylonse caneel in 24 balen... 1 kleene kas rooswater.,........EN 1 kas met een groote spiegel . 1 stuk scharlaken en n 55, ellen gebloemt Hollants zyde stoff. . 4 stucx sabelklingen................. samen tot. .............. f 5276:14:1;  voor den Canarasen handel,  in ’tschip, Zuydpolsbroek, voor Cochin:  8000  giroffel nagelen ;  2025 rompen en  4620 foelie;  20000  inlantsen harpuys;  5000 stucx heele jaty legger duygen; 2 dubbele blaasbalken en 4 vaten Timors kryt;  1000 stucx hant en 50 storm granaten, 20 kruyt hoorns;  49650  diversch yser en 450 staal; 50 ysere sloot platen en 1 kas met dommekragten ; 28 vaten Hollantse en 7055  cust spyckers ;  1 kist en een doos met medicamenten, monterende.... f 15905:5:8;  in ’tschip, Dordregt, voor Wingurla en Coudewaar:  10045  nooten muscaten; 3025  giroffel nagelen; 1540 foelie; 1 kas met papier en schryftuygh; 1 vat mom en 1 vat Delfs bier; 1 halfaam olyven oly en 1 halfaam asyn, kostande' oen seneen pna nen meren ennn.. f 5898:19.  De missiven, daar besyden aan d’'Ed commandeur, Hendrik van Rheede, en raat tot Cochin, als aan den resident, Abraham Lefeber, en raat tot Wingurla, beyde dubbel afgaande, gelyk mede de memorie, den Ed Rombout Lefer t’syner naeriglinge nu wmedegegeven, syn gisteren avont by haar Ed: geteekent en onder dien dato by het uytgaande Indisch briefboeck na te lesen.  Heden is ook, op gedane versoek aan haar Ed door de opperhoofden van jagt, Odyeke, ende de fluyt, Spanbrock, beyde voor haare uytreyse geaccordeert de volle ses maandige premie.  Voormiddags retourneert hier van Japara ook ’t jagt, de Beurs, medebrengende :  60 stucx moerbalcken ; 180  huysbalcken;  Google 
1675	1675	wu.89105697205-seq_0081.txt	2328 FEBRUARY,                             75  Tegenwoordigh sullen hiermede besluyten en maar dit eenlyck noch  seggen, dat tot onderhoudt van vrundschap en niet, omdat het zy van waardy, uwe hoogheyt toesenden dit naarvolgende, als te weten:  5 ellen root scharlaaken ;  5 aurora silver moirha;  2 stucx fyne bethilles Ternatanes ; 2 Bengaalse armosynen;  1 goude Suratse allegias en  1 kleene kas rooswater.  In ’tCasteel Batavia den 25er February 1675.  Onder stont: De Gouverneur Generaal van Nederlantsch India, (was geteekeut): JOAN MAATSUYKER.  24, 25, 26 en 27 d’. Is niet bysonders voorgevallen.  Dese afgeweken maant syn van verscheyde buyten quartieren te deser stede aangekomen een aantal van 66 stucx groot en kleene vaartuygen,  samen bemant met 676 mannen, als, te weten:  2 vaartuygen van Tegaal met 8 mannen, 5 lasten rys en 600 bossen pady. 4 van Samarangh met 18 mannen, 7', lasten rys, 5 picols toebacq Java,  TO en  2  5 picols annys Java en 1000 stucx kistplancken.  Palembangh met 118 mannen, 5525 picols en 64 cattys peper, 15 picols wax, ', picol guttegember, 8 kisten zeep en 8 stucx alcativen Tanara met 19 mannen, 19000 stucx mangustangussen en 25 slucx pompoenen.  Bantam met 59 mannen, 1500 potten met kalck, 4100 stucx potten en tresellen, 265000 stuex oude pinangh en 1900 stucx oude clappussen. Dermayoe met 12 mannen, 100 bossen pady en 3',, lasten rys. Cherita met 12 mannen, 1200 stuecx durioens, 2000 slucx oude clappus en 9000 stucx mangustang.  Lassem met 4 mannen en 100 stucx balcken.  Craoan met 2 mannen en 5 picols toebacq Java.  Tangeran met 8 mannen, 90 stucx hoenders, 180 waterlimoenen, 30 stucx groote comcommers en 15 pompoenen.  Laboangh met 4 mannen en 150 stucx oude clappus.  Johoor met 27 mannen, 1400 stucx cadjangs en 5 picols thin. Patany met 17 mannen, 8000 stucx dammers en 5000 stucx viskuyten. Cheribon met 4 mannen, 4000 stuecx arrax pullekens en 1000 stucx gesoute vispampus.  Packalongen met 8 mannen, 110 potten olie, 100 stucx potten en tresellen ende 2 picols kapock.  66 stuex vaartuygen, die transportere.  Google 
1675	1675	wu.89105697205-seq_0095.txt	12-14 MAERT.                     89  dat de Macassaarse rovers van Grissee en elders souden wesen weggejaagt  en daaruyt de onlust des Sousouhounangs tegen den pangeran Depaty ten deelen  ontstaan, was een gewenschte saake, als ’t waar is; blyvende evenwel het werck  derselver roovers omtrent de Javanen ons geheel suspect, te meer de gedane  klagten over ’tafloopen der chialoup van den borger, Abram Struys, by de sabandars  van Samarang, Damacq en Japara in gants geen aghtinge genomen Zy; wesende van  de ongenugten over de successie des Sousouhounangs in ’t Mattaramse ryck gants niet seekers te oordeelen, dat de tyt moet aanbevolen blyven.  ’t Jagt, de Pauw, voor Macassar meest gereet leggende, staat ook Japara aan te loopen om voorts met houtwerken en ook party rys (soo se becomelyk ware) gevult en ten spoedigsten als dan voort gedepescheert te werden.  135 d’. Niet bysonders voorgevallen.  14 d’. ’s Avonts gaat voor de laatste besendinge naar Macassar onderzeyl het jagt, de Pauw, met de onderstaande behouftigheden voor dat commandement, als :  65 packen diverse sorteringen cleeden; 1 pack cattoene gaaren; 1 kas met 103 chitsen, 25 Bengaalse armosynen, 20 paar cattoene kousen, 50 vellen Persiaans leer en 80 bossen schaften ; 1 kas met 2 goude moirhas, 2 phelpen, 50  holligaren, 5 grouwe lakenen en 5 ditos chergies ; 2 kisten Suratse zeep; 2 kleene kassen rooswaeter; 127 thin; 500 stucx lange goenys in 50 pakjens; 11000 rycxdaalders contant payement in 5 kisten; 50 stucx jaty kist en 350 stucx affuyt planken; 30 rampaart planken; 1555 divers yser en 25 slootplaten; 1170  cust spyckers;  300 stucx koxbylen en 100 parrangs......... 100 metselaars houwelen en 32 ysere schoppen ( in 4 kassen; 24 stuex draygudsen.... .... ........  me  5 kassen met divers timmermans en kuypers gereetschap ; BO kippen hennippe lont; 2 vaten Hollantse spykers ; 1 vat Hollantse en 4 potten Bengaalse boter; 2 halfamen olyven oly; 10000  buscruyt; 1 vat met kruytmaten, draagbanden, 2 trommels, etc. ; 5 kisten met medicamenten en 1 kasje met eenige schenkagie goederen voor Radja Palacca, in syn brief, op 24 January afgegaan, gespecificeert, kostende samen 70819: 16: 14.  Google 
1675	1675	wu.89105697205-seq_0042.txt	356  25 JANUARY.  capitayn belooft ende den grooten Godt tot getuygen aangeroepen hadden, datse voortaan het contract tot den laatsten dagh toe getrouwelyk souden onderhouden, begeerende, soo iemant ter contrarie dede, dat Godt haar en haar lant woude straffen, waarop de Gouverneur Generaal ende de Raden van India haar dan oock sullen verlaten; maar, gelyek wy in onsen brief aan den Conink van Bima en Turilia Gampo geschreven hebben, soo syn wy al vry wat verwondert, dat de Koningen van Bima, Dompo en Tambora den capteyn, Jan Francen, in de pagger op Sumbawa gantsch geen adsistentie hebben beweesen en dat deselve daarin ten laatsten t'eenemaal is verlaten, dat soodanigh niet en hadde behoort; want hy die pagger aldaar op ’t versoek van de Coningen en tot bescherminge van het gemeene beste hadde opgeregt; en sal ons de tyt nu moeten leeren, hoe het daar verder mede sal afgeloopen wesen en of de capteyn met het scheepje, door den president van Macassar na Sumbawa gesonden, met syn volck weder na Macassar geretourneert sal syn, mitsgaders ook of de grooten van Sumbawa eenen nieuwen Conink verkoren en het contract, op Macassar gemaakt, te samen aangenomen sullen hebben om alsoo de Macassaarse roovers mede te helpen vernielen, indiense op het lant van Sumbawa iemant eenigh gewelt of overlast wouden aandoen, waartoe de volekeren van Bima, Dompo, Tambora en Sumbawa overvloedigh sterk genoegh syn; en soo al die van Sumbawa het met de roovers moghten blyven houden, soo kan het de drie andere voleken aan geen magt ontbreeken om hun luyden naar behooren te straffen en tot reden te dwingen, alsoo oock eenige grooten van Sumbawa die van Bima en Dompo toegenegen syn, als de een den anderen maar getrouwelyek bystaat; want het de Comp niet altyt gelegen komt ecnige maght tot adsistentie uyt te senden.  Evenwel hebben de Gouverneur Generaal en Raden van India voor jegenwoordigh goetgevonden 5 jaghjens en 5 kloecke chaloupen, wel gemonteert, af te steeken, die langs de Javaanse cust door de straat van Madure naar lant van Sumbawa sullen zeylen om de rovende Macassaren alle mogelycke afbreuk te doen en, soo ’tnoodigh is, onse bontgenooten op Sumbawa tegen deselve te beschermen, gelyk wy daarvan in onsen brief aan den Conink van Bima en Turilia Gampo in ’tbreede hebben geschreven en in dien brief osck beantwoort al, het geene de Koningen van Bima, Dompo en Turilia Gampo in een aparten brief hebben voorgedragen; en daarenboven door den Bimanesen sabandhar, Codja Roubou, noeh mondelinge laten seggen, welcke den Konink van Bima Radja Dompo wel sal konnen bekent maaken ; en dient oock sorge gedragen te werden in ’tlant van Dompo een goede parthye sappanhout te vervaardigen en gereet te houden tegens de komste van ’tschip, den Hannibal, opdat het daarnaar niet langh en behoeft te waghten.  Wat nu aangaat het verschil, dat ’er is tusschen de Koningen van Dompo en Tambora, de Gouverneur Generaal en Raaden van India hebben  Original from  pigkized by (SOC gle                     UNIVERSITY OF WISCONSIN  mement  
