start_year	end_year	File	Text
1675	1675	wu.89105697205-seq_0015.txt	6 JANUARY.                             9  dessave van Mature op 'teylant Cheylon, aan haar Ed overleverende een paquet Cormandelse papieren van den heer gouverneur, Anthonio Pavilioen, en raat, waarvan de missive zy gedagtekent 6 October uyt de veroverde stadt S'. Thomee, doch met een nader appendix van den 9de de. uyt Palliacatta, wanneer S'. Thomee na de gelegentheyt der saaken by ons volck wederom geheelyck was verlaten ende aan de Mooren t'eenemaal ingeruymt, als nader by ’taankoment briefboek daaruyt zy te sien.  Ende bestaat de Cormandels retour ladinge deses bovengenoemde fluyts uyt:  355 packen diverse sorteringen cleeden ;  20 met rochevellen;  5000 stucx arduyne vloersteenen ;  2450  karkay ip 16 goeny sacken ;  285 gom van balanga boomen;  100 maten boonties oelonde in 2 sacken ;  ilem ook 5 kassen met verscheyde Cormandelse en ook een  groote kas met Mallabaarse secretarie papieren, buyten die monterende dat cargasoen f 158619:15:5.  Buyten welk bovenstaande uyt ’tschip, de Geregtigheyt, en andere bodems in dese fluyt, Cattenburgh, voor S'. Thomee syn overgescheept en daarmede alsoo hier overgebragt de navolgende Persiaanse goederen, soo voor Batavia, als Malacca, gedestineert :  500 packen Persiaanse zyde;  5 met alcatyven;  2 houte kisiens met Persiaanse fluweelen ; 118 kassen met Chirase Persiaanse wyn ; 155 rooswater;  60 packen van goeny met amandelen ;  15 met leer;  19 potten en 15 kisten met rosynen ;  22    12     kismis;  5 10 pistasies;  24 met swarte pruymen;  17     haasenooten ;  5  ockernooten;  1 pot abbricoosen ;  1 kasie met confituren ;  6 goeny sacken met roode aarde;  17 kassen met divers aardewerck ;  2 kisies met medicamenten;  2    thuynzaaden, ete, ter somma van f ...;  item als voren, nu noch van Jaffanapatnam uyt d'fluyt, Vederhorst, overgescheept becomen : 52 packen geschilderde Jaflanapatnamse doeken, ten kosten van f 25715:15:1,  Google 
1675	1675	wu.89105697205-seq_0001.txt	Digitized by Google  Original from UNIVERSITY OF WISCONSIN 
1675	1675	wu.89105697205-seq_0029.txt	17 JANUARY.                            23  wy versoeken, dat noch op geleth mag werden, hebbende uw hoogheyts capteyn van de Xulas daarin sonderlinge niets verright, dat wy anders hadden verwagt; voorts vertrouwen wy, dat de Gorontalers en Bangayers voortaan wel wat gemackelyker en onderdaniger sullen wesen, alsoo die van Mandhaar haar ’tverleden jaar op Macassar in ’tcasteel Rotterdam mede voor de Comp verootmoedigt hebben en sulx ook tot bontgenooten in ’talgemeen contract syn aangenomen gewerden, soodat zy aan die van Mandhaar nu geen heul meer sullen konnen soecken.  Wy hebben wel gelesen, tgeen de Conink van wegen intche Tay in synen brief aan ons geschreven heeft, maar wy hebben van die saack gantsch geen kennis ende, dewyle deselve in de swaare besoekinge des Heeren over de landen van Amboina mede wegh geraackt is, zoo en konnen wy geen ondersoek daarna laten doen; andersints en souden wy de onderdanen van de Comp, die van uw hoogheyt qualyk en ’t syner oneeren yets spraaken, naar haare verdiensten niet ongestraft laten, dat syn hoogheyt sich wel versekeren magh, alsoo wy dat niet en souden willen verdragen, gelyck wy vertrouwen, dat de Coninck ’tselve in ’treguard van de Comp onder syne ondersaten mede niet en soude begeeren te gedoogen.  De goegoegoe, d'Jepelauw, en is van Bouton hier niet verschenen, vermits hy naar Pinonco was gegaan om dat eylant weder onderdanigh te maaken, synde Lahassa en Bongeporre wel op wegh naar herwaarts geweest, maar door contrarie wint weder terugh gekeert, soodat de Konink ende de grooten aan ons verleden jaar hebben afgestiert den capteyn, Cammadjouga, die over weynigh daagen weder naa huys gekeert is; wy wenschten wel, dat uw hoogheyt en die van Bouton wat beeter over een komen en wegen de saaken van Woena en Lohia op Pantchiano bequamer accorderen konden, synde het al een groote boete van 200 slaven, die wy verstaan, dat capteyn, Goffela, met de Xulas hongie, door tusschen spraake van de Boutonders tot nederlegginge van den aangevangen oorlogh, daar van daan voor uw hoogheyt medegevoert heeft, dat ons alwat vremt is voorgekomen; terwyl wy bevorens geen kennisse hebben gehad, dat uw hoogheyt naar derwaarts sulcken oorlogsbesendinge doen soude, connende uyt sulcke kleene beginselen somtyts een groot vier ontstaan; doch wy willen verhoopen, dat het hier met gedaan sal syn; uw hoogheyt believe ons eens te laten weten, wat de eygentlycke oorsaake van dese besendinge zy geweest, schynende Lim Manipa aldaar een schadelyck man te wesen en altoos genegen tot onrust.  Van de Zaleyeresen ende ook van uw hoogheyts pretentie op die van Macassar sal de president, Harthouwer, schryven; uw hoogheyt behoorde waarlyck sich wel te vergenougen met de devoiren, die door denselven op onse ordre werden gedaan, gelyk wy ook verleden jaar hebben geschreven, komende verscheyde woorden in uw hoogheyts brief ons soo duyster te vooren, dat wy deselve niet en konnen begrypen en verstaan; doch kan de Konink wel versekert en daarin gerust wesen, dat, al schoon hy veel schelmen  Google 
1675	1675	wu.89105697205-seq_0217.txt	3 AUGUSTUS,                                209  door UEd gewoonelycke goetheyt, UEd ’tselve ons sullen vergeven; en indien het niet door goet beleyt en wysheyt van ’topperhooft was geschiet geweest, soodanige wercken souden alhier swarigheyt kunnen veroorsaakt hebben; hy heeft padie alhier uytgedeelt om te planten en die het versoghten heeft hy deselve sonder betalinge gegeven; wy kunnen ook dit verhaal niet verswygen, dierhalven maaken wy ’tselve aan den heer Gouverneur Generaal en de Raden van India bekent, dat voorleden jaar de onderkoopman en tweede alhier, Sr. Reynhout Wagenburgh, ten tyden wanneer ’t opperhooft hem heeft gesonden na Batnoumien met sekeren brief van inhout, dat capteyn Moor, Anthonio Hornay, aldaar met den Coninck van Amarassy soude komen, soo niet, dat hy hem soude laten roepen, opdat wy gesamentlyk vreede souden maaken onder de Comp, maar voor dien tyt isset niet geschiet, omdat de capteyn Moor en de Conink van Amarassy niet waren verschenen ; dierhalven hebben wy met onse wapenen stil geseten en op vreede gehoopt, maar de volckeren van Amarassy syn dick wyls ’s nagts als schelmen gekomen en 2 5 van ons volck dootgeslagen en haar hoofden afgehouden en medegenomen ; doen ter tyt heeft het meeste volck van ons de pockjens gehadt, maar nu ter tyt hout die siekte op en wy hebben veel volk verloren; dierhalven hebben wy hier nu weynigh volck.  Verder heeft ’topperhooft en de raadt alhier goetgevonden een van ons volk, nevens de nieuwe tweede persoon, St. Pieter van der Hoeffen, als gesanten naar Liffauw te senden om andermaal aan den capteyn Moor te vragen, of de voornoemde Conink van Amarassy genegen was vreede te maken of niet; maar de capteyn Moor, Anthonio Hornay, heeft ’er niet eens willen naar luysteren en ’t volck van Amarassy, die doen ter tyt tot Liffauw waren, hebben ons volck ook niet willen spreeken ofte sien, waaruyt wy klaar konnen sien, dat de Portugesen niet genegen syn met ons vrede le maaken ; en van wegen de moordenaars en ’tvolk van de plaatse Timo, op ’t eylant Savo, die den onderkoopman, Sr. Wagenburg, nadat door storm aldaar met syn volck was aangekomen, hebben vermoort, niet alleen syn volck, maar noch seventien van onse drie geslagten, te weten: Amassako en Amassakatty, 2 groote tommongons van Coupang, Amatebet, soon van Anthamannana, veltoverste van de Sonnebayers, Amacabo, soon van Amatara, veltoverste van de Amabier, en noch derthien groote en kleene volckeren, die met haar vertrocken waren, en syn gesamentlyk met Comp’ volk dootgeslagen; dierhalven versoeken wy geer ootmoedigh en nedrigh aan den heer Gouverneur Generaal en Raden van India, dat gelieven eenige magt van soldaten, schepen en chialoupen aanstaande jaar herwaarts te senden om de helft van ons volck met deselve magt over te voeren en de plaatse Timo op 'teylant Savo te ruineren, om alsoo revengie van die moordenaars te nemen, die de Hollanders en ons volck vermoort hebben, gelyk wy voor desen aan ’tvolcek van Rotty mede gedaan hebben, opdat ook door die maght onse vyanden van Amarassy moghten verschrikt en tot vrede gebragt werden; en om te bethoonen onse  DAGH-REGISTER ANNO 1675,                                                        14  Google 
1675	1675	wu.89105697205-seq_0203.txt	23 JULY.                                 195  200 beslagen schoppen en 100 spaden; 209 heele en 100 halve piecken; 50 stucx diverse gieters; 10  visch zegens; 601 baalen divers gesorteert zeyldoek ; 8 stucx masthouten ; b tonnen wit zout en 4 vaten kryt; 50 Hamburger en 25 Koninxberger planken; 100 balkdeelen, 150 kropravens en 200 sparren; 100 heele en 50 halve legger schooven ; 5 stucx sware en 2 cabeltouwen en 1 paardelyn; 1 stagh, 3’reeps en 4 stucken want; 22 ysere en 18 wieltrossen ; 680 bossen huysingh en 680 bossen marlyn; 1000 strengen zeylgaren ; 400 stucx oorysers tot degens; 104 botteliers pompen ; 75 riemen divers schryfpapier in kassen; 1 kas met 40 stucx diverse lampen ; 25 ysere ketels en 10 aackers en 10 dooppannen; 100 spitse ysere spaden ; 1 vat met 500 ysere schoppen, houwelen en koxbylen ; 1 timmermans en metselaars gereetschappen ; 1 allerhande timmermans gereetschap, als voren, in ’t geheel monterende f 145595: 15; 6.  De advisen, met dese 2 laatstgenoemde schepen uyt het Patria gebragt, syn al vry out, van Augusty anno voorleden.  En de missive van den heer gouverneur, Isbrand Goske, en raat der Caap de Goede Hoop, dubbelt becomen, gedateert 4 April laatstleden, met verscheyde bylagen, daartoe gehoorende, en sodanigen teneur, als uyt ’taankoment brief boek kan werden nagelesen; sprekende onder anderen van de verlossinge des gemelten heer gouverneur, Goske, door de heeren mayores naar ’t Patria; en haar Ed weder verkiesinge van den Ed Joan Bax (present commandeur der stadt en landen van Gale) tot gouverneur aan deselve Caap.  Gisteren avont, naar ’tordinary gebeth, is by haar Ed (op ’t aanschryven der heeren mayores, daags te voren per ’tschip Sumatra ontfangen) verstaan den Ed heer, Constantin Ranst, als ordinary raat in Raade van India sessie te geven en dat naast aan d’Ed heer, Cornelis Speelman.  Ende wyders ook heden by ordinary vergaderinghe op de klagten en vertoningen van verscheyde paghters, datse om de rys dierte en soberen aanbreng vry wat te kort schieten, geaccordeert, die van d'aankomende suykerpagt, als die van de vischmarkt, ieder voor eerst 2 maanden te borgen (doch die van de rysmarkt ende de waagh noch t’eenemaal uyt te stellen) tot het eynde van ’t jaar.  Google 
1675	1675	wu.89105697205-seq_0363.txt	31 DECEMBER.                          5t  15 stucx vaartuygen, per transport.  2 vaartuygen van Singenap met 9 mannen, 1', last rys, 2 lasten groene cadjang, 2000 stucx suyker catoepa, 500 stucx steenbraesems, 20 potten oly en 1200 stucx oude clappus.  9 van Sombaar met 41 mannen en 21'f, lasten rys.  1 20  ts  (5  20  Eek jk  1  Grissee met 4 mannen en 4 lasten rys.  Cheribon met 80 mannen, 16 lasten rys, 155 picols en 6 cattys peper, 2400 bossen pady, 90 potten oly, 50 canassers witte suyker, 150 korven swarte suyker, 10000 stucx suyker diringo, 2000 stucx suyker gadja, 100 stuex rysmanden, 20 huyden soolleer, 50 stucx buffelshuyden, 200 bossen tamarinda, 4 canassers ajuyn, 100 stucx aarde tresellen en 28000 stucx arax pullekens.  Tegaal met 104 mannen, 60 lasten rys en 5200 bossen pady. Zedayoe met 16 mannen, 28 lasten rys en 15 lasten zout. Javana met 50 mannen, 1', lasten rys, '), last swarte boontjes, 100 bossen pady, 20 korven candy suyker, 118 korven witte suyker, 5800 stucx suyker jaty, 500 potten met suyker, 8 potten met oly en 200 stucx balcken,  Pamanoekan met 8 mannen, 1 last rys, 110 korven witte suyker, 30 stucx balcken en 50 stucx planken.  Japara met 12 mannen, ', last rys, 20 korven swarte suyker en 500 stucx suyker jaty.  Packalongen met 79 mannen, 55', lasten rys, 2100 bossen pady, en 50 stucx balcken.  Rimbangh met 16 mannen, 6 lasten rys, 10 korven witte suyker, 300 stucx suyker jaty, 250 stucx planken, 180 stucx balken en 6 stucx knieshouten.  Pamalangh met 16 mannen, 6 lasten rys en 200 bossen pady. Barbos met 20 mannen, 7', lasten rys en 500 bossen pady. Chiassem met 16 mannen, 2 lasten rys en 1500 bossen pady. Surabaya met 12 mannen, ', last rys en 125 potten oly.  Sumor met 4 mannen en 500 bossen pady.  Malacca met 6 mannen, 56 corgie tapechindos, 26 corgie tapesarassen, 10 corgies tapetelpocans, 22 corgies committers, 5 corgies cambayen en 2 corgies ramboutyns.  Jamby met 205 picols peper en 2 picols loot.  Sumbawa met 12 mannen en 10 stucx slaven en slavinnen. Lassam met 4 mannen en 70 stucx balken.  Palembangh met 28 mannen, 5029 picols en 88 cattys peper, 20 corgies tapechindos, 2 corgies moerissen, 2 picols amphioen en 15 lasten tarwe.  Bima met 4 mannen en 250 picols sappanhout.  129 stucx vaartuygen, die transportere,  Google 
1675	1675	wu.89105697205-seq_0377.txt	REGISTER VAN PERSONEN- EN PLAATS-NAMEN.  3569  C.  Caeff (W.), 6, 8, 12, 1416, 25 27, 49, 67, 68, 80, 85, 86, 9295, 105, 116, 120, 1235, 154, 149, 157, 162, 175, 184, 185, 196, 198, 200, 227, 247- 249,  251, 257, 259, 266, 282, 285, 286,  299, 505, 517, 535, 542, 546, 554.  Caesar (M.), 66, 121, 128, 172, 555 557.  Camme (J. van der), 242.  Camphuys (J.), 128, 169, 170.  Caron (F.), 216.  Caulier (J.), 7, 277, 283, 297.  Geilon, 6, 9, 25, 27, 28, 44, 45, 4749, 69, 84, 85, 106, 115, 128, 147, 148, 153, 187, 189, 196, 197, 215, 228,  247, 276, 277, 280, 281, 285, 284, 294, 298, 317, 551, 556, 544, 545, 552, 560.  Celebes, 22, 29, 50.  Ceracroux (A), 105.  Ceram, 31, 249.  Ceram-laut, 5.  Charleroy, 125, 124.  Chatip (intj), 60.  252, 254, 255, 290, 292, 325, 327, 555, 357.  China, 15, 68, 76, 85, 95, 103, 121, 145, 162, 157, 158, 173, 177, 554, 536.  Chineezen, 12, 15, 50, 82, 96, 121, 1357, 156, 249, 282, 558, 552, 558.  Chinsjioe, 121, 157.  Claessen (B.), 17, 153.  Clant (J.), 60, 157, 222, 286.  Cochin-china, 545.  Concordia (kasteel), 186, 207, 210, 504.  Cops (J.), 155, 250.  Cornput (W. van), 19, 28, 72, 185, 211, 215, 224, 248, 264, 265.   Coster (G.), 28, 29, 164, 166, 167, 182,  269, 275.  Coulster (J. van), 96.  Couper (J.), 107110, 116, 117, 137, 158, 149, 150, 160, 161, 165, 169, 183, 185, 187, 190, 197, 211, 214, 225, 229, 242, 247, 250, 252, 258, 260, 262, 279, 285, 289, 296, 299, 303, 325, 550.  Couwenburg, 351.  Cheribon, 62, 64, 75, 77, 97, 98, 111, ' Coyet (F.), 249. 113, 159, 141, 175, 178, 202, 203,  Gracouw (G.), 155. Ei me  Dacres (H.), 117, 129, 198, 282, 500, 305, 531, 552, 3525b4.  Daguiar (B), 108, 109.  Dam (J. van), 559.  Dame (H.), 199.  Damme, 149.  Danisborg, 318.  Deenen, 12, 67, 68, 73, 80, 95, 109, 158, 173, 249, 257, 282, 505, 3517, 554.  Delft, 48, 57, 58, 149, 151, 200, 218, 221, 310, 315, 520, 552. DAGH-REGISTER ANNO 1675,  215,  Google  Deli, 52, 255.  Demak, 52, 54, 77, 82, 89, 108, 111, 118, 119, 158, 140, 141, 163, 176, 178, 202, 203, 225, 252, 242, 252, 253, 255, 279, 290, 292, 525, 527, 556, 557.  Denee (J.), 158.  Denemarken, 62, 65, 67, 68, 80, 85, 149, 518, 556, 543, 347.  Deneyn (P.), 224, 525.  Diemen (A. van), 91, 101.  ; Diestpoort te Balavia, 45, 56, 79, 96, 99, 24 
1675	1675	wu.89105697205-seq_0388.txt	380                REGISTER VAN PERSONEN- EN PLAATS-NAMEN. Voorde (P. van de), 159. Vos (S.), 68. Voorhout (J. D. van), 226.             Vosburgh (G.), 147. WW.  Wagenburgh (R.), 209.               Wingurla, 28, 154, 245, 246, 281, Walle (A. van der), 126.                294, 545. Wangsa Pati, 517.                 ' Wira Sitsia, 524.     Prana, 165.                Wirat Karti (kia), 109. Ward, 547. Maka, 104, 105, 108, 109, Warden (G. S. van), 28.             1358, 162, 165, 185, 225, 242, Waterpoort van het kasteel Batavia, 148,    252, 260, 286, 524, 550.  506.                           Woena, 25. Weede (A. van), 106. (radja), 215. Werf (A. van der), 47, 49.            Wyckersloot (J. van), 28, 186, 207, West-Vriesland (punt), 45, 560.       555. Wielingen (de), 219.                Wynants (J.). 159, 286. Wigmans (A.), 281, 294.             Wyns (J.), 60. Willougby (A). 197-200, 227, 285,  Wys (A), 6, 105, 157, 145. 159,  551, 543, 5525b4.              "529, 550.  Ee  Y (R. H. van ’), 155.                Ysbrantsz (H.), 91, 212, 265, 266. York (hertog van), 196.  Zi. Zeeland, 45, 46, 48, 49, 57, 58, 80, 81,  Zuid-Ooster eilanden, 149.  110, 187, 192, 200, 215, 218, 219, 27, 296, 510, 512, 515, 520.  Google  284,  118, 250,  3504, 
1675	1675	wu.89105697205-seq_0161.txt	7 en 8 JUNY,.                           153 tot weesmeesteren :  dE. heer Laurens Pit, ordinaris Raat van India, by twaalf jarige continualie tot president;   Isaacq Svolmans als vicepresident  Adriaan van Nieuwelant....... f  Pieter Elmers... ......-  is  Jacob van der Meersche  Adriaan van Beekum, gecontinueert en  Bartel Claassen, nieu verkoren ;  Sr. Cornelis Moll, secretaris ;  mede gecontinueert ;  nieu verkoren ;  tot commissarissen der houwelyxe en kleene saaken :  d'E. capteyn, Isaacq de Saint Martin, als tel  Sr. Govert Gracouw...-.  EEEN KEN  Joannes Putmans..........-gntdiate,k....--.- (alle gecontinueert;  Jacob Does.........-.-Varan eldersed  Joannes Dinkels ............e..-veer eenen:   Johannes Lutgens, secretaris ; tot boedelmeesters van Chinese sterfhuysen :  de coopman, Sr. Daniel Parve.    .  St. Dionys Kelck.........---- Beelen, en uyt de Chinesen:  Lunsaqua, gecontinueert en  Tsoa Wanjock, nieu verkoren ;  Thomas Engels, secretaris ;  tot regenten van ’t vrouwen tughthuys:  capteyn, Jan van Aaldorp.. Re: Roelof Hendrixe van LY... gecontinueert;  tot regenten van ’t Lasarushuys:  capteyn, Didelof van der Beeck, gecontinueert en Sr. Aarnout Mennes, nieu geligeert. 8 d’. ’sMorgens al tydigh verschynt hier uyt Suratta ’tschip, Pouleruu, inhebbende: 268 packen diverse sorteringen Suratse cleden en doecken; 20 blasen met 1380  geconfyte mirabolanen;  Google 
1675	1675	wu.89105697205-seq_0175.txt	25 JUNY.                               167  Comp, derhalven stellen wy ons onder de Comp; dit is ’t geene gepasseert is; en ons volk is vervaart in de stadt te woonen en begeven haar naar ’tbosch om haar woonplaats te nemen en verre van het quaat doen te wesen; verders het contract schrift, dat de sabandar gebragt heeft, is ons niet ter hant gestelt, maar tot noch by capteyn, Jan Francen, verbleven.  Voor dees tyt hebben wy aan de grooten tot Batavia niet te senden dan wenschen haar een lank leven en veel geluk in dese werelt, nevens onse hertelyke groetenisse.  Geschreven op ’tlant van Bima den 20en dagh van de maant April,  Van Radja Dompo. Een groetenis van Radja Dompo.  Dese brief wert geschreven uyt een opregt herte en genegentheyt aan myn vrunden, den Gouverneur Generaal ende de Raden van India, die groot syn op ’tlant van Batavia; Godt geve haar een lank leven en dat haar naam boven en benedens wints seer groot en geroemt magh werden, want in desen tyt heerschers syn, soo te water, als te lande.  Verders, wanneer de brief, dien schipper Coster gebragt heeft, op den zien dagh van de maant April tot Dompo gekomen was, hebbe myn vernedert en denselven met seer groote eere en vergenoeginge ontfangen, waaruyt Radja Dompo de meeninge en 't gevoelen van den Gouverneur Generaal ende de Raden van India wel heeft verstaan; en hebbe ook van alles wel kennisse, tgeene in den brief, dien schipper Coster gebragt heeft, was geschreven.  Daarnaar is schipper Coster door capteyn, Jan Francen, naar Dompo gesonden om het gewapende volck van Dompo te roepen en naar Sumbawa te brengen; doen ter tyt is de coopman, de Bock, gekomen en heeft geseyt, dat ick sappanhout soude haalen; dierhalven ben ick niet naar Sumbawa vertrocken, maar gesonden om sappanhout te haalen; en is doen naar gissinge gebragt 700 picols en daarna noch meer doen haalen en gewacht, datter een schip soude komen.  Verders hebbe ik van den coopman, de Bock, in cleeden 505 rd genoten, die de grooten op Batavia aan hem gelieven te betalen; en de waarde van het na zappanhout versouke ick aan de grooten tot Batavia, in ryxdaalders magh voldaan werden; noch maake ik aan de grooten bekent van wegen de plaatse Pikar, als dat capteyn, Jan Francen, die volekeren tot hem geroepen heeft om haar met die van Tambora te vergelycken; en als het soo sal gaen, sal ik gebrek van volck hebben, want voor desen hebben die van Tambora onder myn gestaan; dierhalven versouke ik hulpe aan den Gouverneur Generaal ende de Raden van India, omdat van de plaatse Fickat ten tyden, wanneer ik op Coree ben geweest en met capteyn, Jan Francen, aldaar geraatslaagt, heeft doen van de plaatse Fikat niet gesprooken,  Google 
1675	1675	wu.89105697205-seq_0149.txt	31 MEY.                                 141  10', lasten zout;                       4 picols annys Java: 11 groene cadjang;             40 corven candy suyker; 5 swarte boontjens;         1090 korven witte poeyer suyker; 500 bossen rotlangs;                694  swarte suyker; 15560 pady;              10 met allerhande verwe en 2500 gomoet touw;               7 Chinese toebacg.  5000 stucx gesoute herders;  Daarentegen syn wederom naar de onder gespecificeerde plaatsen vertrocken een aantal van 62 stucx groot en kleene vaartuygen, namentlyk: 2 vaartuygen naar Catouwen met 1500 rd aan kooper en 60 rd aan cleeden ; 6 naar Palembangh met 1880 rd aan kooper, 50 rd aan ysere pannen, 255 rd' aan cleeden, 40 rd aan porceleynen en 2500 rd' aan contanten ;  Dermayoe met 152 rd’ aan cleeden;  de cust van Java met 100 rd" aan contanten en 160 rd aan cleeden ; Damacq met 120 rd aan amphioen en 20 rd: aan cleeden;  Grissee met 200 rd aan amphioen, 126 rd" aan porceleynen, 18 rd aan oud yser en 15 rd aan quitasollen; 2  Packalongen met 4 rd aan cleeden; 1  Chiassem met 20 rd’ aan cleeden; 2  Zurabaya met 220 rd aan cleeden; 3  Japara met 230 rd aan amphioen, 20 rd aan cleeden en 105 rd' aan benjuwin; 1  Pamalangh met 25 rd: aan cleeden en 80 rd aan kooper; 4  Zamarangh met 68 rd aan oude kooper, 120 rd’ aan amphioen en 785 rd aan cleeden; 2  Caliwongen met 151 rd aan cleeden; 6  Cherihon met 588 rd aan cleeden, 50 rd aan oud yser, 60 rd aan amphioen, 200 rd aan kooper en 40 rd' aan porceleynen; 1  Rimbang met 12 rd aan oud yser; 1 Atchin met 1065 rd’ aan porceleynen, 45 rd aan oud yser en 50 rds aan oud kooper; 12  Tegaal met 765 rd: aan cleeden; 1  Cadoes met 22 rd: aan benjuwin; 5  Sombaar met 212 rd’ aan cleeden en 80 rd aan amphioen; 1 Banjer met 20 rd aan cleeden, samen 62 vaartuygen, in ’'tgeheel van hier vervoert hebbende:  LO mk OU e  15 ryexdaalders aan quitasollen ;         1271 ryexdaalders aan porceleynen ; 50     .       ysere pannen;      2400     . contanten; 98 oudt kooper;       5595     " cleeden en 125     .    yser;         5660       staafkooper; 127      benjuwin;            somma 11951 ryexdaalders, 810            .              amphioen,;  Google 
1675	1675	wu.89105697205-seq_0148.txt	140  31 MEY.  154 stucx vaartuygen, per transport. 14 vaartuygen van Damacq met 57 mannen, 34 lasten rys, 250 bossen  pady, 100 stucx buffelshuyden, 500 stucx plancken, 20 korven witte suyker, 2 lasten zout en 350 stucx swalpen.  7 van Chiassem met 27 mannen, 800 bossen pady en 1100 stucx balcken.  11  17  4  Packalongen met 42 mannen, 100 stucx aarde potten, 570 slucx potten en tresellen, 31 potten met olie, 19 lasten rys, 700 bossen pady en 2000 stucx gesoute eyeren.  Javana met 22 mannen, 38 potten oly, 350 potten om bloemen in te planten, 4 lasten rys en 70 korven wilte suyker.  Cadoes met 4 mannen en 60 korven witte suycker.  Rambang met 45 mannen, 9'f, lasten rys, 860 stucx buffelshuyden, 80 korven bruyne suyker, 195 korven witte suyker, 80 picols sappanhout, 4 korven candy suycker, 50 stucx plancken, 1 masthalck en 10 korven met swarte suyker.  Japara met 78 mannen, 18, lasten rys, 76 potten met olie, 285 korven swarte suyker, 560 korven witte suyker, 56 korven candy suyker, 4 picols anys Java, 4000 bossen pady, 1000 bossen gomoet touwen, 140 stucx balcken en 200 stux plancken. Dermayoe met 16 mannen, 1200 bossen pady, 2 potten met olie, 6 lasten rys en 250 stux hoenders,  V'samen 225 stucx diverse groot en kleene vaartuygen, dewelcke generalyk alhier aangebragt hebben de ondervolgende coopmanschappen, provisien en andere  whaaren: 1 vat met rassemalo;                 1000 stucx arax pullekens; 1 potloot;                    50 aarde foegans ; 27 sacken met zeekroos;               550 hoenders; 1 goeny sack, met poetsiock ;            6000 pees pada; 2 sacken met medicinale wortelen;      6500 oude clappus; 5 tarwe;               105000     pinang; 14 potten met blauwe verwe;           500 steenboxvellen; 4420 stucx potten en tresellen ;          1000 hertevellen;. 200 potten met kalck;                   2970 buffelshuyden ; 10     gesoule garneelen;        4700 duygen; 817 olie;                     50    swalpen; 180 picols sappanhout ;                   1240 balcken; 80 picols cattoen;                      1450 plancken; 2 packen cattoene gaaren ;               1 mast balck; 2852 picols en 60 cattys peper;           2000 stuex gesoute eyeren; 6  ajuyn;                      550 aarde bloempotten; 17 toebacq Java;                 100     passos; 8    cabiry;               51 slaven en slavinnen; 16 wax;                       259', lasten rys;  Digitized by GO   gle  Original from  UNIVERSITY OF WISCONSIN 
